,project_link,title,description,card_category,amt_raised,days_left
417,https://www.indiegogo.com/projects/roc-a-vee-evolution-in-motion--3/pica,Roc-A-Vee Evolution In Motion,Evolutionary transformation of the stroller and swing industry through smart technology,Productivity,"$1,470 USD raised 1%",Ended
418,https://www.indiegogo.com/projects/the-jumper-app-the-uber-of-roadside-assistance/pica,The Jumper App : “The Uber Of Roadside Assistance”,"Welcome To The Jumper App,  Where On Demand Roadside Assistance is Actually A Thing.",Productivity,$0 USD raised 0%,Ended
419,https://www.indiegogo.com/projects/stero-the-3-second-laptop-sleeve-stand/pica,STERO: The 3-Second Laptop Sleeve Stand,The Most Convenient Way to Finish Work: in only three seconds!,Productivity,$0 USD raised 0%,29 days left
420,https://www.indiegogo.com/projects/ara-app-see-car-parts-on-any-vehicle/pica,ARA App - See car parts on any vehicle,A mobile app using augmented reality to see car parts on any vehicle before buying.,Productivity,$0 USD raised 0%,29 days left
421,https://www.indiegogo.com/projects/monday-entrepreneur-s-notebook/pica,monday. entrepreneur's notebook.,monday. entrepreneur’s notebook: a perfect tool to help your business ideas become a reality.,Productivity,"$3,166 USD raised 40%",Ended
422,https://www.indiegogo.com/projects/hologram-market/pica,Hologram-Market,"We connect the hologram with e commerce for a new industry
like the internet in the beginning",Productivity,€0 EUR raised 0%,Ended
423,https://www.indiegogo.com/projects/there-are-bots--2/pica,There are BOTs!,"First there were Websites,  then there were Mobile Apps….  Now, there are BOTs.",Productivity,$0 USD raised 0%,Ended
424,https://www.indiegogo.com/projects/ratherboard-one-name-three-different-devices/pica,"Ratherboard: One name, three different devices","Original Ratherboard, new Ratherboard Embedded and new Ratherboard Battery Management System.",Productivity,$239 USD raised 2%,Ended
425,https://www.indiegogo.com/projects/pinnacle-deal-engine-for-business-buyers-sellers/pica,Pinnacle Deal Engine for Business Buyers & Sellers,"Multiple business valuation methods, deal evaluation, financial projections & what-ifs, integrated!",Productivity,$0 USD raised 0%,Ended
426,https://www.indiegogo.com/projects/shanaca-social-networking-credit-rating-sellers/pica,Shanaca : Social networking credit rating sellers,We want to change the world through social networks to share business cards Shanaca.,Productivity,$0 USD raised 0%,Ended
427,https://www.indiegogo.com/projects/nixpod-linux-pc-with-4k-ultra-hd/pica,Nixpod Linux PC with 4K Ultra HD,"A perfect device for your Productivity, Development and Home Networking needs.",Productivity,$0 USD raised 0%,Ended
428,https://www.indiegogo.com/projects/easyssd-giga-speed-portable-ssd-case-easycable/pica,EasySSD: Giga-speed Portable SSD Case & EasyCable,"SSD Case, Tool-free Installation, Vent Heat Dissipation, Support PC/Mac/Android/iPad Pro.",Productivity,$0 HKD raised 0%,Ended
429,https://www.indiegogo.com/projects/web-design-platform-for-non-programmers/pica,Web Design Platform For Non Programmers,"A  Design Tool for folks without any programming experience, and who have no interest in coding.",Productivity,$0 USD raised 0%,12 days left
430,https://www.indiegogo.com/projects/mo-tactic-edc-battle-pen/pica,Mo-Tactic EDC Battle Pen.,Featured Machine Gun Barrel Style Urban Every Day Carry Tool.,Productivity,"$3,061 USD raised 102%",Ended
431,https://www.indiegogo.com/projects/megafresh-makes-food-social/pica,MegaFresh Makes Food Social,Experience the revolution in grocery shopping. Interact with & buy direct from farmers and producers,Productivity,$0 USD raised 0%,Ended
432,https://www.indiegogo.com/projects/bitcoin-machines-fund/pica,Bitcoin Machines Fund,We will built 5400 Bitcoin to generate 1000 bitcoins and split with sponsors,Productivity,$0 CAD raised 0%,Ended
433,https://www.indiegogo.com/projects/eve-app-for-women-employment--3/pica,EVE app : for Women Employment,eve : it's the first Application that is totally dedicated to women employment,Productivity,$0 USD raised 0%,Ended
434,https://www.indiegogo.com/projects/beamcnc-construction-system-cnc-mill/pica,BeamCNC - construction system CNC mill,Transform lumber and aluminum square tubes into a modular system of building blocks.,Productivity,"$2,427 USD raised 5%",Ended
435,https://www.indiegogo.com/projects/the-selfieelate-app-selfie-spreading-space/pica,The SelfieElate App: Selfie Spreading Space,Get the app for selfie enthusiasts and influencers around the world,Productivity,$0 USD raised 0%,Ended
436,https://www.indiegogo.com/projects/squidget-transforms-fidgeting-into-focusing/pica,Squidget transforms fidgeting into Focusing,"It's not IF you fidget, it's HOW to immediately improve your Focus!",Productivity,$0 USD raised 0%,Ended
437,https://www.indiegogo.com/projects/infographic-creator-by-memographic-co/pica,Infographic Creator by Memographic.co,Memographic is a simple drag and drop infographic creator platform for everybody in the world.,Productivity,$0 USD raised 0%,Ended
438,https://www.indiegogo.com/projects/polycharge-the-most-versatile-power-bank/pica,PolyCharge: The Most Versatile Power bank,"Versatile, modular, and open Source power bank compatible with virtually any device you have.",Productivity,"$28,949 USD raised 41%",Ended
439,https://www.indiegogo.com/projects/shiftsearch-com-an-organized-internet/pica,ShiftSearch.com: An Organized Internet,A Global Content Library Where you can Publish your Content and Reach Worldwide Audience Easily.,Productivity,$0 USD raised 0%,Ended
440,https://www.indiegogo.com/projects/bridge--17/pica,Bridge,Get connected to your real life friends across all social media platforms with just single tap,Productivity,$0 USD raised 0%,Ended
441,https://www.indiegogo.com/projects/doorbell/pica,Doorbell,We have reworked the product and re-launched. Check out the new Flexibell!,Productivity,$0 USD raised 0%,Ended
442,https://www.indiegogo.com/projects/vkliq-smart-technology-for-networking--2/pica,VKLiQ: Smart Technology for Networking,Never Be Left Out,Productivity,$0 USD raised 0%,Ended
443,https://www.indiegogo.com/projects/pyxa-diy-game-console--2/pica,PYXA - DIY Game Console,Build your game console and create your own video games whilst learning about coding.,Productivity,£0 GBP raised 0%,Ended
444,https://www.indiegogo.com/projects/tboard-multi-touch-keyboard-mouse/pica,TBoard multi touch keyboard mouse,Desktop multi touch keyboard and mouse to increase comfort and productivity using gestures,Productivity,€276 EUR raised 6%,Ended
445,https://www.indiegogo.com/projects/graphic-vinyl-vision-new-equipment-upgrade/pica,Graphic Vinyl Vision - New Equipment Upgrade,"We want to improve our turnaround time, and new equipment would help us get products out quicker.",Productivity,$0 USD raised 0%,Ended
446,https://www.indiegogo.com/projects/remindit-app/pica,Remindit App,"Never forget anything behind again! We are here to Remindit
Free mobile App",Productivity,$0 USD raised 0%,Ended
447,https://www.indiegogo.com/projects/exciting-png-hardwood-jv/pica,Exciting PNG Hardwood JV,We have joined in a JV with a large landowner group in PNG to help them get into agriculture.,Productivity,$0 NZD raised 0%,20 days left
448,https://www.indiegogo.com/projects/aidon-t-exist-ii-nonexistent-boogaloo/pica,Aidon't Exist II Nonexistent Boogaloo,The Continuing Adventures of the Little Robot to Separate You From Your Money,Productivity,$0 USD raised 0%,Ended
449,https://www.indiegogo.com/projects/evo-virtualoffice-evolution/pica,eVO - VirtualOffice Evolution,eVO     *      VirtualOffice Evolution,Productivity,$0 USD raised 0%,Ended
450,https://www.indiegogo.com/projects/galaxytweaker-optimize-your-pc-for-gaming/pica,GalaxyTweaker: Optimize Your PC For Gaming,Revolutionizing your gaming experience. The #1 Optimization & Game Management Tool for PC Gaming.,Productivity,$0 USD raised 0%,Ended
451,https://www.indiegogo.com/projects/dogger/pica,Dogger,Dogger.agency is a website that allows you to buy or sell a dog anywhere in the world. Check it out!,Productivity,€0 EUR raised 0%,Ended
452,https://www.indiegogo.com/projects/app-for-gigs/pica,App For Gigs!,"The app is designed to find jobs for those who are self-employed,",Productivity,$125 USD raised 0%,Ended
453,https://www.indiegogo.com/projects/mease-digital-will-of-your-memories--2/pica,Mease: Digital will of your memories,Preserve memories & share your legacy. Create a digital time capsule & send messages to future gen,Productivity,$0 HKD raised 0%,Ended
454,https://www.indiegogo.com/projects/munum-personal-planner/pica,MUNUM personal planner,"The MUNUM planner helps you to accomplish your goals, manage your time and think positively.",Productivity,$0 USD raised 0%,Ended
455,https://www.indiegogo.com/projects/household-finances-at-the-glance/pica,Household finances at the glance,Managing personal finances can be challenging and tedious. Help us to succeed with Financial IQ!,Productivity,$0 USD raised 0%,Ended
456,https://www.indiegogo.com/projects/app-factory-360-launch/pica,App Factory 360 Launch,We need to train and manage people who want to make a living building affordable mobile apps.,Productivity,$0 USD raised 0%,Ended
457,https://www.indiegogo.com/projects/fidget-ki-the-mechanical-switch-key-fidget-device/pica,Fidget Ki: The Mechanical-Switch Key Fidget Device,An intuitive and discreet fidgeting solution with the precision and haptic feel of a keyboard.,Productivity,"$1,144 USD raised 14%",Ended
458,https://www.indiegogo.com/projects/glowify-find-book-top-rated-beauty-pros/pica,Glowify - Find & book top rated beauty pros,"Mobile app to easily book a hair/makeup artist to suit your style, for any occasion at any location.",Productivity,£0 GBP raised 0%,Ended
459,https://www.indiegogo.com/projects/smart-fingers-365-smart-business-application/pica,Smart Fingers 365 - Smart Business Application.,Application to help businesses manage the day to day operations and stay connected with customers.,Productivity,$20 USD raised 0%,Ended
460,https://www.indiegogo.com/projects/do-epic-happy-2018-planner/pica,Do Epic Happy 2018 Planner,LIFE IS BUSY. STOP. BREATHE... Make 2018 your BEST YEAR yet!,Productivity,£90 GBP raised 1%,Ended
461,https://www.indiegogo.com/projects/the-worcnote-multitool-notepad/pica,The WorcNote Multitool Notepad,World's first high grade aluminum multi-tool notepad.,Productivity,€0 EUR raised 0%,41 days left
462,https://www.indiegogo.com/projects/windward-hands-free-ultra-convenient-wearable-fan/pica,"Windward Hands-Free, Ultra-Convenient Wearable Fan","With Windward, a neck wearable fan, fight the heat and sweat less",Productivity,"$3,688 USD raised 7%",Ended
463,https://www.indiegogo.com/projects/scribi-writer-s-studio/pica,Scribi Writer’s Studio,The first ever smart writing platform designed with indie authors in mind.,Productivity,$870 USD raised 1%,Ended
464,https://www.indiegogo.com/projects/selfpree-change-the-way-you-work/pica,selfpree - Change the way you work,"A Handheld Mini Printer for Business Cards, Envelope Labeling, Barcodes, Coupons, Stamps and more!!!",Productivity,"€8,830 EUR raised 9%",Ended
465,https://www.indiegogo.com/projects/blank--411/pica,BLANK,.,Productivity,$0 USD raised 0%,Ended
466,https://www.indiegogo.com/projects/holographic-projector/pica,Holographic projector,"Hologram,Marketing Tool, Technology,Marketing, Inovation",Productivity,$0 USD raised 0%,Ended
467,https://www.indiegogo.com/projects/pin-pen-a-new-fast-way-of-collecting-documents/pica,PIN Pen - A new fast way of collecting documents,A magnet refillable pen which can pin documents on the reusable sticky holder.,Productivity,$319 USD raised 4%,Ended
468,https://www.indiegogo.com/projects/take-back-wall-street-investing-is-for-everyone/pica,Take Back Wall Street! Investing is for EVERYONE!,"Learn about stock and crypto for free, subscribe for strategies, picks, and more for only $5.99",Productivity,$0 USD raised 0%,Ended
469,https://www.indiegogo.com/projects/x-lapdesk/pica,X LapDesk,a multi functional workstation that maximizes your gaming experience and workflow efficiency,Productivity,€15 EUR raised 0%,Ended
470,https://www.indiegogo.com/projects/rgb-watercooling/pica,RGB Watercooling,"I want to do that, rgb custom water cooling loop..",Productivity,€0 EUR raised 0%,Ended
471,https://www.indiegogo.com/projects/fyrepad-raspberry-pi-tablet/pica,FyrePad - Raspberry Pi Tablet,A £230 Linux Tablet powered by the Raspberry Pi 3,Productivity,£40 GBP raised 1%,Ended
472,https://www.indiegogo.com/projects/your-virtual-psychotherapist-in-your-pocket/pica,Your Virtual Psychotherapist in your pocket,Take control of your entire life! Mentalico helps you to achieve perfection in your life.,Productivity,$0 USD raised 0%,Ended
473,https://www.indiegogo.com/projects/snet-mobile-app-and-website-for-the-movie-search/pica,"SNET, Mobile App and Website for the Movie Search.",A platform helping people in search of a movie or TV show according to the mood or occasion.,Productivity,$20 USD raised 0%,Ended
474,https://www.indiegogo.com/projects/the-not-so-usual-stickers/pica,The Not So Usual Stickers,Attach new pages to any spiral notebook,Productivity,£53 GBP raised 11%,Ended
475,https://www.indiegogo.com/projects/eboss-global-launch/pica,eBoss Global Launch,Workflow and Field Software. Boost your business success!,Productivity,$0 AUD raised 0%,Ended
476,https://www.indiegogo.com/projects/world-s-first-social-media-app-only-for-motivation/pica,World's First Social Media App ONLY For Motivation,Want to NEVER lose motivation? Axcender is the world's first social media app ONLY for motivation.,Productivity,$0 USD raised 0%,Ended
477,https://www.indiegogo.com/projects/kwumsy-p2-pro-multi-function-external-screen/pica,KWUMSY P2 PRO Multi-Function External Screen,World first Multi-function foldable external dual-screen for your 13.3’’-17’’ laptop or phone,Productivity,"$420,718 HKD raised 1,083%",
478,https://www.indiegogo.com/projects/dryvrs-changing-the-world-one-ride-at-a-time/pica,"DRYVRS: Changing the World, One Ride At a Time.","DRYVRS mission is to END drunk driving by providing Designated ""Dryvrs"" On-Demand from our app!",Productivity,$0 USD raised 0%,Ended
479,https://www.indiegogo.com/projects/smarter-life-decisions--3/pica,Smarter Life Decisions,"Helping you make data-driven, well-informed, smart decisions every day.",Productivity,$0 USD raised 0%,Ended
480,https://www.indiegogo.com/projects/open-source-assistant/pica,Open-Source Assistant,"Say hello to Buddy, your new assistant.",Productivity,Kr 100 SEK raised 2%,Ended
481,https://www.indiegogo.com/projects/pero-power-300-the-future-is-pero/pica,Pero' Power 300 - The future is Però!,First world's ATX power supply with integrated UPS with Li-Ion battery technology,Productivity,€0 EUR raised 0%,Ended
482,https://www.indiegogo.com/projects/mybeat-smart-music-engine-to-retune-your-brain/pica,Mybeat: Smart music engine to retune your brain,"Be more creative and enhance your productivity. No books, no long courses. Just music with purpose.",Productivity,$0 USD raised 0%,Ended
483,https://www.indiegogo.com/projects/service-bell-much-more-than-a-calling-system/pica,SERVICE BELL: Much More than a Calling System...,The World's 1st Calling System with Integrated Performance Meter for a Better Service,Productivity,€136 EUR raised 0%,Ended
484,https://www.indiegogo.com/projects/subconnect-bridging-the-building-environment--2/pica,Subconnect - Bridging The Building Environment,"A Free, Open-Ended Website, App and Software Platform to rectify collaboration in Construction",Productivity,$0 AUD raised 0%,Ended
485,https://www.indiegogo.com/projects/halo-3d-scanner/pica,Halo 3D Scanner,Cheapest 3D scanner package in the world,Productivity,£0 GBP raised 0%,Ended
486,https://www.indiegogo.com/projects/mecharm-the-most-compact-6-axis-robot-arm-does-all/pica,mechArm:The most compact 6-axis robot arm does all,"6-axis, Raspberry Pi, ROS, Lego Port, and Multiple End Actuators. Simple Programming&Blockly Control",Productivity,"$105,109 USD raised 2,102%",
487,https://www.indiegogo.com/projects/diginote-your-digital-notepad/pica,DIGINOTE - Your Digital Notepad,Yes it’s a Notepad – but a digital one. Connect it with your smart devices whenever you want.,Productivity,$330 USD raised 7%,Ended
488,https://www.indiegogo.com/projects/bitmin-bitcoin-cloud-miner-for-lifetime/pica,BITMIN - Bitcoin cloud miner for lifetime,Run your lifetime Bitcoin miner in cloud at 0 cost.,Productivity,$0 USD raised 0%,Ended
489,https://www.indiegogo.com/projects/r-k-clean-air-smart-gas-detector/pica,R & K Clean Air - Smart Gas Detector,"R & K Clean Air is a Gas/smoke/Carbon detector that features monitoring, speech alarm andFan Control",Productivity,£0 GBP raised 0%,Ended
490,https://www.indiegogo.com/projects/project-r3d-d2880-3d-printer/pica,Project R3D D2880 3D Printer,"The future of  open-source 3D printing hardware, where upgradability and ease of use come together",Productivity,$0 USD raised 0%,Ended
491,https://www.indiegogo.com/projects/owl-bbam-by-jstory-vending/pica,Owl BBAM by JStory Vending,WE OFFER A COLLECTION OF EVENT-SPECIFIC VENDING MACHINES TAILORED TO YOUR BUSINESS NEEDS.,Productivity,$0 USD raised 0%,Ended
492,https://www.indiegogo.com/projects/rock-book-revolutionary-notebook-made-from-stone/pica,Rock Book--Revolutionary Notebook Made from Stone,"Entirely made of stone paper, this notebook is waterproof, moth-proof, bleach-free and Eco-friendly.",Productivity,$0 USD raised 0%,Ended
493,https://www.indiegogo.com/projects/bulletproof-business-planner/pica,Bulletproof Business Planner,more than just a planner - it's a business coach in your pocket!,Productivity,"$2,413 USD raised 28%",Ended
494,https://www.indiegogo.com/projects/cardfundr/pica,Cardfundr,.....,Productivity,$140 USD raised 0%,Ended
495,https://www.indiegogo.com/projects/chijane-turn-your-ipad-into-a-macbook/pica,ChiJane:Turn Your iPad Into A MacBook,A Bluetooth keyboard and trackpad. It can make an iPad instantly become a MacBook,Productivity,$0 HKD raised 0%,Ended
496,https://www.indiegogo.com/projects/cleantouch-antimicrobial-door-opener-edc/pica,CleanTouch: Antimicrobial Door Opener EDC,"Avoid Direct Contact & Germ Transmission From Public Doors, Store Checkouts, ATMs, Elevator Buttons!",Productivity,€172 EUR raised 3%,Ended
497,https://www.indiegogo.com/projects/mechaclix-ultra-thin-mechanical-keyboard/pica,MechaClix Ultra Thin Mechanical Keyboard,A typewriter inspired wireless low profile mechanical keyboard built for everyone.,Productivity,€0 EUR raised 0%,Ended
498,https://www.indiegogo.com/projects/spiral-m1-startup-phase/pica,Spiral M1 - Startup Phase,An intermediary device combining the powerful capabilities of a PC with the portability of a laptop.,Productivity,$0 USD raised 0%,Ended
499,https://www.indiegogo.com/projects/stainless-steel-pen/pica,Stainless Steel Pen,Beautiful handcrafted pens. Made from stainless steel.,Productivity,"$1,601 CAD raised 640%",
500,https://www.indiegogo.com/projects/coorgle-your-centralized-search-engine/pica,Coorgle - Your Centralized Search Engine!,Your Centralized Search Engine!,Productivity,$0 USD raised 0%,Ended
501,https://www.indiegogo.com/projects/bluetooth-intelligence-game-handle/pica,Bluetooth intelligence game handle,The world’s 1st handheld Bluetooth intelligence game handle,Productivity,$0 USD raised 0%,Ended
502,https://www.indiegogo.com/projects/support-digital-startup-in-easing-unemployment/pica,Support Digital Startup in Easing Unemployment,Support us financially in getting and managing a new and improved webapp,Productivity,£0 GBP raised 0%,Ended
503,https://www.indiegogo.com/projects/blockchain-cloud-storage/pica,Blockchain Cloud Storage,Implementing blockchain technology in cloud storage for you to have the best prices and security.,Productivity,$0 USD raised 0%,Ended
504,https://www.indiegogo.com/projects/pinn-t/pica,Pinn't,A new way of Pinning,Productivity,$0 USD raised 0%,Ended
505,https://www.indiegogo.com/projects/the-money-game-have-fun-with-your-money/pica,The Money Game - Have fun with  your money!,Educational money game lets you manage and improve the awareness of your finances - at your own pace,Productivity,$0 USD raised 0%,Ended
506,https://www.indiegogo.com/projects/a-safe-simple-login-service/pica,A Safe Simple Login Service,We want to make login simple & safe for users on the internet,Productivity,$0 USD raised 0%,Ended
507,https://www.indiegogo.com/projects/eagle-3d-printer-with-3-in-1-laser-cnc/pica,"EAGLE 3D PRINTER  with 3-IN-1  LASER, CNC","Eagle,3 in 1 3D printer with interchangeable heads for 3D printing, laser engraving and CNC carving",Productivity,$0 USD raised 0%,Ended
508,https://www.indiegogo.com/projects/i-am-starting-a-startup/pica,I am Starting a StartUp!,Virtual Hotel Assistant - Efficiently track anything that is happening in a hotel by Web App,Productivity,€0 EUR raised 0%,Ended
509,https://www.indiegogo.com/projects/uplance-project-freelance-platform-needs-support/pica,Uplance project - Freelance platform needs support,Uplance is a freelance services platform that connects skills and hirers.,Productivity,$0 USD raised 0%,31 days left
510,https://www.indiegogo.com/projects/crown-minimal-fountain-pen/pica,Crown Minimal Fountain Pen,A craft pen that carries history，a gift that passes down for centuries.,Productivity,"$15,556 CAD raised 519%",
511,https://www.indiegogo.com/projects/indiemail-io/pica,indiemail.io,"Secure, independent email service that respects your privacy",Productivity,€120 EUR raised 12%,Ended
512,https://www.indiegogo.com/projects/renuvi-touch-face-massaging-skincare-system/pica,Renuvi Touch Face Massaging Skincare System,"All in one skincare massaging system. Exercise, tone, tighten, and lift skin in a matter of minutes.",Productivity,$399 USD raised 2%,Ended
513,https://www.indiegogo.com/projects/notebook-neweek-time-to-make-a-change/pica,Notebook NEWEEK. Time to make a change!,NEWEEK is a notebook dedicated to setting your goals and making plans for their achievement.,Productivity,$0 USD raised 0%,Ended
514,https://www.indiegogo.com/projects/tryton-creation-helper/pica,Tryton: creation helper,Create records from external sources,Productivity,€850 EUR raised 43%,Ended
515,https://www.indiegogo.com/projects/showchinese-app-the-new-way-to-learn-mandarin/pica,ShowChinese App: The New Way to Learn Mandarin,"Learn the language and the culture with immersive chat stories and smart, gamified courses.",Productivity,$0 USD raised 0%,Ended
516,https://www.indiegogo.com/projects/stoary-share-your-ar-story-on-the-map/pica,StoARy - Share your AR story on the map,Share your important moment with AR technique at everywhere. Make the places be your storybook.,Productivity,$140 USD raised 0%,Ended
517,https://www.indiegogo.com/projects/--40002/pica,My Campaign Title,We need resources for supply and water,Productivity,$100 USD raised 13%,Ended
518,https://www.indiegogo.com/projects/my-bible-the-1-280-page-notebook/pica,"My Bible, the 1,280 page notebook.",A beautifully designed notebook that will last a lifetime and inspires people to create.,Productivity,$0 USD raised 0%,Ended
519,https://www.indiegogo.com/projects/pacetrail-global-card-gps-smart-business-card/pica,PaceTrail Global Card - GPS & Smart Business Card,"The Worlds Thinnest GPS Tracker with features for Tracking, Productivity & Safety.",Productivity,"$19,655 USD raised 106%",
520,https://www.indiegogo.com/projects/guacam-versatile-intelligent-monitoring-system/pica,Guacam: Versatile & Intelligent Monitoring System,"Cloud- and device-based security platform, which turns ordinary cameras into intelligent appliances.",Productivity,$211 USD raised 0%,Ended
521,https://www.indiegogo.com/projects/i-d-like-app-money-money-money/pica,I'd like app. Money Money Money,Easy and fun way to make money while watching and sharing. I'd like - a unique way to rip the dough.,Productivity,$58 USD raised 1%,Ended
522,https://www.indiegogo.com/projects/intuitive-rn-innovative-clinical-support-tool/pica,Intuitive RN: Innovative Clinical Support Tool,"Enhancing the way nurses learn, communicate and deliver patient care.",Productivity,$0 USD raised 0%,Ended
523,https://www.indiegogo.com/projects/mighty-grips/pica,Mighty-Grips,The all in one multi tool for your everyday tasks and more.,Productivity,$0 USD raised 0%,Ended
524,https://www.indiegogo.com/projects/ink-it-more-than-just-a-wall-planner/pica,INK IT - more than just a wall planner,"The ULTIMATE organization station. Getting individuals, families & teams on the same page literally!",Productivity,"$7,994 AUD raised 17%",Ended
525,https://www.indiegogo.com/projects/the-best-gantt-chart-for-trello/pica,The Best Gantt Chart for Trello,Upgrade your Trello to professional management tool with fast extension with deep integration.,Productivity,"$2,485 USD raised 12%",Ended
526,https://www.indiegogo.com/projects/lifebushido-inspires-people-to-achieve-bushido/pica,Lifebushido inspires people to achieve Bushido,Join a community of Triangles of three people to inspire each other to achieve your Bushido.,Productivity,$0 USD raised 0%,Ended
527,https://www.indiegogo.com/projects/cloud-planner-linking-paper-and-digital-together/pica,"Cloud Planner, linking paper and digital together","SMART Planner book with SMART mobile application, linking digital files into a paper planner.",Productivity,$56 USD raised 1%,Ended
528,https://www.indiegogo.com/projects/getrankeidee/pica,Getränkeidee,"Schneller Zapfen- weniger Personal,kein Schankverlust,weniger Logistik und glückliche Gäste",Productivity,€0 EUR raised 0%,Ended
529,https://www.indiegogo.com/projects/shutoff-notexteosimanejo/pica,ShutOff: #NoTexteoSiManejo,Un mensaje puede esperar TU Vida NO!,Productivity,$0 USD raised 0%,Ended
