,project_link,title,description,card_category,amt_raised,days_left
835,https://www.indiegogo.com/projects/deepsight-by-biolnic/pica,DeepSight - by biolnic,Your youthful Vision is our Focus,Productivity,"$6,546 USD raised 0%",Ended
836,https://www.indiegogo.com/projects/a2d-where-amazing-products-begin/pica,A2D Where Amazing Products Begin,A2D (Assist 2 Develop) Is A Freelance Marketplace That Empowers Product Development Professionals.,Productivity,$390 USD raised 1%,Ended
837,https://www.indiegogo.com/projects/virtkick-take-cloud-back/pica,VirtKick - Take Cloud Back,"Your self-hosted cloud panel, similar to DigitalOcean. Take cloud back and regain full control.",Productivity,"$3,917 USD raised 7%",Ended
838,https://www.indiegogo.com/projects/alligator-board-professional-3d-printer-controller/pica,Alligator Board Professional 3D printer controller,"A new generation electronics  for 3D printer, offers best performances in your applications.",Productivity,"€23,621 EUR raised 146%",Ended
839,https://www.indiegogo.com/projects/design-your-life-2021-planner/pica,Design Your Life 2021 Planner,"A fun, complete productivity system that keeps you motivated all year round.",Productivity,"$16,522 USD raised 151%",Ended
840,https://www.indiegogo.com/projects/f-you-money/pica,F You Money,F You Money - Best way to make a statement 2016,Productivity,$45 USD raised 0%,Ended
841,https://www.indiegogo.com/projects/crowdbot-by-slingbot/pica,Crowdbot by Slingbot,Suite of marketing tools for crowdfunding campaigns — so creators can focus on what really matters.,Productivity,$101 USD raised 0%,Ended
842,https://www.indiegogo.com/projects/thegpsbook-the-first-gps-social-network-app/pica,TheGPSbook: The First GPS Social Network APP,The Development of a Hybrid GPS Navigational APP that will Integrate All the Major Social Networks Into One Real Time Seamless Social APP!,Productivity,$105 USD raised 0%,Ended
843,https://www.indiegogo.com/projects/secure-your-gmail/pica,Secure Your GMaIL,Add-on for sending encrypted emails on GMail and clever key management.,Productivity,£12 GBP raised 0%,Ended
844,https://www.indiegogo.com/projects/na--120/pica,,,Productivity,£221 GBP raised 2%,Ended
845,https://www.indiegogo.com/projects/atom-eva-alarm-technology-optimization-means/pica,ATOM & Eva - Alarm Technology Optimization Means,"Wake up on time, every time! Use ATOM+Eva on your iOS or Android mobile device and you will never oversleep again!",Productivity,$90 USD raised 0%,Ended
846,https://www.indiegogo.com/projects/medsembly-connecting-the-medical-world/pica,Medsembly: Connecting the Medical World,The first networking app to globally connect all students and professionals in the healthcare sector,Productivity,"$2,215 USD raised 4%",Ended
847,https://www.indiegogo.com/projects/chip-the-world-s-first-lovable-robot-dog/pica,CHiP: The World's First Lovable Robot Dog,"Trainable, Loyal & Affectionate. He can recognize, obey, learn and wants to be your new best friend.",Productivity,"$178,121 USD raised 178%",Ended
848,https://www.indiegogo.com/projects/push-pull-power-tool/pica,Push Pull Power Tool,"A power tool that is, combined hammer,chisel,crowbar&nail puller",Productivity,$510 USD raised 1%,Ended
849,https://www.indiegogo.com/projects/worldpennyjar/pica,WorldPennyJar,contributing to the greater good – a few pennies at a time,Productivity,"$1,265 USD raised 6%",Ended
850,https://www.indiegogo.com/projects/yubixi-next/pica,Yubixi NEXT,Yubixi is a mobile app that helps people connect with others nearby based on common interests. It really works!,Productivity,$607 USD raised 8%,Ended
851,https://www.indiegogo.com/projects/lofree-typewriter-inspired-mechanical-keyboard/pica,lofree: typewriter inspired mechanical keyboard,A typewriter inspired wireless mechanical keyboard built for everyone.,Productivity,"$744,199 USD raised 6,601%",Ended
852,https://www.indiegogo.com/projects/memonote-the-smartest-lockable-notebook/pica,Memonote:The smartest lockable notebook,Smart Control|10.2 inches LCD Tablet|7000mAh Power Bank|Reading Light|Sensitive Stylus|Card Holder,Productivity,"$30,815 USD raised 291%",Ended
853,https://www.indiegogo.com/projects/vod2-cloud-security-reinvented/pica,VoD2: cloud security REINVENTED!,"""Information everywhere and nowhere at the same time!""",Productivity,"$2,054 USD raised 2%",Ended
854,https://www.indiegogo.com/projects/naughty-dog-toys/pica,Naughty Dog Toys,We're here to bring adults wonderful and exciting new bedroom toys.,Productivity,$546 USD raised 2%,Ended
855,https://www.indiegogo.com/projects/pprintee-the-mini-robot-pocket-printer/pica,"PPrintee, the Mini Robot Pocket Printer",Mini-robot pocket printer. Print on the go. Print on all paper formats. Print mobile.,Productivity,"$1,767 USD raised 1%",Ended
856,https://www.indiegogo.com/projects/buyago-the-ultimate-application-for-individuals-to-safely-buy-sell-vehicles/pica,buyago: The ULTIMATE application for individuals to safely buy & sell vehicles,Take the fear out of car shopping & confidently buy & sell  with a smartphone or tablet with the buyago-app. buyago the easiest and safest way to buy & sell,Productivity,$30 USD raised 0%,Ended
857,https://www.indiegogo.com/projects/public-journal-design-humanity/pica,PUBLIC Journal: Design & Humanity,A journal exploring the expanding public interest and social impact design movements.,Productivity,"$3,815 USD raised 31%",Ended
858,https://www.indiegogo.com/projects/alphabet-soup--4/pica,Alphabet Soup,Alphabet Soup,Productivity,$235 USD raised 12%,Ended
859,https://www.indiegogo.com/projects/ultimateyou-planner/pica,UltimateYou Planner,Identify and Reach your Biggest Goals | A simplified system for getting your best results,Productivity,"€6,066 EUR raised 116%",Ended
860,https://www.indiegogo.com/projects/3d-laser-scanning-software-for-the-3d-printer/pica,3D Laser Scanning-Software for the 3D-Printer,"Enjoy a new freedom!
3D scanning software for mobile scanning and 3D printing (G-code)",Productivity,€298 EUR raised 1%,Ended
861,https://www.indiegogo.com/projects/wisedog-2017-calendar/pica,Wisedog 2017 Calendar,"It's about a calendar for the year 2017. BW design at daylight, glows in the dark during night.",Productivity,€773 EUR raised 106%,Ended
862,https://www.indiegogo.com/projects/kickflows-social-media-songwriting-app/pica,KickFlows - Social Media Songwriting App,"KickFlows is a creative writing app where users can write, save, organize and share songs, poems and any other writings with friends and followers.",Productivity,"$1,210 USD raised 3%",Ended
863,https://www.indiegogo.com/projects/hackfon-turn-your-analog-phone-to-a-smart-remote/pica,hackfon - Turn Your Analog Phone to a Smart Remote,Turn an Analog Phone to a Smart Remote. Use Your Phone as a Programmable IoT Buttons.,Productivity,"$2,529 USD raised 126%",Ended
864,https://www.indiegogo.com/projects/magcon-the-most-versatile-and-portable-design-tool/pica,MAGCON-The most versatile and portable design tool,A mini compass and protractor combo to perfect sketching and create a new drawing experience,Productivity,"$722,739 HKD raised 8,207%",Ended
865,https://www.indiegogo.com/projects/edinn-efficiency-and-productivity-for-all-organizations/pica,edinn: efficiency and productivity for all organizations,Our users report a 10% to 40% increase in their total efficiency. Donate to help organizations!,Productivity,€440 EUR raised 0%,Ended
866,https://www.indiegogo.com/projects/rainbow-carrier/pica,Rainbow Carrier,Email marketing software for designers and their clients,Productivity,$135 USD raised 1%,Ended
867,https://www.indiegogo.com/projects/riley-a-smarter-robot/pica,"Riley, a Smarter Robot",Be in two places at the same time. This is the robot that will change the world.,Productivity,"$176,033 USD raised 333%",Ended
868,https://www.indiegogo.com/projects/viral-agenda-app-que-se-passa-a-tua-volta/pica,Viral Agenda App: que se passa à tua volta?,"Descobre eventos aqui e agora com a aplicação de eventos + completa, actualizada e fácil de usar!",Productivity,"€1,000 EUR raised 10%",Ended
869,https://www.indiegogo.com/projects/kabuto-focus-lever/pica,Kabuto Focus Lever,Kabuto Focus is a stand-alone follow focus and focus marker board that can be used on any camera lens.  You will able to focus faster without missing your mark.,Productivity,€918 EUR raised 31%,Ended
870,https://www.indiegogo.com/projects/brixo-building-blocks-meet-electricity-and-iot/pica,Brixo - Building Blocks Meet Electricity and IoT,"Brixo building blocks bring your designs to life with electronic sensors, motors and connected apps.",Productivity,"$1,560,260 USD raised 1,434%",Ended
871,https://www.indiegogo.com/projects/desktech-kilogram-prototype/pica,DeskTech: Kilogram Prototype,"The kilogram has changed forever, capture scientific history in the making.",Productivity,"$164,449 HKD raised 110%",Ended
872,https://www.indiegogo.com/projects/paynshow-instantly-send-pictures-of-what-you-buy-no-picture-taking-needed/pica,PayNShow -Instantly Send Pictures of What You Buy. No Picture Taking Needed,"Pictures of anything you buy are delivered instantly to any social media account, automatically and without the need to take the picture.",Productivity,$245 USD raised 0%,Ended
873,https://www.indiegogo.com/projects/we-fancy-korean-lesson-time/pica,We Fancy : Korean Lesson Time,"Language Learning App with Games, Interactive PDFs & Videos, Audiobook version.",Productivity,"$19,030 USD raised 63%",Ended
874,https://www.indiegogo.com/projects/instant-find-mobile-app-to-locate-singles-nearby/pica,Instant Find- mobile app to locate singles nearby-,Eliminate the guess work and discover who's single.,Productivity,$401 USD raised 1%,Ended
875,https://www.indiegogo.com/projects/mobile-source-code-marketplace/pica,Mobile Source Code Marketplace,The ultimate marketplace for mobile app developers,Productivity,$103 USD raised 1%,Ended
876,https://www.indiegogo.com/projects/solidmaker-affordable-laser-sla-3d-printer--3/pica,"SolidMaker, Affordable Laser SLA 3D Printer","3 µm XY accuracy, 4.7x4.7x6″ print area, SolidMaker is a SLA 3D printer has better printing results.",Productivity,"$228,439 USD raised 441%",Ended
877,https://www.indiegogo.com/projects/gmk-nucbox-most-powerful-palm-sized-4k-mini-pc/pica,GMK NucBox - Most Powerful Palm-Sized 4K Mini PC,Palm-size & Lightweight | Intel 4-Core CPU | 8GB + Up to 512GB | Flexible I/O Ports | 4K UHD Output,Productivity,"$2,157,400 HKD raised 2,697%",Ended
878,https://www.indiegogo.com/projects/maberme/pica,MaberMe,MaberMe is a New Social Platform that Enables Thought Leaders to Share Their Knowledge,Productivity,$385 USD raised 0%,Ended
879,https://www.indiegogo.com/projects/smile-blankets/pica,SMILE blankets,"For every blanket you buy, we will donate one to a child in the hospital",Productivity,"$6,661 USD raised 111%",Ended
880,https://www.indiegogo.com/projects/enable-gwt-to-preserve-java-debugging-info-in-production/pica,Enable GWT to Preserve Java Debugging Info in Production,Will overhaul GWT to give developers accurate Java-like stack traces for all JavaScript exceptions in a compiled GWT app deployed in any browser.,Productivity,$661 USD raised 10%,Ended
881,https://www.indiegogo.com/projects/counterfringe/pica,Counterfringe,An app to protect businesses and families from counterfeit products.,Productivity,$80 USD raised 0%,Ended
882,https://www.indiegogo.com/projects/super-cool-keys/pica,Super Cool Keys,Super Cool Keys that are customized and personalized to each unique individual.,Productivity,$722 USD raised 14%,Ended
883,https://www.indiegogo.com/projects/vh-80-the-world-s-first-bilateral-laser-measurer/pica,VH-80: The World's First Bilateral Laser Measurer,"It's true, VH-80 is the world's first bilateral LDM. Let us show you how awesome it really is.",Productivity,"$931,152 USD raised 2,916%",Ended
884,https://www.indiegogo.com/projects/danforce-g1-pro-the-first-modular-flashlight/pica,DanForce G1 PRO - The First Modular Flashlight,The world's first modular flashlight that adapts to any lighting situation.,Productivity,"$413,931 USD raised 2,335%",Ended
885,https://www.indiegogo.com/projects/ios-handheld-projector-with-kickass-software/pica,iOS handheld projector with kickass software,Share your world with all of your friends at the same time!  Mobile device screens are just too small.  Share on a big screen.,Productivity,"$1,156 USD raised 1%",Ended
886,https://www.indiegogo.com/projects/phobos-anxiety-management-vr-platform/pica,PHOBOS - Anxiety Management VR Platform,Virtual Reality software for research and treatment of common phobias and anxiety disorders,Productivity,"$3,000 USD raised 12%",Ended
887,https://www.indiegogo.com/projects/help-map-app/pica,Help Map App,"Mobile app helps institutions and philanthropic projects, where anyone can donate or volunteer.",Productivity,$1 USD raised 0%,Ended
888,https://www.indiegogo.com/projects/php-inspections-ea-extended-a-code-analyzer/pica,"Php Inspections EA Extended, a code analyzer",Php Inspections (EA Extended) is a superior Static Code Analyzer for PhpStorm and IdeaUltimate IDEs.,Productivity,"€5,100 EUR raised 51%",Ended
889,https://www.indiegogo.com/projects/social-media-planner-for-nonprofits-and-do-gooders--2/pica,Social Media Planner for Nonprofits and Do-gooders,Use your social media powers for good with this planning notebook and companion digital products,Productivity,"$4,283 USD raised 100%",Ended
890,https://www.indiegogo.com/projects/modular-raspberry-pi-expansion-case-and-accessory/pica,Modular Raspberry Pi Expansion Case and Accessory,"High quality Raspberry Pi case let your project be more professional, convenient and attractive!",Productivity,"$159,774 HKD raised 105%",Ended
891,https://www.indiegogo.com/projects/glamos-bring-your-touchless-screens-to-life/pica,GLAMOS: Bring Your Touchless Screens To Life,Ex-Samsung engineers Glamos uses LIDAR tech to turn any screen into a fully interactive touch screen,Productivity,"$457,283 USD raised 4,010%",Ended
892,https://www.indiegogo.com/projects/the-best-led-toys-you-ll-ever-have/pica,The best led toys you'll ever have!,I want to create led performance toys that do anything and everything you want them to do!,Productivity,$40 USD raised 8%,Ended
893,https://www.indiegogo.com/projects/next-browser-v1-4-0/pica,Next browser: v1.4.0,Next makes you productive.,Productivity,"$2,326 USD raised 19%",Ended
894,https://www.indiegogo.com/projects/da-vinci-color-mini-full-color-3d-printer/pica,da Vinci Color mini - Full Color 3D Printer,"Compact and intuitive, turn your everyday ideas into full-color reality.",Productivity,"$68,836 USD raised 129%",Ended
895,https://www.indiegogo.com/projects/writscrib-a-social-network-for-creators/pica,WritScrib: A Social Network For Creators,Looking for a social network tailored to you? Want to earn some money on posts? Try WritScrib!,Productivity,"$7,760 USD raised 13%",Ended
896,https://www.indiegogo.com/projects/cubroid-teaching-coding-to-help-kids-feel-creative/pica,Cubroid-Teaching coding to help kids feel creative,Learn how to program in a new and fun way with Cubroid! Simply build and connect with Lego blocks.,Productivity,"$89,402 USD raised 866%",Ended
897,https://www.indiegogo.com/projects/seder2015-digital-platform-to-invigorate-passover/pica,SEDER2015: digital platform to invigorate Passover,"A digital platform to invigorate
and expand the Passover Seder.",Productivity,"$20,745 USD raised 83%",Ended
898,https://www.indiegogo.com/projects/phroogal/pica,Phroogal,Solving financial illiteracy.,Productivity,"$78,501 USD raised 105%",Ended
899,https://www.indiegogo.com/projects/safe-and-portable-co2-laser-cutter/pica,Safe and Portable CO2 Laser Cutter,"Laser cut or engrave at home, in a confined space or in a public place with our 40W CO2 Laser Cutter",Productivity,"$123,971 USD raised 122%",Ended
900,https://www.indiegogo.com/projects/the-birth-of-owliecat-toys/pica,The birth of Owliecat Toys,"A toy making workshop where you can watch as toys & other magical handmade objects are made, try making them,and buy them too!",Productivity,"$1,040 USD raised 47%",Ended
901,https://www.indiegogo.com/projects/myt-6-inch-engine-for-aviation-2-0/pica,MYT 6-inch Engine for Aviation 2.0,"Raphial Morgado wants to finish his 6"", 200 HP engine to power his JetPack prototype. With another $200k he could finish the JetPack to demonstrate it flying.",Productivity,"$2,896 USD raised 2%",Ended
902,https://www.indiegogo.com/projects/mystyle-app/pica,MyStyle App,"Our company is developing a mobile app that will revolutionize the way people shop, share and express their style. Please assist us in funding our vision.",Productivity,$725 USD raised 3%,Ended
903,https://www.indiegogo.com/projects/sens-the-most-minimalistic-pen/pica,SENS - the most minimalistic pen,"This pen was designed for thinkers, solvers, and creators - for those, who are changing this world!",Productivity,"$33,295 USD raised 655%",Ended
904,https://www.indiegogo.com/projects/maya-zuvuya-agenda-2018/pica,Maya Zuvuya Agenda 2018,A magical Journey through the Year 2018 | Unleash your true.full Potential with our Maya Agenda ...,Productivity,"$15,650 USD raised 102%",Ended
905,https://www.indiegogo.com/projects/vitun-2-0-ultrasonic-cleaning-pen/pica,ViTUN 2.0 Ultrasonic  Cleaning Pen,"A powerful ultrasonic washing equipment,which enables you to easily clean dirt anytime and anywhere.",Productivity,"$56,638 USD raised 127%",Ended
906,https://www.indiegogo.com/projects/demon-art-metal-plus-aluminu-alloy-metal-keyboard/pica,"DEMON ART- metal PLUS,aluminu alloy metal keyboard",A simple and beauty aluminum alloy metal keyboard.(With backlight),Productivity,$790 USD raised 130%,Ended
907,https://www.indiegogo.com/projects/pc--59/pica,PC,PC,Productivity,"Kr 8,191 SEK raised 33%",Ended
908,https://www.indiegogo.com/projects/the-perfect-notebook/pica,The Perfect Notebook,One notebook to replace the productivity apps that have failed you. It’s so simple it’s brilliant.,Productivity,"$254,865 USD raised 1,468%",Ended
909,https://www.indiegogo.com/projects/momi/pica,MOMI,Buy or Sell - it's the best app either way !,Productivity,$210 USD raised 0%,Ended
910,https://www.indiegogo.com/projects/delux-designer-perfect-assistant-for-designers/pica,Delux Designer - Perfect Assistant for Designers,"Customizable shortcut keys, macros and multifunctional dial. Increase efficiency of designers by 80%",Productivity,"$141,562 USD raised 956%",Ended
911,https://www.indiegogo.com/projects/tesmo-the-invisible-portable-adhesive-laptop-stand/pica,Tesmo The Invisible Portable Adhesive Laptop Stand,"Tesmo Kickstand weighs only 17g yet able to hold up to 17.6lbs. Portable, reusable and affordable.",Productivity,"$28,697 USD raised 278%",Ended
912,https://www.indiegogo.com/projects/deskspace-handcrafted-solar-system-desk-accessory/pica,DeskSpace: Handcrafted Solar System Desk Accessory,"Experience the beauty of the solar system everyday at your desk, with nine handcrafted gemstones.",Productivity,"$52,916 USD raised 1,058%",Ended
913,https://www.indiegogo.com/projects/the-shopthismag-app-shopping-reinvented/pica,The ShopthisMag App: Shopping Reinvented,We are the first digital ecommerce newsstand app that lets you shop your favorite magazines in one easy app.,Productivity,"$1,754 USD raised 4%",Ended
914,https://www.indiegogo.com/projects/ralok-the-future-of-e-tickets/pica,Ralok: the future of e-tickets.,Ralok smart card - all e-tickets and season e-tickets on one card.,Productivity,£5 GBP raised 0%,Ended
915,https://www.indiegogo.com/projects/texans-tickets-for-triumph/pica,TEXANS TICKETS FOR TRIUMPH,Support graduating nursing students by purchasing $5 raffle tickets for FIELD LEVEL SIDELINE TICKETS to see the JAGUARS vs TEXANS game! Donations appreciated!,Productivity,$135 USD raised 1%,Ended
916,https://www.indiegogo.com/projects/the-nix-color-sensor-batch-2/pica,The Nix Color Sensor - Batch 2,You can still pick up your own Nix at www.nixsensor.com,Productivity,"$16,547 USD raised 3,309%",Ended
917,https://www.indiegogo.com/projects/reagan-chat-secure-private-messaging-platform/pica,"Reagan Chat - Secure, private messaging platform",The first secure and private messaging platform developed for American Conservatives. Funds are being used for completing development of the technology.,Productivity,$250 USD raised 3%,Ended
918,https://www.indiegogo.com/projects/app--17/pica,App,App,Productivity,$3 USD raised 0%,Ended
919,https://www.indiegogo.com/projects/millright-cnc-mega-v-router-and-plasma-system/pica,MillRight CNC Mega V Router and Plasma System,"The Mega V was designed to outperform. This is the next level of affordable, high performance CNC.",Productivity,"$498,201 USD raised 397%",Ended
920,https://www.indiegogo.com/projects/destruct-pro-wipe-your-hard-drive-military-grade/pica,Destruct PRO: Wipe your hard drive. Military grade,"Securely wipe all your data from your Laptop or PC before you gift, sell or re-use your computer,",Productivity,"£4,727 GBP raised 121%",Ended
921,https://www.indiegogo.com/projects/pop-n-go-the-world-s-best-kids-playpen/pica,Pop 'N Go - The World's Best Kids Playpen,"The most innovative, convenient, and advanced playpen in the world is now here!",Productivity,"$446,442 USD raised 1,977%",Ended
922,https://www.indiegogo.com/projects/tiscribe-bolt-v2-0-ultimate-titanium-edc-pen-t/pica,TiScribe-Bolt V2.0 Ultimate Titanium EDC Pen  T,"The bolt-action pen, The Best Pen Of The World.",Productivity,$470 USD raised 24%,Ended
923,https://www.indiegogo.com/projects/the-creatorstand-we-re-shipping-now/pica,The creatorstand. We're shipping now.,The printed content marketing tool for the desktop. Eco-friendly and Made in America.,Productivity,"$15,227 USD raised 102%",Ended
924,https://www.indiegogo.com/projects/lgbt-friendly-app-development/pica,LGBT Friendly App Development,MyRainbowPages.com App & Print Development for Gay Friendly Businesses in Northern California,Productivity,$55 USD raised 0%,Ended
925,https://www.indiegogo.com/projects/paymentspree-mobile-payment-and-rewards-app/pica,PaymentSpree Mobile Payment and Rewards App,Paymentspree will change the retail world forever.,Productivity,$500 USD raised 1%,Ended
926,https://www.indiegogo.com/projects/smarttags-locate-your-lost-pet-over-any-social-networking-site/pica,SmartTags- Locate your lost pet over any social networking site,SmarT-Tags utilize QR Codes and Unique hashtags to track you lost pet on social networking sites. Anyone with a smartphone can find you to bring your pet home.,Productivity,$213 USD raised 4%,Ended
927,https://www.indiegogo.com/projects/tesla-s-insight/pica,Tesla's Insight,"A nifty, new desk toy. Create electricity by spinning the magnetic Tesla top!",Productivity,"$8,829 USD raised 147%",Ended
928,https://www.indiegogo.com/projects/tipen-redefining-edc-pen/pica,TIPEN: Redefining EDC Pen,Must-Have Everyday Carry for Anyone and Everyone,Productivity,"£82,982 GBP raised 3,766%",Ended
929,https://www.indiegogo.com/projects/hat-claim-your-data-organise-visualise-control/pica,"HAT! Claim your data: organise, visualise, control","Claim the data corporations have on you. Manage, track & trade it. Start the Bigger Data revolution!",Productivity,"£54,939 GBP raised 102%",Ended
930,https://www.indiegogo.com/projects/green-cleaning/pica,Green Cleaning,going the green distance for a healthier environment!,Productivity,$260 USD raised 3%,Ended
931,https://www.indiegogo.com/projects/simplifying-sales-a-premier-app-for-door-to-door-sales-reps/pica,Simplifying Sales: A Premier App for Door-to-Door Sales Reps,"Get the sales app that helps simplify your work by tracking routes, tracking sales reports, motivating you and much more!",Productivity,$35 USD raised 0%,Ended
932,https://www.indiegogo.com/projects/multi-level-dish-rack-organizer/pica,Multi level Dish Rack Organizer,"The Multi level dish rack organizer reduces cluttering and piling up of dishes, saves time.",Productivity,$200 USD raised 2%,Ended
933,https://www.indiegogo.com/projects/porwod-case-computer-height-adjuster/pica,"porwod : Case, Computer, Height Adjuster",The world’s first three in one product for laptop users.,Productivity,$117 USD raised 0%,Ended
934,https://www.indiegogo.com/projects/taihe-gemini-most-affordable-on-the-go-monitor/pica,"TAIHE Gemini, Most Affordable On-the-go Monitor.","15.6"" FHD touchscreen or 4K UHD screen | Built-in battery | Kickstand design | All ports you need",Productivity,"$1,306,535 USD raised 11,103%",Ended
935,https://www.indiegogo.com/projects/reusable-whiteboard-planner-notebook-sketchbook--2/pica,"Reusable Whiteboard Planner, Notebook, Sketchbook!",Get things done again and again with the infinitely reusable erasable whiteboard Schedule Planner!,Productivity,"$93,846 USD raised 3,521%",Ended
936,https://www.indiegogo.com/projects/pressssssure-steamroller-printmaking/pica,Pressssssure: Steamroller Printmaking,Steamroller Printmaking Event hosted by students of VCU Graphic Design,Productivity,"$1,475 USD raised 87%",Ended
937,https://www.indiegogo.com/projects/pcbite-the-professional-and-affordable-pcb-holder--4/pica,"PCBite, The professional and affordable PCB holder","PCBite securely holds your PCB  during soldering, inspection and test. Now arms with test needles!",Productivity,"$19,158 USD raised 374%",Ended
938,https://www.indiegogo.com/projects/prototype-for-continuous-renewable-electricity/pica,Prototype for continuous renewable electricity,A new electricity generation process that uses large particles of floating mass and their rise and fall with the incoming and outgoing tide.,Productivity,$70 USD raised 1%,Ended
939,https://www.indiegogo.com/projects/digital-condom/pica,Digital Condom,Researching digital ways to improve condoms.,Productivity,"$1,750 USD raised 18%",Ended
