,project_link,title,description,card_category,amt_raised,days_left
1143,https://www.indiegogo.com/projects/theme-k2-wordpress-website-building-powerhouse/pica,THEME K2 :: WordPress Website Building Powerhouse,A revolutionary website builder that does everything a design & marketing agency does for under $95!,Productivity,"$11,690 USD raised 114%",Ended
1144,https://www.indiegogo.com/projects/legacy-engine-a-revolutionary-new-engine/pica,Legacy Engine - A Revolutionary New Engine,"A green engine technology that is cleaner, more powerful and less expensive.",Productivity,$445 USD raised 0%,Ended
1145,https://www.indiegogo.com/projects/lanq-pcdock-the-new-standard-of-monitor-stand/pica,LANQ PCDock: The New Standard of Monitor Stand,"Upgrade your setup with built-in Touch ID, WiFi, Bluetooth and more functions all designed in one.",Productivity,"$844,752 HKD raised 521%",Ended
1146,https://www.indiegogo.com/projects/jmb-living-journal-the-only-all-in-one-planner/pica,JMB Living Journal - The Only All-In-One Planner,"A 90-Day planner, journal, magazine & personal coach so you can be more joyful, mindful and balanced",Productivity,"$16,967 USD raised 170%",Ended
1147,https://www.indiegogo.com/projects/the-pineapple-shop-upscale-clothes-classic-toys/pica,The Pineapple Shop: Upscale Clothes. Classic Toys.,Are you as concerned as me about China?  We are a start-up who will sell upscale children's clothes and classic toys not produced in China.,Productivity,$14 USD raised 0%,Ended
1148,https://www.indiegogo.com/projects/how-grant/pica,HOW Grant,HOW regulars donate to send a newbie to the 2014 HOW Design Conference in Boston,Productivity,$550 USD raised 110%,Ended
1149,https://www.indiegogo.com/projects/cnc-router-for-hackrva/pica,CNC Router for HackRVA!,"Robot underlord, do our bidding!",Productivity,"$1,975 USD raised 165%",Ended
1150,https://www.indiegogo.com/projects/beetree-app-the-world-of-arts-creativity/pica,Beetree App - The World of Arts & Creativity,"1st professional App to find Artists, manage Bookings & Projects, track Jobs & interact!",Productivity,"Fr 29,252 CHF raised 97%",Ended
1151,https://www.indiegogo.com/projects/keystone-the-future-of-mechanical-keyboards/pica,Keystone - The Future of Mechanical Keyboards,An Open Source Fully Analog Keyboard with Adaptive Typing AI.,Productivity,"$224,400 USD raised 625%",Ended
1152,https://www.indiegogo.com/projects/picassotab-first-multipurpose-drawing-tablet/pica,PicassoTab - First Multipurpose Drawing Tablet,A 10-Inch Android 7 Nougat Drawing Tablet for students and aspiring artists,Productivity,"$1,268 USD raised 4%",Ended
1153,https://www.indiegogo.com/projects/horizon-ruler-create-and-measure-everywhere/pica,Horizon Ruler: Create and Measure Everywhere,"Inch & Cm & Pixel & Pica ruler, compass, protractor, t-square and more—all in your wallet!",Productivity,"£22,821 GBP raised 555%",Ended
1154,https://www.indiegogo.com/projects/innervoice-app-the-next-step-in-technology-for-autism/pica,"InnerVoice App, The Next-Step in Technology for Autism","The product is a cost-effective, revolutionary invention that improves social interaction and communication for the 1 in 50 people who are born with autism.",Productivity,$260 USD raised 1%,Ended
1155,https://www.indiegogo.com/projects/solid-titanium-the-most-affordable-titanium-pen/pica,Solid Titanium: The Most Affordable Titanium Pen,The ultimate refill friendly pen that accepts 100+ refills. Ti6AI4V grade 5 aerospace Titanium!,Productivity,$273 USD raised 55%,Ended
1156,https://www.indiegogo.com/projects/my-week-educational-calendar/pica,My Week Educational Calendar,Let your children help keep track of their daily activities with Fancytotz's My Week interactive magnetic and dry-wipe wall calendar,Productivity,£110 GBP raised 14%,Ended
1157,https://www.indiegogo.com/projects/app--51/pica,App,App,Productivity,£24 GBP raised 0%,Ended
1158,https://www.indiegogo.com/projects/abadesk-data-collection-graphing-software/pica,ABAdesk - Data Collection & Graphing Software,"Intuitive, HIPAA Compliant Data Collection and Graphing Software for ABA Professionals & Educators",Productivity,"$6,056 USD raised 101%",Ended
1159,https://www.indiegogo.com/projects/mappsafe-makes-your-every-journey-safer/pica,Mappsafe makes your every journey safer,"World's first mobile app that keeps you safe everywhere you go. Map it, rate it, share it.",Productivity,"$1,639 USD raised 16%",Ended
1160,https://www.indiegogo.com/projects/surveillance-disruption-network/pica,Surveillance Disruption Network,Stop Mass Surveillance! Create massive amounts of disinformation. Structured in a decentralized peer to peer format similar to torrent networks.,Productivity,$75 USD raised 0%,Ended
1161,https://www.indiegogo.com/projects/cucme/pica,CuCme,"""See You See Me"".  We are building a new mobile app to help people ""See"" others -- so we spend less time looking for connections & more time building them!",Productivity,$280 USD raised 3%,Ended
1162,https://www.indiegogo.com/projects/squizz-digital-signage/pica,SQUIZZ DIGITAL SIGNAGE,"THE EASIEST WAY TO SHARE IMAGES, VIDEOS AND DOCUMENTS ON ANY MONITOR EVER CREATED!",Productivity,$394 USD raised 0%,Ended
1163,https://www.indiegogo.com/projects/gather-the-minimal-organizer-that-cuts-clutter/pica,Gather: The minimal organizer that cuts clutter,Gather adapts to your workspace to make sure the tools you need are always within reach.,Productivity,"$463,012 USD raised 2,394%",Ended
1164,https://www.indiegogo.com/projects/this-revolutionary-engine-will-change-our-world/pica,This Revolutionary Engine Will Change Our World,"Revolutionary engine improves fuel efficiency by 50%, but this one is by a well published PhD professor in aerospace engineering.",Productivity,"$6,435 USD raised 7%",Ended
1165,https://www.indiegogo.com/projects/world-s-first-universal-10-in-1-super-dock/pica,World's First Universal 10-In-1 Super Dock,The USB-C Super Dock features Dual 4K Displays and supports up to 100w of power delivery via USB-C.,Productivity,"$73,644 AUD raised 272%",Ended
1166,https://www.indiegogo.com/projects/acts-of-random-kindness/pica,Acts of Random Kindness,To make disciples of Jesus Christ for the transformation of the world through acts of random kindness,Productivity,"$3,801 USD raised 51%",Ended
1167,https://www.indiegogo.com/projects/visualsaas-design-deliver-deploy-in-the-cloud/pica,"VisualSaaS: Design, Deliver, Deploy in the Cloud","Build integrated, structured-data applications in the Cloud quickly and collaboratively without hardware costs, licence fees or in-depth technical ability",Productivity,£295 GBP raised 0%,Ended
1168,https://www.indiegogo.com/projects/black-media-network/pica,Black Media Network,Black Media Network,Productivity,$326 USD raised 0%,Ended
1169,https://www.indiegogo.com/projects/rovair-mobile-broadband-for-the-sharing-economy/pica,RovAir Mobile Broadband for The Sharing Economy,Collaborative Consumption platform to allow users to share a mobile broadband account.,Productivity,"$3,635 USD raised 8%",Ended
1170,https://www.indiegogo.com/projects/the-healthy-living-reminder-app/pica,The Healthy Living Reminder App,Do you struggle with self empowerment?  Do you find that you sabotage yourself when you are trying to reach goals?  This App is for you!,Productivity,$745 USD raised 9%,Ended
1171,https://www.indiegogo.com/projects/create-apps-online/pica,Create Apps Online,Develop your own IOS and Android App in less than 10 minutes Online! Made the easy way for people without any coding or programming knowledge!,Productivity,$831 USD raised 28%,Ended
1172,https://www.indiegogo.com/projects/hunt22-the-world-s-coolest-titanium-uv-flashlight/pica,HUNT22: The World's Coolest Titanium UV Flashlight,Let's explore the hidden world! Waterproof + Fireproof + Iceproof + Smashproof.,Productivity,"£67,348 GBP raised 3,276%",Ended
1173,https://www.indiegogo.com/projects/minibook-mobile-workstation-in-your-hand/pica,MiniBook-Mobile Workstation In Your Hand,360° Yoga design l 8 Inch Touch Screen l M.2 SSD Expansion l Intel® Core™ m3-8100Y l 8GB LPDDR3,Productivity,"$7,154,483 HKD raised 2,982%",Ended
1174,https://www.indiegogo.com/projects/migo-a-portable-internet-enabled-3d-printer/pica,Migo - A Portable Internet-enabled 3D Printer,"Portable,Internet-Enabled,Industrial Quality. From $299. *Price increases by $20 each month.* !",Productivity,"$179,044 USD raised 157%",Ended
1175,https://www.indiegogo.com/projects/sharit-the-best-social-app-for-all-platforms/pica,Sharit: the best social app for all platforms,Browse & Manage all Social Platforms using a Single App available to all Devices & Operating Systems,Productivity,$156 USD raised 0%,Ended
1176,https://www.indiegogo.com/projects/outnest/pica,OutNest,provides the students with the one-stop solution for enhancing their experience.,Productivity,"€5,350 EUR raised 107%",Ended
1177,https://www.indiegogo.com/projects/the-30-ruler-2-0-one-ruler-to-rule-them-all/pica,The 30 Ruler 2.0 : One Ruler To Rule Them All,"A laser engraved, aerospace aluminum ruler at a practical 30° angle. For designers and for everyone.",Productivity,"£35,341 GBP raised 1,675%",Ended
1178,https://www.indiegogo.com/projects/buy-a-zoubus-for-the-antlers/pica,Buy a ZouBus for The Antlers,The Antlers want to buy the ZouBus.,Productivity,$568 USD raised 9%,Ended
1179,https://www.indiegogo.com/projects/deskspace-handcrafted-solar-sun-mood-lamp/pica,DeskSpace: Handcrafted Solar Sun Mood Lamp,Handcrafted Golden Calcite gemstone illuminated to recreate the beauty and power of the Sun.,Productivity,"$166,494 USD raised 2,348%",Ended
1180,https://www.indiegogo.com/projects/campaign-ended--40/pica,campaign ended,campaign ended,Productivity,"$1,204 USD raised 6%",Ended
1181,https://www.indiegogo.com/projects/austin-lloyd-delivering-engaging-surprises-for-young-minds/pica,Austin Lloyd: Delivering Engaging Surprises for Young Minds,Austin Lloyd™ is a start-up that sells subscriptions of educational toys for infants and toddlers. We also donate our customers' used toys to charities.,Productivity,"$5,815 USD raised 39%",Ended
1182,https://www.indiegogo.com/projects/presenter-world-create-presentations-in-minutes/pica,presenter.world - create presentations in minutes,Great presentations can make great things happen! We help you to create yours in minutes!,Productivity,€130 EUR raised 1%,Ended
1183,https://www.indiegogo.com/projects/the-most-beautiful-construction-set-in-the-world/pica,The most beautiful construction set in the world,"Exclusive mechanical models made of metal. For interior design, education and as a gift, meccano",Productivity,"$463,863 USD raised 2,874%",Ended
1184,https://www.indiegogo.com/projects/p2p-secure-encrypted-email-system-flowingmail/pica,"P2P, secure, encrypted email system: FlowingMail","The future of emails: ALWAYS encrypted automatically, NEVER transit through a central server like Gmail, Yahoo or NSA, addresses cannot be forged",Productivity,$715 USD raised 1%,Ended
1185,https://www.indiegogo.com/projects/zztat-see-and-use-your-stats-in-whole-new-ways/pica,zztat: See and use your stats in whole new ways!,zztat is The Next-Gen Oracle Performance Monitoring and Reaction Framework,Productivity,$932 USD raised 6%,Ended
1186,https://www.indiegogo.com/projects/cancelled-powered-by-ql-find-technology/pica,Cancelled - Powered By QL-Find Technology,"Wootch is an app enabled security accessory for children, camouflaged as a digital watch.",Productivity,£804 GBP raised 3%,Ended
1187,https://www.indiegogo.com/projects/apollo-nano-spectrometer/pica,apollo :   nano spectrometer,Co-create and share the unlimited opportunities of spectral sensing for Internet of Things (IoT),Productivity,"$34,552 USD raised 17%",Ended
1188,https://www.indiegogo.com/projects/x-bows-mechanical-ergonomic-keyboard/pica,X-Bows Mechanical Ergonomic Keyboard,Available at: x-bows.com,Productivity,"$336,310 USD raised 811%",Ended
1189,https://www.indiegogo.com/projects/3d-printing-materials/pica,3D printing materials,I develop high-resolution photopolymer resins for 3D printers,Productivity,€541 EUR raised 3%,Ended
1190,https://www.indiegogo.com/projects/high-strength-titanium-locking-d-shackle/pica,High Strength Titanium Locking D Shackle,"The strongest, safest multi-use shackle you'll ever find.",Productivity,$81 USD raised 2%,Ended
1191,https://www.indiegogo.com/projects/workable-internet-micropayment-system-fundraising-for-patent-process/pica,Workable internet micropayment system- Fundraising for patent process,"If you have a website, you'll finally be able to make money from your content.",Productivity,$320 USD raised 1%,Ended
1192,https://www.indiegogo.com/projects/loveyourselfagain-club/pica,Loveyourselfagain.club,"Mobile App for helping people with their diets, workouts, progress tracking and find encouragement.",Productivity,$32 USD raised 0%,Ended
1193,https://www.indiegogo.com/projects/dryzoo-protecting-your-valuable-electronic-devices-from-liquid-damage/pica,Dryzoo: Protecting your valuable electronic devices from liquid damage.,"By creating an invisible, liquid repellent layer, Dryzoo's unique process protects your valuable electronic devices from liquid damage.",Productivity,"$1,803 USD raised 3%",Ended
1194,https://www.indiegogo.com/projects/skala-light-that-ascends-design-that-transcends/pica,Skála: Light that ascends. Design that transcends.,The  masterful fusion of art and function.,Productivity,"$25,453 USD raised 100%",Ended
1195,https://www.indiegogo.com/projects/stop-iffs-in-2015/pica,Stop IFFs in 2015,"Illicit financial flows are draining development and perpetuating poverty. Join ASAP in building a fair, transparent financial system.",Productivity,"$11,870 USD raised 79%",Ended
1196,https://www.indiegogo.com/projects/downtown-direct-the-app/pica,Downtown Direct: The App,Safe choice for Syracuse students traveling to Armory Square. Keeping people connected in a new way that's non-intrusive,Productivity,$45 USD raised 1%,Ended
1197,https://www.indiegogo.com/projects/dead-zone--7/pica,Dead Zone,"Secure your Cellphones and  Mobile Devices from cloning, scanning, tracking and unauthorized use.",Productivity,$186 USD raised 1%,Ended
1198,https://www.indiegogo.com/projects/heelight-a-smart-bulb-that-reacts-to-sound/pica,Heelight: A Smart Bulb That Reacts to Sound,This innovative smart bulb reacts to sound – creating the perfect ambiance for any situation.,Productivity,"$23,515 USD raised 114%",Ended
1199,https://www.indiegogo.com/projects/lucidity-network-fun-learning-for-better-results/pica,Lucidity Network: fun learning for better results,An online and face to face learning network giving you confidence to achieve better results.,Productivity,"£12,086 GBP raised 116%",Ended
1200,https://www.indiegogo.com/projects/the-proposal--3/pica,The Proposal,The sales app that does all of the work for you.,Productivity,$560 USD raised 11%,Ended
1201,https://www.indiegogo.com/projects/vh-80se-bilateral-laser-distance-measurer/pica,VH-80SE: Bilateral Laser Distance Measurer,Easily measure distances without moving a step! | Incomparable work efficiency,Productivity,"$310,551 USD raised 2,747%",Ended
1202,https://www.indiegogo.com/projects/tagsu-the-digital-wondertag/pica,Tagsu - The  Digital Wondertag,"The digital #wondertag you should absolutely never, ever be without",Productivity,"$5,680 USD raised 28%",Ended
1203,https://www.indiegogo.com/projects/fridge-with-automatic-ordering-products/pica,Fridge with automatic ordering products,"The world's first fridge, self ordering products",Productivity,$245 USD raised 0%,Ended
1204,https://www.indiegogo.com/projects/axis-3d-printer-from-125/pica,AXIS 3D Printer from $125,Dual Material Printing | Wi-Fi/Webcam Interface | Removable FlexPlate | Heated Bed | Silent Printing,Productivity,"£38,768 GBP raised 190%",Ended
1205,https://www.indiegogo.com/projects/pikanote-the-best-way-to-share-your-notes/pica,Pikanote: the best way to share your notes!,"Take your notes with intuitive and effective tools. 
Share your tips, tricks and advices.
Simply said, Pikanote: it's a hand to success!",Productivity,"€2,031 EUR raised 2%",Ended
1206,https://www.indiegogo.com/projects/all-in-one-macserver-for-macos/pica,All-in-One macServer for macOS,Port Zentyal Server to macOS to provide a replacement for Apple's deprecated server.app,Productivity,"$1,780 USD raised 1%",Ended
1207,https://www.indiegogo.com/projects/propoint-mouse-in-air-presenter-pc-mac-ipad/pica,"ProPoint Mouse & In-air Presenter. PC, Mac & iPad","Award-winning pen-grip mouse & presenter.  For designers, power users, in the office or on the go.",Productivity,"$715,040 USD raised 2,480%",Ended
1208,https://www.indiegogo.com/projects/quizflip-the-world-s-best-learning-tool/pica,Quizflip: The World's Best Learning Tool,Learn up to 10X faster and remember anything forever.,Productivity,"$97,384 USD raised 116%",Ended
1209,https://www.indiegogo.com/projects/vidicle-an-app-worth-recommending/pica,Vidicle! An App WORTH Recommending.,"Did you once find a local diner that serves up the best vegetarian burgers in town? No matter what the ""gem"", share your overlooked discovery through Vidicle!",Productivity,$325 USD raised 3%,Ended
1210,https://www.indiegogo.com/projects/note-mark-bookmark/pica,Note & Mark - Bookmark,A simple and useful bookmark integrated with page markers.,Productivity,$227 USD raised 5%,Ended
1211,https://www.indiegogo.com/projects/blademaster-ultimate-keyboard-with-genius-knob/pica,BladeMaster: Ultimate Keyboard with Genius-Knob,2.4GHz Wireless/BLE4.0/4000mAh/Cloud Software/On-Board Memory/Fully Compatible with Mac&PC/9 Layouts,Productivity,"$478,824 USD raised 2,177%",Ended
1212,https://www.indiegogo.com/projects/mechanical-toys-for-3d-printing/pica,Mechanical toys for 3D Printing,Visit us at www.laykanics.com!,Productivity,"$3,800 USD raised 38%",Ended
1213,https://www.indiegogo.com/projects/hoverpen-the-executive-pen-that-defies-gravity/pica,Hoverpen: The Executive Pen That Defies Gravity,"Turn heads, provoke curiosity, and cure your fidget itch with this self-balancing marvel.",Productivity,"$137,334 USD raised 2,446%",Ended
1214,https://www.indiegogo.com/projects/kai-gesture-controller-buy-now-at-vicara-co/pica,Kai: Gesture Controller - Buy Now At Vicara.co!,"A smart gesture-based interaction device to control Laptops, VR, Drones, Smart TVs or Mobiles.",Productivity,"$106,239 USD raised 100%",Ended
1215,https://www.indiegogo.com/projects/c-est-vrai-the-transparency-reporting-app/pica,C'est Vrai: the Transparency Reporting App,Web app that uses big data and a computer-assisted reporting function.,Productivity,$305 USD raised 1%,Ended
1216,https://www.indiegogo.com/projects/g-flow-stone-laptop-stand/pica,g.flow stone: Laptop Stand,"Light & Foldable, a Sustainable Laptop Stand Made From 100% Recycled Materials!",Productivity,"$5,419 USD raised 178%",Ended
1217,https://www.indiegogo.com/projects/veggiesmile-community-app-buy-sell-trade-share/pica,Veggiesmile Community App - Buy.Sell.Trade.Share,Veggiesmile is a community app that let's you find and connect with people to trade home grown food.,Productivity,$40 USD raised 0%,Ended
1218,https://www.indiegogo.com/projects/lifepowr-laptop-car-charger-triple-port-96-watts/pica,LIFEPOWR Laptop Car Charger - Triple Port 96 Watts,The Ultimate | Unique | Universal | USB-C PD Car Charger. Driving has never been so powerful.,Productivity,"$12,054 USD raised 109%",Ended
1219,https://www.indiegogo.com/projects/phigolf-wgt-edition/pica,Phigolf WGT Edition,Golf Simulator for Your Living Room,Productivity,"$216,444 USD raised 365%",Ended
1220,https://www.indiegogo.com/projects/the-smack-app/pica,The Smack App,Your Virtual Wake-Up Call,Productivity,$181 USD raised 1%,Ended
1221,https://www.indiegogo.com/projects/printbrush-xdr-colors-everywhere/pica,PrintBrush XDR -Colors. Everywhere.,First color inkjet printer for smartphones. Go paperless. Go truly mobile. Save the planet.,Productivity,"$686,182 USD raised 100%",Ended
1222,https://www.indiegogo.com/projects/crowdsurfer/pica,Crowdsurfer,"Crowdsurfer is an augmented reality friends, business and events locator app for all mobile devices. Launching globally in May/June.",Productivity,$110 AUD raised 0%,Ended
1223,https://www.indiegogo.com/projects/deafnationgo-sign-language-on-the-go/pica,DeafNationGO: Sign Language on the Go!,DeafNationGo is a mobile sign language app that offers quality signed content for landmarks and tourist attractions across the globe.,Productivity,$295 USD raised 1%,Ended
1224,https://www.indiegogo.com/projects/phree-make-the-world-your-paper--2/pica,Phree - Make the world your paper,"The world’s first unrestricted, high resolution, write-virtually-anywhere mobile input device.",Productivity,"$1,526,543 USD raised 1,066%",Ended
1225,https://www.indiegogo.com/projects/p8s-fastest-air-purifier-with-nanoscale-filter/pica,P8S: Fastest Air Purifier with Nanoscale Filter,Purify Interior Air of A Car in 2 Min|Protect You and Your Family from Air Pollution and Allergens,Productivity,"$30,621 USD raised 285%",Ended
1226,https://www.indiegogo.com/projects/meritocracy/pica,Meritocracy,"Cloud Review System for scientists, businesses, and students",Productivity,$790 USD raised 5%,Ended
1227,https://www.indiegogo.com/projects/choptainer-cutting-board-extension-bins/pica,ChopTainer: Cutting Board Extension Bins,"These all-in-one containers collect, rinse, measure and pour ingredients chopped on a cutting board.",Productivity,"$35,379 USD raised 278%",Ended
1228,https://www.indiegogo.com/projects/investing-in-youth/pica,Investing in youth.,"I need dollar dollar, a dollar is what I need
And if I share with you my story would you share your dollar with me.",Productivity,$4 USD raised 0%,Ended
1229,https://www.indiegogo.com/projects/cyberghost-vpn-nospyproxy--2/pica,CyberGhost VPN NoSpyProxy,Hier entsteht das weltweit erste #NoSpyProxy-Datencenter außerhalb NSA-Reichweite!,Productivity,"€135,266 EUR raised 241%",Ended
1230,https://www.indiegogo.com/projects/the-pointless-app-fight-restlessness-and-boredom/pica,The Pointless App - Fight restlessness and boredom,An app that fights restlessness and boredom by giving you pointless proposals on what to do.,Productivity,$65 USD raised 0%,Ended
1231,https://www.indiegogo.com/projects/ios-camera-app-to-automatically-de-identify-photos/pica,iOS camera app to automatically De-Identify photos,An iOS camera app that will Automatically remove all identifying features from clinical photos.,Productivity,"$2,132 USD raised 27%",Ended
1232,https://www.indiegogo.com/projects/deleting-the-digital-divide-one-computer-at-a-time/pica,Deleting The Digital Divide One Computer at a Time,A child's exposure to technology should never be          predicated by the ability to afford it.,Productivity,"$7,511 USD raised 83%",Ended
1233,https://www.indiegogo.com/projects/penultimate-x1-an-advanced-ergonomic-pen/pica,PenUltimate X1: An Advanced Ergonomic Pen,A hyper ergonomic pen built to truly accommodate your hand. Redefining a 220 year old design.,Productivity,"$3,229 USD raised 297%",Ended
1234,https://www.indiegogo.com/projects/it-s-all-about-powered-communication/pica,it's all about powered communication,Secure and powerful e-mail client and processing engine. Encrypted communication and centralize content. Give new life to your e-mail,Productivity,$125 USD raised 0%,Ended
1235,https://www.indiegogo.com/projects/yoma-your-own-mobile-app/pica,YOMA - Your Own Mobile App,YOMA is for the public persona in you. Build native mobile apps for your public in minutes.,Productivity,€4 EUR raised 0%,Ended
1236,https://www.indiegogo.com/projects/eros-magnetic-cap-refillable-felt-tip-pen/pica,EROS - Magnetic cap refillable felt tip pen,A new aluminium refillable felt tip pen with a magnetic cap.,Productivity,"$13,168 HKD raised 105%",Ended
1237,https://www.indiegogo.com/projects/hootoo-tripmate-elite-5-in-1-portable-traveling-device/pica,HooToo TripMate Elite - 5-in-1 Portable Traveling Device,"Create your very own secure personal cloud to share files between mobile devices.  Wi-Fi Hotspot. Built-in wall charger with a rechargable 6,000mAh power bank.",Productivity,"$3,467 USD raised 43%",Ended
1238,https://www.indiegogo.com/projects/remarkable-digital-technology-for-nonprofits/pica,Remarkable Digital Technology for Nonprofits,"Innovation to introduce remarkable digital technology for nonprofits, philanthropists & donors.",Productivity,$10 USD raised 0%,Ended
1239,https://www.indiegogo.com/projects/fabtotum-prism/pica,FABtotum PRISM,"World's first All-in-One Low Cost Stereolithography 3D printer platform. 3D print, Mill, Scan",Productivity,"$157,571 USD raised 256%",Ended
1240,https://www.indiegogo.com/projects/higame-pc-affordable-high-performance-mini-pc/pica,HiGame PC - Affordable high-performance mini PC,"Latest Intel i7 w/ Radeon RX Vega M graphics, customisable RAM/storage & flexible I/O options.",Productivity,"$410,125 USD raised 777%",Ended
1241,https://www.indiegogo.com/projects/pocketduino-innovation-from-your-pocket/pica,PocketDuino - Innovation from your pocket,"Anytime, 
anywhere, 
You can make innovation happen!
The PocketDuino is an Arduino compatible development board.",Productivity,"$8,843 USD raised 111%",Ended
1242,https://www.indiegogo.com/projects/out-of-town-still-buy-a-round-with-drinksnap/pica,Out of town?  Still buy a round!  With DrinkSnap!,Buy your friends a drink anytime from anywhere at any DrinkSnap establishment.  This one's on you!,Productivity,$36 USD raised 0%,Ended
1243,https://www.indiegogo.com/projects/international-mobile-app-for-models/pica,International Mobile App For Models,"Int'l Resource App for Models. Submit Photos to Top Agents, Every Resource Category, Contest, & MORE",Productivity,$685 USD raised 0%,Ended
