,project_link,title,description,card_category,amt_raised,days_left
0,https://www.indiegogo.com/projects/sens-ai-make-your-brain-sharper-faster-better/pica,"Sens.ai: Make Your Brain Sharper, Faster, Better","Supercharge Your Brain for Calm, Focused Performance In Just 20 Mins, 3 Times / Week.",Productivity,"$118,464 USD raised 395%",29 days left
1,https://www.indiegogo.com/projects/foldable-stand-rotatable-portable-durable/pica,"Foldable Stand - Rotatable, portable & durable","Rotatable, foldable, portable, and durable, the only stand you need for your phones and tablets",Productivity,"$6,214 USD raised 124%",19 days left
2,https://www.indiegogo.com/projects/ep500-ep500pro-the-new-era-of-home-backup-power/pica,EP500&EP500Pro - The New Era of Home Backup Power,5100Wh LiFePO4/Up to 2400W MPPT Solar/Seamless UPS/240V Split Phase/6000+ Cycles/App & OTA Upgrade,Productivity,"$4,194,871 USD raised 31,172%",
3,https://www.indiegogo.com/projects/firewalla-purple-gigabit-cyber-security/pica,Firewalla Purple: Gigabit Cyber Security,"Next-generation smart firewall for home and work, that's simple to use, powerful and affordable",Productivity,"$562,873 USD raised 869%",
4,https://www.indiegogo.com/projects/memoryos-greatly-improve-your-memory-the-fun-way/pica,memoryOS: Greatly Improve Your Memory the Fun Way!,"AI-powered memory improvement gamified app, co-developed by 2X World Memory Champion",Productivity,"$707,709 USD raised 6,420%",
5,https://www.indiegogo.com/projects/kimblade-nano-wiper-blade-solution-completed/pica,KIMBLADE NANO: Wiper blade solution completed,Reinvented wiper blade reinforced by Carbon Nanotube & Graphene. Never mind wipers.,Productivity,"$458,819 USD raised 4,140%",
6,https://www.indiegogo.com/projects/win-max-2021-handheld-game-laptop-for-aaa-games/pica,WIN Max 2021: Handheld Game Laptop for AAA Games,"Pro processor. Pro gamepad. Pro performance. The ultimate handheld game Laptop. Intel & AMD,Win10 OS",Productivity,"$6,084,365 HKD raised 2,745%",
7,https://www.indiegogo.com/projects/pendora-48-bits-in-one-tool/pica,PENDORA: 48 Bits in One Tool,The World Most Minimalist Screwdriver Set,Productivity,"¥3,922,910 JPY raised 1,308%",2 days left
8,https://www.indiegogo.com/projects/vboard-turn-your-dull-display-into-a-touchscreen/pica,VBoard: Turn Your Dull Display Into A Touchscreen,An Interactive Whiteboard System that calibrates on your displays to allow tablet-like annotating,Productivity,"$56,641 USD raised 549%",
9,https://www.indiegogo.com/projects/the-keyboardio-model-100--4/pica,The Keyboardio Model 100,"A customizable ergonomic, mechanical keyboard that works the way you do",Productivity,"$980,098 USD raised 902%",
10,https://www.indiegogo.com/projects/aura-mate-pro-best-premium-updated-scanner-yet/pica,Aura Mate Pro - Best Premium Updated Scanner Yet,"Dual-Camera, Document Camera, Use With Zoom, 16 MegaPixel, Curve-Flatten Tech, Scan A Book In 8 Mins",Productivity,"$661,381 USD raised 51,238%",
11,https://www.indiegogo.com/projects/harmonic-scanner-candlestick-patterns-scanner/pica,Harmonic Scanner - Candlestick Patterns Scanner,We built the most powerful Technical Analysis Pattern Scanner for retail traders.,Productivity,"$5,465 USD raised 104%",
12,https://www.indiegogo.com/projects/a-betterbook-a-notebook-but-better/pica,"A BetterBook, a Notebook, But Better","BetterBook is a better notebook to work and study with, an ideal companion for computers and tablets",Productivity,"£62,769 GBP raised 1,970%",
13,https://www.indiegogo.com/projects/gigadrive-world-s-fastest-external-ssd/pica,GigaDrive: World’s Fastest External SSD,"with 2,800MB/s transfer speeds ⚡ and heat control technology.",Productivity,"$1,714,961 USD raised 8,840%",
14,https://www.indiegogo.com/projects/ficihp-keyboard-with-12-6-inches-touchscreen--2/pica,FICIHP Keyboard with 12.6 inches Touchscreen,The built-in 12.6“ touchscreen and USB expansion will meet your needs for the multi-screen display,Productivity,"$437,821 SGD raised 6,383%",
15,https://www.indiegogo.com/projects/picopc-tiny-desktop-pc-win10-linux-4k-computer/pica,"PicoPC: Tiny Desktop PC,  Win10 Linux 4K Computer","Tiny 4K Desktop PC, 4 x USB Ports, 2.7GHz Intel CPU, 8GB RAM, Dual-Band WiFi. For Games, Work, Study",Productivity,"$3,357,926 HKD raised 4,823%",
16,https://www.indiegogo.com/projects/foci-wearable-that-boosts-your-focus/pica,FOCI : Wearable that Boosts Your Focus,Understand your real mind as you work and improve 4 types of focus.,Productivity,"$1,499,935 USD raised 1,168%",
17,https://www.indiegogo.com/projects/cardongle-usb-car-pc-computer-dongle-for-vehicles/pica,CarDongle: USB Car PC Computer Dongle for Vehicles,"CarDongle is an Octa-core USB Car Donggle Computer Stick, Up to 4GB RAM 64gb ROM, Mic, MicroSD slot",Productivity,"$4,937,186 HKD raised 48,254%",
18,https://www.indiegogo.com/projects/inomad-stay-connected-via-5g-anywhere-you-go/pica,"iNomad - Stay Connected via 5G, Anywhere You Go","The World's First 5G MiFi VPN Router: Light, Portable, Fast, and Secure",Productivity,"$147,878 USD raised 239%",
19,https://www.indiegogo.com/projects/metmo-pen-a-dual-threaded-pen-for-curious-minds/pica,MetMo Pen: A dual threaded pen for curious minds,Precision machined to be the smoothest and most satisfying pen you'll ever own!,Productivity,"£156,996 GBP raised 3,062%",
20,https://www.indiegogo.com/projects/this-pan-unlocks-countless-culinary-possibilities/pica,This pan unlocks countless culinary possibilities,"We've developed a pan that is safer, more durable, and most of all, more ""non-stick.""",Productivity,"$446,541 USD raised 3,006%",
21,https://www.indiegogo.com/projects/glo-most-efficient-portable-4k-wireless-monitor/pica,Glo:Most Efficient Portable 4k wireless Monitor,"144Hz Refresh Rate,1ms Response Time,WirelessHD connection,24 Hours Battery life,4K UHD,ZERO latency",Productivity,"$125,573 USD raised 1,776%",
22,https://www.indiegogo.com/projects/gpd-win3-the-world-s-1st-handheld-aaa-game-console/pica,GPD WIN3:The world’s 1st handheld AAA game console,"1165G7/1135G7 processor, 16GB LPDDR4x 4266, 1TB NVMe SSD, 60 FPS for the latest AAA games",Productivity,"$34,076,565 HKD raised 12,785%",
23,https://www.indiegogo.com/projects/infinity-planner-more-than-just-a-planner/pica,Infinity Planner - More than Just a Planner,Weekly & Monthly Planner | Habit Tracker | Mind Map | Kanban Board | Doodle Pages | Project Tracker,Productivity,"$65,739 USD raised 980%",
24,https://www.indiegogo.com/projects/metmo-grip-the-world-s-most-satisfying-grip--2/pica,MetMo Grip - The World's Most Satisfying Grip!,An icon of industry re-imagined to get a grip on the 21st Century,Productivity,"£497,064 GBP raised 7,684%",
25,https://www.indiegogo.com/projects/tickrmeter-physical-stock-tickers-on-your-desk/pica,TickrMeter: Physical Stock Tickers on your desk!,"E-Paper-based stock ticker for your home & office. Real-time stocks, cryptocurrencies & forex pairs",Productivity,"€440,535 EUR raised 7,606%",
26,https://www.indiegogo.com/projects/xfanic-a-11-in-1-desk-organizer-with-hub-stand/pica,Xfanic: A 11-in-1 Desk Organizer With Hub & Stand,8 Ports | 2 Slots | Foldable Stand | Boost Working Productivity | Keep Your Desk Stay Neat,Productivity,"$319,798 HKD raised 1,985%",Ended
27,https://www.indiegogo.com/projects/hybro-h400-hybrid-2-in-1-screwdriver-set--2/pica,HYBRO H400 : HYBRID 2-IN-1 SCREWDRIVER SET,“A Real Game Changer For Your Hand Tool Experiences”,Productivity,"$9,184 USD raised 1,837%",4 days left
28,https://www.indiegogo.com/projects/goofoo-cube-world-s-first-easy-to-use-3d-printer--2/pica,Goofoo Cube- World's First  Easy-to-use 3D Printer,"Fast, fun, and easy to use. Cube makes it easy for anyone to get started with 3D printing in minutes",Productivity,"$38,841 USD raised 3,884%",8 days left
29,https://www.indiegogo.com/projects/morefine-s500-powerful-amd-ryzen-9-5900hx-mini-pc/pica,MOREFINE S500: Powerful AMD Ryzen 9 5900HX Mini PC,Vega 8 Graphics/32G+1TB NVMe/WIFI6/BT5.2/4K@60HZ/Dual RJ45/Win 10/Expandability/Compact/Low-noise,Productivity,"$1,995,909 HKD raised 19,443%",Ended
30,https://www.indiegogo.com/projects/bentsai-b10-mini-the-finest-printer-for-business/pica,BENTSAI B10 mini - The Finest Printer for Business,195g | WiFi Connection | One Click Print | 42mL=2 Million Letters | Prints Anything | Any Surfaces,Productivity,"$58,598 USD raised 5,822%",
31,https://www.indiegogo.com/projects/hunt3-0-the-smallest-multi-function-flashlight/pica,HUNT3.0: The Smallest Multi-Function Flashlight,"Small, powerful, and compact, with a flashlight on one end and a tiny pry bar on the other.",Productivity,"£105,655 GBP raised 1,962%",
32,https://www.indiegogo.com/projects/mini-milktea-mug-take-the-tea-shop-home--3/pica,MINI MilkTea Mug - Take the Tea Shop Home,Milk Tea Maker / Milk Frother / Teapot / Coffee Maker,Productivity,"$120,325 USD raised 23,202%",
33,https://www.indiegogo.com/projects/jingpad-world-s-first-consumer-level-linux-tablet/pica,JingPad: World’s First Consumer-Level Linux Tablet,ARM-based tablet JingPad A1 powered by JingOS an especially developed open-source Linux distribution,Productivity,"$220,157 USD raised 954%",
34,https://www.indiegogo.com/projects/remotable-portable-desk-for-better-productivity/pica,Remotable: Portable desk for better productivity,"Be healthy & productive - sit, stand & work anywhere around the house",Productivity,"£18,848 GBP raised 135%",
35,https://www.indiegogo.com/projects/the-most-beautiful-easy-to-use-3d-printer-ever/pica,"The Most Beautiful, Easy To Use 3D Printer EVER!",Be one of the first to own a Plybot 3D Printer.,Productivity,"$180,672 USD raised 334%",
36,https://www.indiegogo.com/projects/cheatkard-electrical-engineering-tools/pica,CheatKard - Electrical Engineering Tools,The Professional Pocket Reference That Saves You Time & Keeps You Focused - Ultimate Reference Cards,Productivity,"£73,499 GBP raised 4,136%",
37,https://www.indiegogo.com/projects/the-fastest-way-to-network-pay-and-get-payed/pica,"The Fastest Way to Network, Pay, and Get Payed.",We want to help people reduce their time wasted with our revolutionary mobile app.,Productivity,Fr 370 CHF raised 1%,23 days left
38,https://www.indiegogo.com/projects/capsule-most-versatile-portable-tire-pump/pica,Capsule - Most Versatile & Portable Tire Pump,150psi/10.3bar/ One-click Operation/ 4 Different Modes/ Flashlight/ LCD Display,Productivity,"$230,226 HKD raised 5,446%",
39,https://www.indiegogo.com/projects/marksmith-titanium-modern-edc-permanent-marker/pica,MARKSMITH Titanium - Modern EDC Permanent Marker,World's first titanium retractable permanent marker is so much more than a pen.,Productivity,"$230,870 USD raised 2,217%",Ended
40,https://www.indiegogo.com/projects/bodo-the-all-in-one-modular-charging-station/pica,Bodo: The All-in-One Modular Charging Station,Meet the modular WFH station. Organize and charge your devices to streamline the way you work,Productivity,"$21,560 USD raised 108%",32 hours left
41,https://www.indiegogo.com/projects/wyn-pen-1-0-the-most-minimalist-pen/pica,WYN PEN 1.0 -  The Most Minimalist Pen,Beautifully machined from a single block of aluminum and will last a lifetime.,Productivity,"$155,420 USD raised 1,595%",
42,https://www.indiegogo.com/projects/timechi-your-smart-productivity-tool/pica,TimeChi - Your smart productivity tool,Meet the Fitbit for your productivity; a deep work companion tool based on proven timeboxing methods,Productivity,"$328,964 AUD raised 1,803%",
43,https://www.indiegogo.com/projects/elesense-computer-monitor-light-bar/pica,Elesense Computer Monitor Light Bar,Asymmetrical Design | Auto Dimming | 2.4GHz Wireless Controller | No Screen Glare,Productivity,"$238,865 CAD raised 4,361%",Ended
44,https://www.indiegogo.com/projects/mover-erase-combo-reusable-thumbsized-whiteboard/pica,Mover Erase Combo - Reusable Thumbsized Whiteboard,Analog Productivity System with Digital Flexibility for Breaking Ideas Down and Focus.,Productivity,"$234,288 USD raised 4,496%",
45,https://www.indiegogo.com/projects/busybox-smart-sign-for-interruption-free-work/pica,BusyBox - Smart Sign For Interruption-Free Work,"BusyBox — Work uninterrupted at home w/ BusyBox, the wireless status sign controlled from your phone",Productivity,"$332,202 USD raised 3,142%",Ended
46,https://www.indiegogo.com/projects/thundergo-most-compact-powerful-200w-gan-charger/pica,ThunderGo:Most Compact & Powerful 200W GaN Charger,"200W, 3 USB-C Ports, 1 USB-A Port, No More Tangled Cables, Charge All Your Devices At The Same Time",Productivity,"$153,158 HKD raised 1,675%",
47,https://www.indiegogo.com/projects/autofocusing-10w-dual-laser-cutter-engraver/pica,Autofocusing 10W Dual-Laser Cutter & Engraver,Wainlux L3 Laser Downsized Industrial Power At Your Tabletop. Versatile DIY Tool.,Productivity,"$3,422,456 HKD raised 4,183%",
48,https://www.indiegogo.com/projects/mutesync-a-physical-mute-button-for-video-calls/pica,mütesync: a physical mute button for video calls,"Our lighted, physical mute button toggles mute and shows others when your mic is live!",Productivity,"$59,769 USD raised 550%",
49,https://www.indiegogo.com/projects/luxi-mx1-plus-human-centric-portable-task-light--2/pica,LUXI MX1 PLUS : Human-Centric Portable Task Light,"Light up your workspace anytime, anywhere. Protect your vision and enhance your productivity.",Productivity,"$10,201 USD raised 196%",
50,https://www.indiegogo.com/projects/septem-pure-titanium-camp-grill-hotplate/pica,SEPTEM: Pure Titanium Camp Grill & Hotplate,Specifically designed to suit the needs of lightweight camping and bushcraft expeditions.,Productivity,"£63,695 GBP raised 1,224%",
51,https://www.indiegogo.com/projects/pocket-3-a-modular-and-full-featured-handheld-pc/coming_soon/pica,Pocket 3: A Modular and Full-featured Handheld PC,"Modular I/O ports, 1195G7 CPU, 16GB memory, 1TB disk space, 3 USB ports, supports serial port module",Productivity,,
52,https://www.indiegogo.com/projects/eati-anti-bacterial-titanium-utensil-multi-tool/pica,EATI: Anti-Bacterial Titanium Utensil Multi-Tool,The most useful camping utensil made from pure titanium. Cook & Eat you just need one.,Productivity,"£64,792 GBP raised 1,739%",
53,https://www.indiegogo.com/projects/onestudios-p1-high-power-intel-10th-gen/pica,OneStudios P1 : High Power Intel 10th Gen,"Intel i3/i5/i7 10th Gen/Intel UHD Graphics/
WiFi6/16Gb DDR4/256-512 NVME/4K@60Hz/Thunderbolt3/Win 10",Productivity,€485 EUR raised 2%,23 days left
54,https://www.indiegogo.com/projects/tipen-2-0-redefining-the-minimal-edc-pen/pica,TIPEN 2.0: Redefining the Minimal EDC Pen.,An ultra-portable writing instrument. Grade 5 titanium body with Silicon Nitride Ceramic tip.,Productivity,"£120,903 GBP raised 2,246%",
55,https://www.indiegogo.com/projects/tactigon-skin-stylish-3d-wearable-mouse/pica,Tactigon SKIN: stylish 3D wearable mouse,"Programmable gesture and voice control for your PC, PowerPoint, 3D CAD, Gaming, Robotics and more",Productivity,"€17,046 EUR raised 150%",
56,https://www.indiegogo.com/projects/edge-the-first-modular-work-from-home-kit/pica,EDGE - The First Modular Work From Home Kit,"Your workstation, anywhere. Guaranteed to boost your productivity.",Productivity,"€519,242 EUR raised 5,009%",
57,https://www.indiegogo.com/projects/nuka-eternal-stationery/pica,nuka ETERNAL STATIONERY,"Fully rewritable and waterproof notebook.
Eternal metal pencil.",Productivity,"$236,617 USD raised 655%",
58,https://www.indiegogo.com/projects/ti-straw-titanium-bamboo-to-eliminate-plastic/pica,Ti-STRAW: Titanium & Bamboo to Eliminate Plastic,The eco-friendly & anti-bacterial straw designed to last forever!,Productivity,"£1,281 GBP raised 106%",
59,https://www.indiegogo.com/projects/1page-to-help-you-search-less-sell-more/pica,"1Page to help you search less, sell more!","Minutes before every meeting, get a curated 1Page summary about the person and the company everytime",Productivity,$20 USD raised 0%,47 days left
60,https://www.indiegogo.com/projects/the-most-innovative-you-can-find-yes-a-ruler/pica,"The Most Innovative You Can Find. Yes, A Ruler!",A laser engraved aerospace aluminium ruler at a practical 30° angle. For designers and for everyone.,Productivity,"£99,255 GBP raised 3,248%",
61,https://www.indiegogo.com/projects/packed-pixels-4k-15-6-portable-laptop-monitor/pica,Packed Pixels 4K - 15.6'' Portable Laptop Monitor,The new powerhouse 4K monitor from the original portable monitor manufacturer.,Productivity,"$277,110 USD raised 173%",Ended
62,https://www.indiegogo.com/projects/la-marque-the-lifetime-brass-pen-collection/pica,La Marque - The Lifetime Brass Pen Collection,The refined brass pen & pencil collection. Made in Italy & created to accompany on your life journey,Productivity,"$428,268 USD raised 1,436%",
63,https://www.indiegogo.com/projects/muteme-the-illuminated-mute-button/pica,MuteMe - The Illuminated Mute Button,An Illuminated Mute Button for Virtual Calls that Increases Productivity and Decreases Interruptions,Productivity,"$289,231 USD raised 1,032%",
64,https://www.indiegogo.com/projects/razorbooster-effortless-way-to-clean-your-razor/pica,Razorbooster: Effortless Way To Clean Your Razor,"Clean and sharpen your razor blade. As result, get smooth skin, save money, and the environment!",Productivity,"$37,754 USD raised 701%",
65,https://www.indiegogo.com/projects/exlicon-groundbreaking-multi-shape-design-tool/pica,Exlicon - Groundbreaking multi-shape design tool,"Draw all shapes with ease such as ellipses, circles, golden ratio, pentagons, hexagons, and more.",Productivity,"$600,820 HKD raised 6,978%",
66,https://www.indiegogo.com/projects/onexplayer-best-performing-handheld-game-console/pica,ONEXPLAYER: Best Performing Handheld Game Console,"8.4 Inch 2.5K IPS Screen, Supreme Performance, Ultimate Experience | Best Performing Game Console.",Productivity,"$16,085,429 HKD raised 8,043%",Ended
67,https://www.indiegogo.com/projects/vector-motion-design-support-our-beta-app/pica,Vector motion design - support our beta app!,"NoodleLoupe -a soon to  be released vector animation app, is now in Beta",Productivity,$155 USD raised 1%,4 days left
68,https://www.indiegogo.com/projects/linkpro-portable-11-in-1-working-hub-stand/pica,LinkPro: Portable 11-in-1 Working Hub Stand,A portable working hub stand that helps you stay productive and ergo-comfortable wherever you are!,Productivity,"$287,307 HKD raised 704%",
69,https://www.indiegogo.com/projects/okami-3-in-1-ipad-foldable-workstation/pica,OKAMI : 3-in-1 iPad Foldable Workstation,"Ultimate Case & Stand, for iPad Pro & New iPad Air",Productivity,"£13,127 GBP raised 256%",
70,https://www.indiegogo.com/projects/driveslide-attach-your-hard-drive-to-your-laptop/pica,DriveSlide: Attach Your Hard Drive to Your Laptop,"A two-piece, locking laptop attachment. Holds your hard drives and hubs, 
so you don’t have to.",Productivity,"$43,479 USD raised 136%",
71,https://www.indiegogo.com/projects/helpgate--3/pica,HelpGate,HelpGate app - revolutionary personal assistant in your pocket,Productivity,€135 EUR raised 0%,39 days left
72,https://www.indiegogo.com/projects/x-pick-neodymium-n52-guitar-bass/pica,X-PICK - NEODYMIUM N52 - Guitar & Bass,Your Friends Won't Believe Their Eyes! Use Science to Have Much More from your Instrument! Amaze All,Productivity,"€1,860 EUR raised 37%",Ended
73,https://www.indiegogo.com/projects/remake-mini-desktop-whiteboard-undated-planner/pica,REMAKE: Mini Desktop Whiteboard - Undated Planner,A weekly planner you can reuse again and again. You may never need to buy another one again!,Productivity,"$55,421 HKD raised 214%",
74,https://www.indiegogo.com/projects/gogoleash-all-in-one-dog-leash-and-collar-system--2/pica,GoGoLeash: All-in-One Dog Leash and Collar System,The World's Most Advanced Dog-Walking and Training Tool For Your Good Boy or Girl.,Productivity,"$352,669 USD raised 6,540%",
75,https://www.indiegogo.com/projects/the-x-crowd--2/pica,The X Crowd,The X Crowd: a big step into the world of Adult Crowdfunding,Productivity,€175 EUR raised 1%,14 days left
76,https://www.indiegogo.com/projects/the-arc-edition-pen-celebrating-the-struggle/pica,The Arc Edition Pen. Celebrating the struggle.,A pen made with wood from America's civil rights history.,Productivity,"$55,011 USD raised 426%",
77,https://www.indiegogo.com/projects/airview2-4k-wirelesshd-touchscreen-monitor/pica,AirView2 - 4K wirelessHD touchscreen monitor,Samsung DeX | Mac | Windows | Android | ZERO-lag | mm-Wave | Plug-n-Play | Huawei | Nintendo Switch,Productivity,"$1,532,205 HKD raised 3,563%",
78,https://www.indiegogo.com/projects/4tb-2tb-high-speed-ssd-for-all-usb-c-devices/pica,4TB & 2TB HIGH SPEED SSD for All USB-C Devices,SPEEDSSD is the 4TB high-speed stick drive with read & write speed of 1050MB/s for creatives.,Productivity,"$443,533 USD raised 7,142%",
79,https://www.indiegogo.com/projects/mover-erase-mini-whiteboard-on-the-palm/pica,Mover Erase - Mini Whiteboard on the Palm,"Washable, Reusable Silicon whiteboard with patented magnetic design. Workspace in your control.",Productivity,"$185,448 USD raised 2,916%",
80,https://www.indiegogo.com/projects/vava-portable-ssd-touch/pica,VAVA Portable SSD Touch,AES 256-bit & fingerprint encryption. 1TB & 2TB. 540MB/s transfer speed. Multi-device compatibility.,Productivity,"$716,300 USD raised 3,675%",
81,https://www.indiegogo.com/projects/blusaigon-mother-of-pearl-legacy-pen-collection/pica,BLUSAIGON Mother of Pearl Legacy Pen Collection,"Treasure Of The Sea. The Handcrafted, Luxury Pens You Can Hold Forever.",Productivity,"$12,190 USD raised 216%",
82,https://www.indiegogo.com/projects/cnc-one-the-easiest-way-to-start-cnc-machining/pica,CNC ONE: The Easiest Way to Start CNC Machining,"Mill metal, wood and acrylics with quality CNC machines made in Germany",Productivity,"€321,549 EUR raised 532%",
83,https://www.indiegogo.com/projects/introducing-dubbel/pica,Introducing dubbel,"The folding, portable workstation to change desks forever",Productivity,£485 GBP raised 0%,Ended
84,https://www.indiegogo.com/projects/tibeast-professional-robotic-dog-at-a-toy-s-price/pica,"TiBeast, Professional Robotic Dog at a Toy's Price","Professional 12 DOF robotic dog with powerful software and SDK, joystick support, camera & speakers!",Productivity,"$1,624 USD raised 32%",Ended
85,https://www.indiegogo.com/projects/the-smart-mouse/pica,The Smart Mouse,"A leap forward in the way you use your computer : speed, polyvalence speed, versatility, and more ..",Productivity,€330 EUR raised 0%,Ended
86,https://www.indiegogo.com/projects/powering-military-veteran-and-family-employment/pica,Powering Military Veteran and Family Employment,Help Fund Empower Employ to give Military Veterans and their families quality career opportunities!,Productivity,"$10,810 USD raised 11%",Ended
87,https://www.indiegogo.com/projects/enten-smart-headphones-for-smarter-focus-habits/pica,Enten: Smart Headphones for Smarter Focus Habits,"Using EEG brainwave sensors, Enten measures your focus patterns so you work smarter, not longer.",Productivity,"$230,821 USD raised 893%",
88,https://www.indiegogo.com/projects/moft-float-invisible-stand-case-for-ipad-pro/pica,MOFT Float: Invisible Stand&Case For iPad Pro,Fits for iPad Pro and iPad Air 2020 | Adjustable Height | Unlimited Angles.,Productivity,"$574,194 USD raised 5,004%",
89,https://www.indiegogo.com/projects/germanicum-arminius-damascus-knives/pica,Germanicum Arminius Damascus knives,The most sharp and durable Damascus knife series we have ever made.,Productivity,"€204,607 EUR raised 2,496%",
90,https://www.indiegogo.com/projects/floor-plan-bot/pica,Floor Plan Bot,"A handhold floor plan scanner, Automatically generate floor plan instantly.",Productivity,"$3,850 AUD raised 70%",Ended
91,https://www.indiegogo.com/projects/shine-ultra-next-gen-portable-powerful-scanner/pica,Shine Ultra - Next Gen Portable & Powerful Scanner,"13 Full-sized Megapixels, 340DPI, Patented 'Curve-flatten' Technology, Scan A Book In 10 Minutes",Productivity,"$25,698,282 HKD raised 158,766%",
92,https://www.indiegogo.com/projects/charles-fan-film-post-production/pica,CHARLES FAN FILM- POST PRODUCTION,This campaign is to cover Post Production costs,Productivity,"$8,000 USD raised 27%",Ended
93,https://www.indiegogo.com/projects/m-button/pica,M-Button,mute/unmute in a heartbeat,Productivity,$174 USD raised 6%,Ended
94,https://www.indiegogo.com/projects/moft-z-the-4-in-1-invisible-sit-stand-laptop-desk/pica,MOFT Z: The 4-in-1 invisible sit-stand laptop desk,It helps you develop a healthy sit-stand working posture in an easy way.,Productivity,"$1,446,038 USD raised 11,442%",
95,https://www.indiegogo.com/projects/monarch-by-goodskrew-elevate-the-way-you-screw/pica,Monarch by Goodskrew: Elevate the Way You Screw,"Versatile EDC screwdriver, stunning collectible showpiece or fidget spinner? It's all of the above.",Productivity,"$4,270 HKD raised 11%",46 days left
96,https://www.indiegogo.com/projects/brili-routines-your-app-for-daily-routine-success--2/pica,Brili Routines: Your App For Daily Routine Success,Join us and support the launch of our next generation app - created together with the ADHD community,Productivity,"$16,244 USD raised 41%",Ended
97,https://www.indiegogo.com/projects/planogol-life-management-to-transform-your-story/pica,Planogol: Life Management to Transform Your Story,Story need to change? Balanced life? Dreaming in the right areas? Setting and achieving good goals?,Productivity,"$9,086 USD raised 45%",Ended
98,https://www.indiegogo.com/projects/maxtand-portable-sit-to-stand-desk-monitor-arm/pica,Maxtand: Portable sit-to-stand desk & monitor arm,Maxtand turns any desk or table into an adjustable desk of up to 15 inches and saves lots of space.,Productivity,"$77,713 USD raised 878%",
