,story,story_txt,img_len,video_len,campaign_count,campaign_city,url
0,"<div class=""routerContentStory-storyBody"" data-v-1df7bf5a=""""><p></p><h3><span style=""font-size: 15px; line-height: 1.45em; color: rgb(34, 34, 34);""></span></h3><p><b>Hello, my name is Joe Francisco. I am an amateur powerlifter by hobby and lifetime athlete by choice. I am a kinesiology major, slowly but surely closing on the light at the end of the tunnel of that degree. Why am I starting now at such a young age? Because there is no time like the present. Running my own gym and helping others to progress in their lives is my dream. Helping others is my true passion. This is my outlet, and my greatest opportunity to bring the sport and lifestyle of powerlifting to the masses.</b><b></b></p><p>This campaign will be funding, for the most part, the startup costs of opening the facility, which include some equipment cost and rent costs for the warehouse itself. In addition, it will get the legalities sorted out with insurance and regulations. </p><p><b>Like I said previously, this is my true passion and calling in life. I want to start now, I want to help as many people as possible, and the sooner we can reach or preferably surpass our goal of only $1200, the sooner we can make this facility a reality. </b></p><p>Now the part you guys are waiting to hear about… opening a gym can be pretty costly. However, a warehouse gym does not require a lot of cost in the energy department, as the roll up garage door will act as the main light source. My goal is to have 3 cage style racks. This will keep the gym capable of rotating lifters through stations without it getting clogged. With that said, 2 deadlift platforms means the total barbells needed is up to 5. What good are barbells without weight to put on them, eh? At the current going price about $2.00USD having the plates to keep up with that many lifting platforms would be about 2000 lbs in weight plates.</p><p><b>As the list of optimal equipment needed grows, I have decided on the following:</b></p><p><b>3 standard squat cages on amazon, averaging $350-400 before tax and shipping</b></p><p><b><a href=""http://www.amazon.com/Powerline-PPR200X-PowerLine-Power-Rack/dp/B000VLRVSC/ref=sr_1_2?ie=UTF8&amp;qid=1393197433&amp;sr=8-2&amp;keywords=squat+cage"" rel=""noopener nofollow"">http://www.amazon.com/Powerline-PPR200X-PowerLine-Power-Rack/dp/B000VLRVSC/ref=sr_1_2?ie=UTF8&amp;qid=1393197433&amp;sr=8-2&amp;keywords=squat+cage</a><br/></b></p><p><b>2 8x8 deadlift platforms, on average about $100 total for the plywood sheets needed 4 sheets per platform. </b></p><p><b>2 bench press benches approx $290.00 before tax </b></p><p><b><a href=""http://www.amazon.com/Valor-Athletics-Inc-BF-Olympic/dp/B0031Q5BTA/ref=pd_sbs_sg_5?ie=UTF8&amp;refRID=1P3FCGH3TA11AA415QB3"" rel=""noopener nofollow"">http://www.amazon.com/Valor-Athletics-Inc-BF-Olympic/dp/B0031Q5BTA/ref=pd_sbs_sg_5?ie=UTF8&amp;refRID=1P3FCGH3TA11AA415QB3</a><br/></b></p><p><b>5 olympic 7' bars. with center knurl. medium-aggressive knurl. 28.5mm width bar, brand is tentative, i would rather much high quality bars, like those from rogue, or even eleiko, but starting up money will be tight. </b></p><p><b><a href=""http://www.amazon.com/Cap-Barbell-Pound-Solid-7-Feet/dp/B000RNSDKE/ref=sr_1_4?s=sporting-goods&amp;ie=UTF8&amp;qid=1393197889&amp;sr=1-4&amp;keywords=olympic+bar"" rel=""noopener nofollow"">http://www.amazon.com/Cap-Barbell-Pound-Solid-7-Feet/dp/B000RNSDKE/ref=sr_1_4?s=sporting-goods&amp;ie=UTF8&amp;qid=1393197889&amp;sr=1-4&amp;keywords=olympic+bar</a><br/></b></p><p><b>Total cost comes out to ~$2750.00 at current market rates, prices subject to change with market value. Price for weight plates will vary with manufacture, brand new will run about $2.00/lbs and used can be for around $.50/lbs, we expect a total of about 2500 lbs needed to run all stations, but probably more. </b></p><p><b><br/></b></p><p><b>Contributing to this campaign will gain you some pretty awesome things! First off, we will begin to generate merchandise, and when we do, we will send you a super awesome t-shirt or tank with our name and logo! If you contribute $50.00 or more you will get the t-shirt or tank, along with membership to the gym for 3 full months and have the ability to attend any 1 of the classes or clinics of your choice! With a donation of $100.00 or more you will receive the same t-shirt and privileges, however the membership lasts 6 months, and you gain access to 2 classes or clinics. Keeping with the current trend, if you contribute $500.00 or more you will receive a super awesome Continental Standard: Power and Fitness t shirt or tank, however your membership to the gym will now last 2 years, you will have access to 3 classes or clinics, and you will receive free 1 on 1 personal coaching for 6 months</b>. </p><p>As a full time student we all know how difficult it is to find work, let alone time to get a workout in. For me, this fulfills both problems, but it will also help many of the people I compete with and go to school with by providing jobs to a college town that is bombarded by industrialism and very specific businesses. In 6 months to 1 year I will be able to overcome the hurdle of getting started and pushing the gym in a position to start flourishing as a business. </p><p>We need as much popularity as possible. Yes donating money is nice, but not all of us can just give people money for things they only believe in from a distance. Please spread the word, if you are a powerlifter, or know any powerlifters in the area, or have any family that is an athlete that live in the area. Remember who we are, give us a shout out; send them the link to this campaign. We will also accept any and all donations of gym equipment you may have just laying around, and you will be compensated for your donation appropriately. Above all, if you see this, please share the crap out of it! Even if you have no interest in the idea, there may be plenty others that you know or maybe you don't know that would be! Thank you!</p><p><b>Update 2/20/2014: We have finally decided on a target date to open, we are going to target June of 2014. We of course need your help and support in order to make this happen, but I know this is possible! Youtube content is in the pipeline, and the final logo is being worked on for the first round of t-shirts. So please check us out, share us, and above all, if you can any donation will help! </b></p><p><b>Update 2/23/2014: We have come up with a tentative list of equipment that will be needed. Of course this may not be final, and prices may change, however this will give more light to what we expect to need in order to operate at the capacity we would like to. I am working on finalizing the block scheduling for hours of operation, and will post that in the coming days! </b></p><p></p></div>","Hello, my name is Joe Francisco. I am an amateur powerlifter by hobby and lifetime athlete by choice. I am a kinesiology major, slowly but surely closing on the light at the end of the tunnel of that degree. Why am I starting now at such a young age? Because there is no time like the present. Running my own gym and helping others to progress in their lives is my dream. Helping others is my true passion. This is my outlet, and my greatest opportunity to bring the sport and lifestyle of powerlifting to the masses.This campaign will be funding, for the most part, the startup costs of opening the facility, which include some equipment cost and rent costs for the warehouse itself. In addition, it will get the legalities sorted out with insurance and regulations. Like I said previously, this is my true passion and calling in life. I want to start now, I want to help as many people as possible, and the sooner we can reach or preferably surpass our goal of only $1200, the sooner we can make this facility a reality. Now the part you guys are waiting to hear about… opening a gym can be pretty costly. However, a warehouse gym does not require a lot of cost in the energy department, as the roll up garage door will act as the main light source. My goal is to have 3 cage style racks. This will keep the gym capable of rotating lifters through stations without it getting clogged. With that said, 2 deadlift platforms means the total barbells needed is up to 5. What good are barbells without weight to put on them, eh? At the current going price about $2.00USD having the plates to keep up with that many lifting platforms would be about 2000 lbs in weight plates.As the list of optimal equipment needed grows, I have decided on the following:3 standard squat cages on amazon, averaging $350-400 before tax and shippinghttp://www.amazon.com/Powerline-PPR200X-PowerLine-Power-Rack/dp/B000VLRVSC/ref=sr_1_2?ie=UTF8&qid=1393197433&sr=8-2&keywords=squat+cage2 8x8 deadlift platforms, on average about $100 total for the plywood sheets needed 4 sheets per platform. 2 bench press benches approx $290.00 before tax http://www.amazon.com/Valor-Athletics-Inc-BF-Olympic/dp/B0031Q5BTA/ref=pd_sbs_sg_5?ie=UTF8&refRID=1P3FCGH3TA11AA415QB35 olympic 7' bars. with center knurl. medium-aggressive knurl. 28.5mm width bar, brand is tentative, i would rather much high quality bars, like those from rogue, or even eleiko, but starting up money will be tight. http://www.amazon.com/Cap-Barbell-Pound-Solid-7-Feet/dp/B000RNSDKE/ref=sr_1_4?s=sporting-goods&ie=UTF8&qid=1393197889&sr=1-4&keywords=olympic+barTotal cost comes out to ~$2750.00 at current market rates, prices subject to change with market value. Price for weight plates will vary with manufacture, brand new will run about $2.00/lbs and used can be for around $.50/lbs, we expect a total of about 2500 lbs needed to run all stations, but probably more. Contributing to this campaign will gain you some pretty awesome things! First off, we will begin to generate merchandise, and when we do, we will send you a super awesome t-shirt or tank with our name and logo! If you contribute $50.00 or more you will get the t-shirt or tank, along with membership to the gym for 3 full months and have the ability to attend any 1 of the classes or clinics of your choice! With a donation of $100.00 or more you will receive the same t-shirt and privileges, however the membership lasts 6 months, and you gain access to 2 classes or clinics. Keeping with the current trend, if you contribute $500.00 or more you will receive a super awesome Continental Standard: Power and Fitness t shirt or tank, however your membership to the gym will now last 2 years, you will have access to 3 classes or clinics, and you will receive free 1 on 1 personal coaching for 6 months. As a full time student we all know how difficult it is to find work, let alone time to get a workout in. For me, this fulfills both problems, but it will also help many of the people I compete with and go to school with by providing jobs to a college town that is bombarded by industrialism and very specific businesses. In 6 months to 1 year I will be able to overcome the hurdle of getting started and pushing the gym in a position to start flourishing as a business. We need as much popularity as possible. Yes donating money is nice, but not all of us can just give people money for things they only believe in from a distance. Please spread the word, if you are a powerlifter, or know any powerlifters in the area, or have any family that is an athlete that live in the area. Remember who we are, give us a shout out; send them the link to this campaign. We will also accept any and all donations of gym equipment you may have just laying around, and you will be compensated for your donation appropriately. Above all, if you see this, please share the crap out of it! Even if you have no interest in the idea, there may be plenty others that you know or maybe you don't know that would be! Thank you!Update 2/20/2014: We have finally decided on a target date to open, we are going to target June of 2014. We of course need your help and support in order to make this happen, but I know this is possible! Youtube content is in the pipeline, and the final logo is being worked on for the first round of t-shirts. So please check us out, share us, and above all, if you can any donation will help! Update 2/23/2014: We have come up with a tentative list of equipment that will be needed. Of course this may not be final, and prices may change, however this will give more light to what we expect to need in order to operate at the capacity we would like to. I am working on finalizing the block scheduling for hours of operation, and will post that in the coming days!",0.0,0,"1 Campaign
                |","Fullerton, United States",https://www.indiegogo.com/projects/continental-standard-power-and-fitness/pica
0,"<div class=""routerContentStory-storyBody"" data-v-1df7bf5a=""""><div id=""content"">
<p><span>""Be a New Orleanian Wherever You Are,"" reads my favorite T-shirt. Given to me by a fellow Cajun visiting San Antonio after Hurricane Katrina, the little piece of home could not have proven more precious in the months and years to come. Every time I put it on, it reminds me of the city that raised me, the people who love me, and the food that I cannot wait to share with the rest of the world.</span></p>
<p>Shrimpfest is the first step in my ability to bring authentic Cajun cooking to Texas, a place that sometimes feels oddly far from the city I call home. Randall and I have been accepted with open arms as food vendors at this seaside event, and if we are able to raise the money here to purchase the food we need to make it happen, we will be the first Cajun booth to show a presence here. The event coordinator, Kristine, is genuinely excited at the prospect of our attendance and contribution to the festival. It is the first event at which I will showcase my true Cajun roots through the passion I have found for cooking as a means of telling a story. Unmistakeabaly authentic red beans and rice, scrumptious seafood gumbo, playful shrimp-stuffed andouille corndogs, and sinfully sweet beignets will all grace the menu at this event. Not only will it be a chance for me to express my Cajun creativity to the public, but it will also be the first of many steps in raising the capital we will need to open our very own restaurant in San Antonio. Le Rêve, as we have thought of naming it, truly would be a dream, an opportunity to bring elevated Cajun cuisine to a city that longs for it, a city full of other displaced New Orleanians just like myself (Kickstarter project #2 to come soon)!</p>
<p><span>We already know we can make some serious cash to put towards our restaurant dreams. At an event with over 4,000 in attendance last year, we will be the only vendors offering Cajun cuisine. Alongside the endless booths selling shrimp kabobs and fried shrimp baskets will be a couple with a real passion for food that excites and goes beyond the norm in every possible way, food that is carefully crafted by people who really know flavor! Based on statistics from last year's shrimp fest, we are expecting to serve at least 100-150 meals each day of the 2 day event. We are planning to price each of our menu items at an easy $5, putting our sales projections at around $1500 for the weekend. With our food costs only around $500, that is a serious profit! Check out the Shrimpfest page from 2012 here:<a href=""http://www.seadriftchamber.com/site/2012-shrimpfest/"" rel=""noopener nofollow"" target=""_blank"">http://www.seadriftchamber.com/site/2012-shrimpfest/</a>.</span></p>
<p><span>Our Cajun fare will fit right into the feel of the event, alongside fishing tournaments for the young and the old, outdoor sporting events like volleyball and horseshoes, and the ever popular summer beauty pageants. There will be plenty of fun to be had in the sun for all in attendance, and we are looking for the opportunity to be one of the lucky food vendors gracing the event and just making people happy. Happiness is a warm gumbo, and that is what we are trying to bring to  Shrimpfest 2013.</span></p>
<p><span>We cannot wait to share our food and our joy with the people of Seadrift and, hopefully, in turn, the lovely people of San Antonio and beyond. We would love to share our unique journey with you and pledge to share all we can about the road we take to get there. Regular project updates will be made here, and we hope that you enjoy all of the rewards in store! Please join us on our culinary journey by aiding in our ability to purchase the product we need to feed all these hungry folks! And if you're in the neighborhood, by all means, come check us out! Laissez le bons temps rouler!</span></p>
</div>
<div class=""row twoup""> </div></div>","""Be a New Orleanian Wherever You Are,"" reads my favorite T-shirt. Given to me by a fellow Cajun visiting San Antonio after Hurricane Katrina, the little piece of home could not have proven more precious in the months and years to come. Every time I put it on, it reminds me of the city that raised me, the people who love me, and the food that I cannot wait to share with the rest of the world.
Shrimpfest is the first step in my ability to bring authentic Cajun cooking to Texas, a place that sometimes feels oddly far from the city I call home. Randall and I have been accepted with open arms as food vendors at this seaside event, and if we are able to raise the money here to purchase the food we need to make it happen, we will be the first Cajun booth to show a presence here. The event coordinator, Kristine, is genuinely excited at the prospect of our attendance and contribution to the festival. It is the first event at which I will showcase my true Cajun roots through the passion I have found for cooking as a means of telling a story. Unmistakeabaly authentic red beans and rice, scrumptious seafood gumbo, playful shrimp-stuffed andouille corndogs, and sinfully sweet beignets will all grace the menu at this event. Not only will it be a chance for me to express my Cajun creativity to the public, but it will also be the first of many steps in raising the capital we will need to open our very own restaurant in San Antonio. Le Rêve, as we have thought of naming it, truly would be a dream, an opportunity to bring elevated Cajun cuisine to a city that longs for it, a city full of other displaced New Orleanians just like myself (Kickstarter project #2 to come soon)!
We already know we can make some serious cash to put towards our restaurant dreams. At an event with over 4,000 in attendance last year, we will be the only vendors offering Cajun cuisine. Alongside the endless booths selling shrimp kabobs and fried shrimp baskets will be a couple with a real passion for food that excites and goes beyond the norm in every possible way, food that is carefully crafted by people who really know flavor! Based on statistics from last year's shrimp fest, we are expecting to serve at least 100-150 meals each day of the 2 day event. We are planning to price each of our menu items at an easy $5, putting our sales projections at around $1500 for the weekend. With our food costs only around $500, that is a serious profit! Check out the Shrimpfest page from 2012 here:http://www.seadriftchamber.com/site/2012-shrimpfest/.
Our Cajun fare will fit right into the feel of the event, alongside fishing tournaments for the young and the old, outdoor sporting events like volleyball and horseshoes, and the ever popular summer beauty pageants. There will be plenty of fun to be had in the sun for all in attendance, and we are looking for the opportunity to be one of the lucky food vendors gracing the event and just making people happy. Happiness is a warm gumbo, and that is what we are trying to bring to  Shrimpfest 2013.
We cannot wait to share our food and our joy with the people of Seadrift and, hopefully, in turn, the lovely people of San Antonio and beyond. We would love to share our unique journey with you and pledge to share all we can about the road we take to get there. Regular project updates will be made here, and we hope that you enjoy all of the rewards in store! Please join us on our culinary journey by aiding in our ability to purchase the product we need to feed all these hungry folks! And if you're in the neighborhood, by all means, come check us out! Laissez le bons temps rouler!",0.0,0,"1 Campaign
                |","San Antonio, United States",https://www.indiegogo.com/projects/bayou-bistro-does-shrimpfest/pica
