,story,story_txt,img_len,video_len,campaign_count,campaign_city,url
0,"<div class=""routerContentStory-storyBody"" data-v-1df7bf5a=""""><p></p><p><span style=""color: rgb(106, 106, 106); font-family: 'Benton Sans', Helvetica, sans-serif; letter-spacing: 0px; background-color: initial;""><b>How it Came to be</b></span></p><p><span style=""background-color: initial;""><span style=""letter-spacing: 0px;"">After the recent negative attention at <a href=""http://ashevilleblog.com/waking-life-espresso-is-under-fire/"" rel=""noopener nofollow""></a></span><a href=""http://ashevilleblog.com/waking-life-espresso-is-under-fire/"" rel=""noopener nofollow"" style=""color: rgb(106, 106, 106); font-family: 'Benton Sans', Helvetica, sans-serif; letter-spacing: 0px;"" target=""_blank"">Waking Life Espresso</a><span style=""letter-spacing: 0px;"">, Sarah Winkler, a two and half year employee, found herself leaving a job and many customers she loved.  Unwilling to compromise her morals
and accept a severance, Sarah instead has decided to turn this into a positive for
herself, her customers, and the community. With the collaborative efforts of two like minded friends, Trade and Lore  Asheville  was founded</span><span style=""letter-spacing: 0px;"">! </span></span></p><p></p><p></p><p><img class=""lazy"" data-src=""https://c1.iggcdn.com/indiegogo-media-prod-cld/image/upload/c_limit,w_695/v1443717293/brw7j7t7wmzdvhofgbwb.jpg"" src="""" style=""width: 281.485px; height: 379px;""/></p><p><br/></p><p><b>Along Came Lindsey!</b></p><p>Sarah went to visit Lindsey Pitman of <a href="".https://www.facebook.com/thedailypressclt?fref=ts"" rel=""noopener nofollow"" target=""_blank"">The Daily Press CLT</a> and while sitting down over coffee an idea was formed. Within minutes it had been decided, there was no better way to show gratitude to the community that has surrounded Sarah with support than to open a specialty coffee shop with a focus on empowerment, equality, and an initiative for advocacy.</p><p></p><p><img class=""lazy"" data-src=""https://c1.iggcdn.com/indiegogo-media-prod-cld/image/upload/c_limit,w_695/v1443717569/ne4xv3ghszid2aqfdsdx.jpg"" src="""" style=""width: 423.341px; height: 282px;""/></p><p><b><br/></b></p><p><b>What we'll do</b></p>Though unfortunate, this situation has given the community the opportunity to express its commitment to inclusiveness, equality, and awareness.  Continuing that commitment, Trade and Lore Coffee will provide the same high quality coffee product while also supporting those ideals. We intend to work closely with like-minded local non-profits and businesses, to provide a fair living wage for staff, to source our ingredients locally - using <a href=""http://www.mtnairroasting.com/"" rel=""noopener nofollow"" target=""_blank"">Mountain Air Roasting</a> coffee, local bakers, and purveyors.<div>
<br/><div>
<br/><p><b>Why your support is crucial</b></p>
<p>In order to get our doors open, we'll will need to need to finish the upfit, purchase equipment locally, prepare the storefront, and hire and train additional staff. We've already secured a majority of our
$65,000 budget from local lenders and working second jobs, That leaves $15,000 we are hoping to fund from the community.</p>
<p>We will be posting our progress along the way.  Though there may be bumps in the road, we are committed to this idea and the community it will create.</p>
<p><br/></p>
<p><b>Other ways you can help</b></p>
<p>Funds raised in this campaign are crucial, but there's are many ways you can help! <a href=""https://www.facebook.com/tradeandlore"" rel=""noopener nofollow"" target=""_blank"">Like us on facebook</a> and share this campaign!  Email us directly at tradeandlore@gmail.com with any resources, advice, or supportive words you might have.</p>
<p><br/></p>
<p><i><b><span style=""color: rgb(106, 106, 106); font-family: 'Benton Sans', Helvetica, sans-serif; letter-spacing: 0px; background-color: initial;"">Huge Thank You and we look forward to serving you soon!</span><br/></b></i></p>
<p><i><b>Sarah, Lindsey, and Brock</b></i></p>
</div>
</div></div>","How it Came to beAfter the recent negative attention at Waking Life Espresso, Sarah Winkler, a two and half year employee, found herself leaving a job and many customers she loved.  Unwilling to compromise her morals
and accept a severance, Sarah instead has decided to turn this into a positive for
herself, her customers, and the community. With the collaborative efforts of two like minded friends, Trade and Lore  Asheville  was founded! Along Came Lindsey!Sarah went to visit Lindsey Pitman of The Daily Press CLT and while sitting down over coffee an idea was formed. Within minutes it had been decided, there was no better way to show gratitude to the community that has surrounded Sarah with support than to open a specialty coffee shop with a focus on empowerment, equality, and an initiative for advocacy.What we'll doThough unfortunate, this situation has given the community the opportunity to express its commitment to inclusiveness, equality, and awareness.  Continuing that commitment, Trade and Lore Coffee will provide the same high quality coffee product while also supporting those ideals. We intend to work closely with like-minded local non-profits and businesses, to provide a fair living wage for staff, to source our ingredients locally - using Mountain Air Roasting coffee, local bakers, and purveyors.

Why your support is crucial
In order to get our doors open, we'll will need to need to finish the upfit, purchase equipment locally, prepare the storefront, and hire and train additional staff. We've already secured a majority of our
$65,000 budget from local lenders and working second jobs, That leaves $15,000 we are hoping to fund from the community.
We will be posting our progress along the way.  Though there may be bumps in the road, we are committed to this idea and the community it will create.

Other ways you can help
Funds raised in this campaign are crucial, but there's are many ways you can help! Like us on facebook and share this campaign!  Email us directly at tradeandlore@gmail.com with any resources, advice, or supportive words you might have.

Huge Thank You and we look forward to serving you soon!
Sarah, Lindsey, and Brock",2.0,0,"2 Campaigns
                |","Asheville, United States",https://www.indiegogo.com/projects/trade-and-lore-coffee--2/pica
0,"<div class=""routerContentStory-storyBody"" data-v-1df7bf5a=""""><p>Founded in 2008, Queer Burners is to create venues, events and forums to network LGBTQ++ camps and groups with queer Burning Man culture (10 Principles). By working together, we can make our collective burn experiences profound and uniquely meaningful.<br/></p><p></p><ul>
<li>to create a leadership network allowing members of the community to support and communicate each other; strengthen projects and share resources.<br/>
</li>
<li>to create community programs that that give back and help build enterprise concepts for bettering our world. To x-post, support, network existing programs supporting great ideas already out there.<br/>
</li>
<li>to be the flying buttress when needed and be the extra arms when called upon. To help in lifting projects up when they need and gently help let go when the time is right, but never losing hope by finding support from each other physically or through cheer.<br/>
</li>
</ul><div>We have taken on projects that range in supporting new projects in the community and starting ones with huge implications. </div><div>
<ul>
<li>2012 to 2015 Queer Burner Leadership summits annually - avg 40 people</li>
<li>2014 paused to 2016 Safe Place for resources for people in distress</li>
<li>2015 to 2016 retreat events - 2015: 90 people &amp; 2016: 150 people</li>
</ul>
<div>The campaign is to recapture a small amount of $1000 lost in the production of the last Queer Burner Retreat. We collected $15,000 but some unforeseen expenses camp up. </div>
</div><div>We need to complete steps into creating a legal entity for the project because with money coming in it needs to go to administrative charges for the legal costs and taxes for a California based corporate entity for 2016. The anticipated expenses of that is less than $1,500.</div><div>
<p></p>
<p><img class=""lazy"" data-src=""https://c1.iggcdn.com/indiegogo-media-prod-cld/image/upload/c_limit,w_695/v1466286918/bannerset__etcnzo.jpg"" src="""" style=""""/></p>We will be running a couple fund raisers over the next 6 months to bring in finances for those expenses as well as getting ready for the 2017 Queer Burner Retreat: it will focus on fostering the creation of art in the community. </div><div>To see some of the people on a dynamic list of leadership participants in the Queer Burners Leadership Network check out:<br/><a href=""http://queerburners.com/quire-qbln/the-hive-mind-of-queer-burners"" rel=""noopener nofollow"">http://queerburners.com/quire-qbln/the-hive-mind-of-queer-burners</a><br/><br/>Queer Burner Leadership Network on Facebook:<br/><a href=""https://www.facebook.com/groups/240956916002164/"" rel=""noopener nofollow"">https://www.facebook.com/groups/240956916002164/</a><br/>
</div><div>Queer Burners public facing Page:<br/><a href=""https://www.facebook.com/gayburners/"" rel=""noopener nofollow"">https://www.facebook.com/gayburners/</a><br/>
</div><div>Queer Burners public discussion Group:<br/><a href=""https://www.facebook.com/groups/250295325089174/"" rel=""noopener nofollow"">https://www.facebook.com/groups/250295325089174/</a><br/>
</div><div>We have regional Queer Burners pages for: Australia, New York City, Atlanta, Southern California, San Francisco and Las Vegas with more to come. <br/>
</div><div>To see some of our recent video based meetings saved on YouTube:<br/><a href=""https://www.youtube.com/playlist?list=PLnAoxrDCrQDfliec9WBBVr5i59JtLutIJ"" rel=""noopener nofollow"">https://www.youtube.com/playlist?list=PLnAoxrDCrQDfliec9WBBVr5i59JtLutIJ</a><br/>
</div><div><br/></div></div>","Founded in 2008, Queer Burners is to create venues, events and forums to network LGBTQ++ camps and groups with queer Burning Man culture (10 Principles). By working together, we can make our collective burn experiences profound and uniquely meaningful.
to create a leadership network allowing members of the community to support and communicate each other; strengthen projects and share resources.

to create community programs that that give back and help build enterprise concepts for bettering our world. To x-post, support, network existing programs supporting great ideas already out there.

to be the flying buttress when needed and be the extra arms when called upon. To help in lifting projects up when they need and gently help let go when the time is right, but never losing hope by finding support from each other physically or through cheer.

We have taken on projects that range in supporting new projects in the community and starting ones with huge implications. 

2012 to 2015 Queer Burner Leadership summits annually - avg 40 people
2014 paused to 2016 Safe Place for resources for people in distress
2015 to 2016 retreat events - 2015: 90 people & 2016: 150 people

The campaign is to recapture a small amount of $1000 lost in the production of the last Queer Burner Retreat. We collected $15,000 but some unforeseen expenses camp up. 
We need to complete steps into creating a legal entity for the project because with money coming in it needs to go to administrative charges for the legal costs and taxes for a California based corporate entity for 2016. The anticipated expenses of that is less than $1,500.

We will be running a couple fund raisers over the next 6 months to bring in finances for those expenses as well as getting ready for the 2017 Queer Burner Retreat: it will focus on fostering the creation of art in the community. To see some of the people on a dynamic list of leadership participants in the Queer Burners Leadership Network check out:http://queerburners.com/quire-qbln/the-hive-mind-of-queer-burnersQueer Burner Leadership Network on Facebook:https://www.facebook.com/groups/240956916002164/
Queer Burners public facing Page:https://www.facebook.com/gayburners/
Queer Burners public discussion Group:https://www.facebook.com/groups/250295325089174/
We have regional Queer Burners pages for: Australia, New York City, Atlanta, Southern California, San Francisco and Las Vegas with more to come. 
To see some of our recent video based meetings saved on YouTube:https://www.youtube.com/playlist?list=PLnAoxrDCrQDfliec9WBBVr5i59JtLutIJ",1.0,0,"6 Campaigns
                |","San Francisco, CA, United States",https://www.indiegogo.com/projects/building-on-community-leadership-lgbtq/pica
0,"<div class=""routerContentStory-storyBody"" data-v-1df7bf5a=""""><p></p><p style=""text-align: center;""><b></b></p><p></p><p><b>Help us to make traveling easier and cheaper!</b></p><p><b>WHO WE ARE?</b> We
are a group of young people from Bosnia and Herzegovina who are involved in
some NGO's in Sarajevo, and who wants to make traveling much easier and much
cheaper for students from our country so that they get the same possibility to
travel and see the world like their friends from other parts in Europe. We also
are enthusiastic believers in the WORK AND TRAVEL program, and we also intend
to help young people to earn money while traveling.</p>
<p><b>WHY ARE WE DO THAT?</b> In
the last 25 years our country went through heavy times. In the beginning of the
nineties a huge war broke out, and most of the country’s economy broke down.
People lose their jobs and later even life’s. Most of today's students were
born at the time and didn't have the possibility to grow up as their friends in
the rest of Europe. About 80% of the young people in Bosnia and Herzegovina
didn't travel abroad or more than 200 kilometers from their home. We want to
give same opportunities and we want to help young people to travel Europe and
the World as cheap and easy as possible.</p>
<p><b>HOW DO WE DO THAT?</b> By
organizing bigger groups we intend to lower the price as low as possible, and
to give the best service for a fair price. Our guideline is clear! We believe
that no trip inside Europe need to be more than 199€ (240US$) and this idea
will help us to create new products and give more possibilities to our client’s
so that they will also be part of our whole planning process.</p>
<p><b>WHAT IS OUR VISION?</b> Our
vision is to start small and grow step by step, so that every year we will have
at least 3000 costumers that will participate in our trips and learn the
culture of Europe. We also plan to rise the number of young people participate
in the Work and Travel program in USA, Australia, Canada and New Zealand. Our
goal is that 500 young people from Bosnia and Herzegovina, Serbia and
Montenegro use the possibility and travel in this far locations to work, learn
and travel.</p>
<p><b>WHERE WE WILL SPEND THE MONEY THAT WE WILL RAISE?</b> The money that we will raise we will initial use to register
our company as an Ltd. And to pay initial costs of starting the company (Rentals,
equipment, renovation etc.). We also plan to use 30% of the money for marketing
costs, so that our company and our products get visibility and that our popularity
can grow.</p>
<p><b>WHAT ARE WE OFFER YOU?</b> If
you support our aim, we will use the possibility to thank you in a special way!
We will have a WALL OF SUPPOERTERS’ in our agency where everyone who will
donate more than <b>5 USD</b> get its
picture and its name there. Every of our future customers will know who supported
this idea and helped us start business! Everyone who donate more than <b>10 USD </b>will additionally to the wall of
supporters also get a personalized postcard from Sarajevo, Bosnia and
Herzegovina. Everyone who gives more than <b>50
USD</b> will also additionally get from us a personalized gift package with
different local products (jewelry, souvenirs, magnet’s, book’s etc.). Everyone
who donate <b>100 USD</b> or more will get
a special gift package with TRADITIONAL HAND MADE and UNIQUE art pieces from
Sarajevo. Please while donating indicate your e-mail to: <a href=""mailto:travello.agency@gmail.com"" rel=""noopener nofollow"">travello.agency@gmail.com</a> and the reference.</p>
<p>THANK YOU for reading this post and we hope that you will decide to
help us starting Ur own business and help other people to see the world.</p><br/></div>","Help us to make traveling easier and cheaper!WHO WE ARE? We
are a group of young people from Bosnia and Herzegovina who are involved in
some NGO's in Sarajevo, and who wants to make traveling much easier and much
cheaper for students from our country so that they get the same possibility to
travel and see the world like their friends from other parts in Europe. We also
are enthusiastic believers in the WORK AND TRAVEL program, and we also intend
to help young people to earn money while traveling.
WHY ARE WE DO THAT? In
the last 25 years our country went through heavy times. In the beginning of the
nineties a huge war broke out, and most of the country’s economy broke down.
People lose their jobs and later even life’s. Most of today's students were
born at the time and didn't have the possibility to grow up as their friends in
the rest of Europe. About 80% of the young people in Bosnia and Herzegovina
didn't travel abroad or more than 200 kilometers from their home. We want to
give same opportunities and we want to help young people to travel Europe and
the World as cheap and easy as possible.
HOW DO WE DO THAT? By
organizing bigger groups we intend to lower the price as low as possible, and
to give the best service for a fair price. Our guideline is clear! We believe
that no trip inside Europe need to be more than 199€ (240US$) and this idea
will help us to create new products and give more possibilities to our client’s
so that they will also be part of our whole planning process.
WHAT IS OUR VISION? Our
vision is to start small and grow step by step, so that every year we will have
at least 3000 costumers that will participate in our trips and learn the
culture of Europe. We also plan to rise the number of young people participate
in the Work and Travel program in USA, Australia, Canada and New Zealand. Our
goal is that 500 young people from Bosnia and Herzegovina, Serbia and
Montenegro use the possibility and travel in this far locations to work, learn
and travel.
WHERE WE WILL SPEND THE MONEY THAT WE WILL RAISE? The money that we will raise we will initial use to register
our company as an Ltd. And to pay initial costs of starting the company (Rentals,
equipment, renovation etc.). We also plan to use 30% of the money for marketing
costs, so that our company and our products get visibility and that our popularity
can grow.
WHAT ARE WE OFFER YOU? If
you support our aim, we will use the possibility to thank you in a special way!
We will have a WALL OF SUPPOERTERS’ in our agency where everyone who will
donate more than 5 USD get its
picture and its name there. Every of our future customers will know who supported
this idea and helped us start business! Everyone who donate more than 10 USD will additionally to the wall of
supporters also get a personalized postcard from Sarajevo, Bosnia and
Herzegovina. Everyone who gives more than 50
USD will also additionally get from us a personalized gift package with
different local products (jewelry, souvenirs, magnet’s, book’s etc.). Everyone
who donate 100 USD or more will get
a special gift package with TRADITIONAL HAND MADE and UNIQUE art pieces from
Sarajevo. Please while donating indicate your e-mail to: travello.agency@gmail.com and the reference.
THANK YOU for reading this post and we hope that you will decide to
help us starting Ur own business and help other people to see the world.",0.0,0,"1 Campaign
                |","Sarajevo, Bosnia and Herzegovina",https://www.indiegogo.com/projects/student-travel-service/pica
0,"<div class=""routerContentStory-storyBody"" data-v-1df7bf5a=""""><p>I'm a 26-year-old travel coordinator from Kathmandu, Nepal, who was lucky enough to survive the earthquake with family and home intact. Others were not so lucky. I'm working to provide immediate relief to the many people in Kathmandu who are currently without food and shelter by handing out food, water, and blankets in Dharmasthali, Kathmandu, where many have been displaced. Government aid has been very, very slow to arrive and it's so hard to see my people like this -- hungry and living outside out of fear or because they have nowhere else to go. Larger organizations are helping as well, but they can only do so much and there are thousands of people who still need help. In the meantime, Nepalis have to work together to help each other.</p><p>I'd like to do my part in providing immediate assistance through food, water, and blankets. If you'd like to help me in this effort, please consider donating. All funds from this page will go directly to these efforts, and I will update with photos and information along the way. <br/><br/>I've set the goal for this campaign to be $1000 and ten days, so I can use funds as soon as possible. Anything raised above that will be used for the same purpose <br/><br/>Thank you!<br/>Rijen Shahi</p></div>","I'm a 26-year-old travel coordinator from Kathmandu, Nepal, who was lucky enough to survive the earthquake with family and home intact. Others were not so lucky. I'm working to provide immediate relief to the many people in Kathmandu who are currently without food and shelter by handing out food, water, and blankets in Dharmasthali, Kathmandu, where many have been displaced. Government aid has been very, very slow to arrive and it's so hard to see my people like this -- hungry and living outside out of fear or because they have nowhere else to go. Larger organizations are helping as well, but they can only do so much and there are thousands of people who still need help. In the meantime, Nepalis have to work together to help each other.I'd like to do my part in providing immediate assistance through food, water, and blankets. If you'd like to help me in this effort, please consider donating. All funds from this page will go directly to these efforts, and I will update with photos and information along the way. I've set the goal for this campaign to be $1000 and ten days, so I can use funds as soon as possible. Anything raised above that will be used for the same purpose Thank you!Rijen Shahi",0.0,0,"1 Campaign
                |","Kathmandu, Nepal",https://www.indiegogo.com/projects/blankets-and-foods-for-dharmasthali-kathmandu/pica
