,story,story_txt,img_len,video_len,campaign_count,campaign_city,url
0,"<div class=""routerContentStory-storyBody"" data-v-1df7bf5a=""""><div>
<strong> </strong><h3>Gypsy Road Fundraiser</h3>
<p>My Name is Garry Anthony, I am a Singer Songwriter/Truck Driver from Montreal, Quebec, I recently bought my copyright and master tapes for an album I recorded with 2M records and Mega Producer Bill Szawlowski called Gypsy Road, but I had to go to court to be heard in front of a judge first, my court case was picked up by TV Court Show L'Arbitre, they played the title song Gypsy Road and I won my case in front of thousands of Quebecers, in the following days after the show aired I got a thousand views of my YouTube video for Gypsy Road and hundreds of friend requests on Facebook all congratulating me  telling me how much they like the record, and asking where they could by the album... the problem is I haven't had records to sell for a long time, and after buying my copyright back plus Lawyer fees I am short of money to pay for a duplication of 500 CDs, that is what brought me to try a Fund Raising Campaign to get the $2000 we need to get 500 CDs made.</p>
<p>I truly believe in Gypsy Road, it is very well recorded album, and is still relevant in todays country music market, we will give the CD a fresh new look and hopefully re-release it in the spring of 2015. By booking shows, selling records, and using the new social media that was not available when we first launched it, Gypsy Road will get the chance it deserves.</p>
<p>We would like to offer a few perks to the people who would donate to our campaign, for people that donate $100 we will give 2 copies of the CD, and for people that donate $500 we will play a live private show at their home, and for people that wish us well but can't donate, all we ask is for some help getting the word out about our campaign, we would really appreciate anything you can do. </p>
<p>
</p>
<p><br/></p>
<p>Mon nom est Garry Anthony , je suis un chanteur
compositeur/Chauffeur de Camion de Montréal, Québec , j'ai récemment acheté mes droits d'auteur et
de bandes maîtresses pour un album que je ai enregistré avec des
 2M Records et Producteur Mega Bill Szawlowski appelé Gypsy
Road , mais j'ai dû aller au tribunal pour être entendu devant un juge , mon
procès a été repris par la télévision Court Appelez l' Arbitre , ils ont joué
le titre de la chanson Gypsy Road et je ai gagné mon cas devant des milliers de
Québécois , dans les jours suivants après le spectacle j'ai diffusé un millier
de points de vue de ma vidéo YouTube pour Gypsy Road et des centaines de
demandes d'amis sur Facebook tous me féliciter de me dire combien ils aiment le
dossier , et en demandant où ils pouvaient par l'album ... le problème est que
je ne ai pas eu enregistrements à vends pour une longue période, et après
l'achat de mes droits d'auteur de retour, plus avocat frais , je suis à court
d' argent pour payer une duplication de 500 CD , ce est ce qui m'a amené à
essayer une campagne collecte de fonds pour obtenir le $ 2,000 nous avons
besoin pour obtenir 500 CD .</p>
<p>Je crois vraiment dans Gypsy Road , il est très bien
enregistré l'album , et est toujours d'actualité dans le marché de la musique
Country d'aujourd'hui , nous allons donner le CD un nouveau look et je espère
rééditer au printemps de 2015. En réservant spectacles , vente CD , et en
utilisant les nouveaux médias sociaux qui ne était pas disponible lorsque nous
avons lancé il , Gypsy Road auront la chance qu'il mérite.</p>
<p>Nous aimerions offrir quelques avantages pour les gens
qui donneraient à notre campagne , pour les personnes qui font don de $ 100 ,
nous allons donner deux copies du CD , et pour les personnes qui font don de $
500 , nous allons jouer un show privé direct à leur domicile , et pour les gens
qui nous veulent du bien mais ne peut pas faire un don , tout ce que nous demandons,
ce est un peu d'aide à passer le mot au sujet de notre campagne, vous pouvez
utiliser les outils de parts IndieGoGo , nous apprécierions.</p>

 <p><br/></p> </div> <div> <h3><br/></h3>
</div></div>","Gypsy Road Fundraiser
My Name is Garry Anthony, I am a Singer Songwriter/Truck Driver from Montreal, Quebec, I recently bought my copyright and master tapes for an album I recorded with 2M records and Mega Producer Bill Szawlowski called Gypsy Road, but I had to go to court to be heard in front of a judge first, my court case was picked up by TV Court Show L'Arbitre, they played the title song Gypsy Road and I won my case in front of thousands of Quebecers, in the following days after the show aired I got a thousand views of my YouTube video for Gypsy Road and hundreds of friend requests on Facebook all congratulating me  telling me how much they like the record, and asking where they could by the album... the problem is I haven't had records to sell for a long time, and after buying my copyright back plus Lawyer fees I am short of money to pay for a duplication of 500 CDs, that is what brought me to try a Fund Raising Campaign to get the $2000 we need to get 500 CDs made.
I truly believe in Gypsy Road, it is very well recorded album, and is still relevant in todays country music market, we will give the CD a fresh new look and hopefully re-release it in the spring of 2015. By booking shows, selling records, and using the new social media that was not available when we first launched it, Gypsy Road will get the chance it deserves.
We would like to offer a few perks to the people who would donate to our campaign, for people that donate $100 we will give 2 copies of the CD, and for people that donate $500 we will play a live private show at their home, and for people that wish us well but can't donate, all we ask is for some help getting the word out about our campaign, we would really appreciate anything you can do. 



Mon nom est Garry Anthony , je suis un chanteur
compositeur/Chauffeur de Camion de Montréal, Québec , j'ai récemment acheté mes droits d'auteur et
de bandes maîtresses pour un album que je ai enregistré avec des
 2M Records et Producteur Mega Bill Szawlowski appelé Gypsy
Road , mais j'ai dû aller au tribunal pour être entendu devant un juge , mon
procès a été repris par la télévision Court Appelez l' Arbitre , ils ont joué
le titre de la chanson Gypsy Road et je ai gagné mon cas devant des milliers de
Québécois , dans les jours suivants après le spectacle j'ai diffusé un millier
de points de vue de ma vidéo YouTube pour Gypsy Road et des centaines de
demandes d'amis sur Facebook tous me féliciter de me dire combien ils aiment le
dossier , et en demandant où ils pouvaient par l'album ... le problème est que
je ne ai pas eu enregistrements à vends pour une longue période, et après
l'achat de mes droits d'auteur de retour, plus avocat frais , je suis à court
d' argent pour payer une duplication de 500 CD , ce est ce qui m'a amené à
essayer une campagne collecte de fonds pour obtenir le $ 2,000 nous avons
besoin pour obtenir 500 CD .
Je crois vraiment dans Gypsy Road , il est très bien
enregistré l'album , et est toujours d'actualité dans le marché de la musique
Country d'aujourd'hui , nous allons donner le CD un nouveau look et je espère
rééditer au printemps de 2015. En réservant spectacles , vente CD , et en
utilisant les nouveaux médias sociaux qui ne était pas disponible lorsque nous
avons lancé il , Gypsy Road auront la chance qu'il mérite.
Nous aimerions offrir quelques avantages pour les gens
qui donneraient à notre campagne , pour les personnes qui font don de $ 100 ,
nous allons donner deux copies du CD , et pour les personnes qui font don de $
500 , nous allons jouer un show privé direct à leur domicile , et pour les gens
qui nous veulent du bien mais ne peut pas faire un don , tout ce que nous demandons,
ce est un peu d'aide à passer le mot au sujet de notre campagne, vous pouvez
utiliser les outils de parts IndieGoGo , nous apprécierions.",0.0,0,"1 Campaign
                |","Deux-Montagnes, Canada",https://www.indiegogo.com/projects/500-cd-duplication-for-gypsy-road/pica
0,"<div class=""routerContentStory-storyBody"" data-v-1df7bf5a=""""><p><strong>Remnants of Humanity</strong></p><p>""Since the election of 2016, when I've been writing new music I've found myself locked into one subject. The only lyrics coming to me were of a protesting nature. Since my tune ""Stick It In Your Ear"" started to catch on in a big way on Spotify just as T-Rump took office, it seems the time is ripe to follow my muse and share my new creations. I hope all of the lyrics become past tense before the fundraiser is finished.  I'm planning to record an extra vocal track, so I can change the them in the mix!  Speaking of changes, as you are all aware, the music business has changed drastically, as renumeration has dwindled from recorded music. I'm asking for your help to make my new project a reality.""</p><p>- Jennifer Leitham</p><p><strong>ABOUT JENNIFER LEITHAM</strong></p><p>Considered by many to be one of the finest bassists in the world, Jennifer Leitham has been a career musician for over 46 years. She is known for playing with many music world masters, including Mel Tormé, Peggy Lee, George Shearing, Doc Severinsen, Woody Herman, Benny Carter, Louis Bellson, Take 6 and k.d. lang, along with countless other greats in many genres.</p><p>She is a bassist, vocalist, composer, arranger, lyricist, and producer. Her bass lines have graced numerous movies and TV shows. Currently Jennifer leads her trio and plays in clubs and concerts around the world. Jennifer is also a member of the Stan Kenton Legacy Orchestra and the acclaimed Left Coast Ukulele Trio.</p><p>Jennifer has played on over 135 albums, including 10 albums of her own. The feature film documentary about her, ""I Stand Corrected"" was the winner of 11 best film awards as it screened at film festivals around the world in 2012. She was awarded the 2014 Community Leader Angel Award by the Center for Transyouth Health and Development at Children’s Hospital of Los Angeles. She was featured as one of the top 20 pioneers in Vanity Fair’s “Trans America” '15 Edition. In 2016, L.A. Weekly named her as as one of the “50 Most Interesting Angelinos.” Her music has been streamed on Spotify over 1.5 million times in the last year. In 2019 Jennifer spoke at the Jazz at Lincoln Center Jazz Congress, was featured on the news website Now This, and lectured and conducted a master class at the University of North Texas. </p><p><strong>Goal of the Campaign</strong></p><p>Thanks to the generosity of the contributors to the previous campaign, Jennifer was able to raise close to $20,000 and was able to produce two CDs, ""Future Christmas"" and ""MOOD(S)WINGS"". The goal of that campaign was to raise enough money to make three CDs. Audacious and quite ambitious!</p><p>The funding received was almost enough to pay for the recording and manufacture of the two CDs, but unfortunately there was no budget for promotion. We're trying a different approach this time. The goal of this ""Remnants of Humanity"" campaign is to provide enough funding to record, manufacture, promote and distribute one project. In the off chance that we reach our goal and there is any extra money, Jennifer plans to forge ahead with her long anticipated solo bass album. Depending on the income raised here, it would be released as a download only recording, but also as a CD if enough people chip in and we have a highly successful campaign!</p><p>We'll be posting video updates from out on the road on the progress of the campaign. If you're familiar with Jennifer's CDs you know that the recording quality and performance are always top notch!</p><p>We have a multitude of perks that you will receive for your contributions. Be sure to check out some of the new ones, especially at the highest levels, we've added some very unique perks. Just click on each perk to see a detailed description before you decide. Even if you don't plan on giving $5,000 or $10,000, give them a read. Who knows? Maybe you'll be inspired!</p><p>As you are probably aware, Jennifer is one of the few transgender persons who pursues a career in the Jazz world. It is a daunting task but Jennifer continues to strive for excellence in her music and performances. The contributions from this campaign will be invaluable in helping to keep Jennifer and her music visible and accessible. We thank you for your steadfast support of the music and career of Jennifer Leitham!</p><p>Some people just can't contribute, but that doesn't mean they can't help:</p><p>If you are unable to contribute to the campaign, you can still help by sharing it on your social media platforms. Please make some noise about the Remnants of Humanity campaign!</p><p>The Indiegogo share tools make it easy to help spread the word!</p><p>And that's all there is to it. Please folks, let's make this campaign a success and spread the new music all over the world! </p><p><strong>Calling all ""Remnants of Humanity""!</strong></p><h3> </h3></div>","Remnants of Humanity""Since the election of 2016, when I've been writing new music I've found myself locked into one subject. The only lyrics coming to me were of a protesting nature. Since my tune ""Stick It In Your Ear"" started to catch on in a big way on Spotify just as T-Rump took office, it seems the time is ripe to follow my muse and share my new creations. I hope all of the lyrics become past tense before the fundraiser is finished.  I'm planning to record an extra vocal track, so I can change the them in the mix!  Speaking of changes, as you are all aware, the music business has changed drastically, as renumeration has dwindled from recorded music. I'm asking for your help to make my new project a reality.""- Jennifer LeithamABOUT JENNIFER LEITHAMConsidered by many to be one of the finest bassists in the world, Jennifer Leitham has been a career musician for over 46 years. She is known for playing with many music world masters, including Mel Tormé, Peggy Lee, George Shearing, Doc Severinsen, Woody Herman, Benny Carter, Louis Bellson, Take 6 and k.d. lang, along with countless other greats in many genres.She is a bassist, vocalist, composer, arranger, lyricist, and producer. Her bass lines have graced numerous movies and TV shows. Currently Jennifer leads her trio and plays in clubs and concerts around the world. Jennifer is also a member of the Stan Kenton Legacy Orchestra and the acclaimed Left Coast Ukulele Trio.Jennifer has played on over 135 albums, including 10 albums of her own. The feature film documentary about her, ""I Stand Corrected"" was the winner of 11 best film awards as it screened at film festivals around the world in 2012. She was awarded the 2014 Community Leader Angel Award by the Center for Transyouth Health and Development at Children’s Hospital of Los Angeles. She was featured as one of the top 20 pioneers in Vanity Fair’s “Trans America” '15 Edition. In 2016, L.A. Weekly named her as as one of the “50 Most Interesting Angelinos.” Her music has been streamed on Spotify over 1.5 million times in the last year. In 2019 Jennifer spoke at the Jazz at Lincoln Center Jazz Congress, was featured on the news website Now This, and lectured and conducted a master class at the University of North Texas. Goal of the CampaignThanks to the generosity of the contributors to the previous campaign, Jennifer was able to raise close to $20,000 and was able to produce two CDs, ""Future Christmas"" and ""MOOD(S)WINGS"". The goal of that campaign was to raise enough money to make three CDs. Audacious and quite ambitious!The funding received was almost enough to pay for the recording and manufacture of the two CDs, but unfortunately there was no budget for promotion. We're trying a different approach this time. The goal of this ""Remnants of Humanity"" campaign is to provide enough funding to record, manufacture, promote and distribute one project. In the off chance that we reach our goal and there is any extra money, Jennifer plans to forge ahead with her long anticipated solo bass album. Depending on the income raised here, it would be released as a download only recording, but also as a CD if enough people chip in and we have a highly successful campaign!We'll be posting video updates from out on the road on the progress of the campaign. If you're familiar with Jennifer's CDs you know that the recording quality and performance are always top notch!We have a multitude of perks that you will receive for your contributions. Be sure to check out some of the new ones, especially at the highest levels, we've added some very unique perks. Just click on each perk to see a detailed description before you decide. Even if you don't plan on giving $5,000 or $10,000, give them a read. Who knows? Maybe you'll be inspired!As you are probably aware, Jennifer is one of the few transgender persons who pursues a career in the Jazz world. It is a daunting task but Jennifer continues to strive for excellence in her music and performances. The contributions from this campaign will be invaluable in helping to keep Jennifer and her music visible and accessible. We thank you for your steadfast support of the music and career of Jennifer Leitham!Some people just can't contribute, but that doesn't mean they can't help:If you are unable to contribute to the campaign, you can still help by sharing it on your social media platforms. Please make some noise about the Remnants of Humanity campaign!The Indiegogo share tools make it easy to help spread the word!And that's all there is to it. Please folks, let's make this campaign a success and spread the new music all over the world! Calling all ""Remnants of Humanity""!",0.0,0,"2 Campaigns
                |","Pasadena, United States",https://www.indiegogo.com/projects/remnants-of-humanity-campaign--2/pica
0,"<div class=""routerContentStory-storyBody"" data-v-1df7bf5a=""""><div>
<h3>Background</h3>
<ul>
<li>Founded in 2012, Æternal Requiem is forging a new sound, combining elements of neoclassical, European folk, deep baritone vocals, and of course, heavy metal. Based in San Antonio, Texas, the band is taking its first steps into the global metal scene!<br/> </li>
<li>While we are all ready investing our own money into this project, this campaign bridges the financial gap, making these plans possible! </li>
</ul>
</div><div>
<h3>What We Need &amp; What You Get</h3>
<ul>
<li>We have already paid half of our studio fees, securing our reservation, and now need to pay $4000 more by our first day in the studio in January.<br/> </li>
<li>We are offering various packages and perks in exchange for your support:<br/>For $10 you can preorder the digital album!<br/>For $15 you can preorder the album on CD!<br/>For $30 you get the T-Shirt Package!<br/>For $60 you get the Guitar Lesson Package!<br/>For $200 you get the ULTIMATE Guitar Lesson Package!<br/>For $500 You can claim the Top Contributor Package!<br/> </li>
<li>100% of all funds go towards our goal, whether or not our target is reached. </li>
</ul>
</div><div>
<h3>The Impact</h3>
<ul>
<li>This album was written from years of inspiration and it needs to be heard in the highest quality! It will be recorded strictly on analogue tape to capture the raw emotion and realness that has been lost in modern music.<br/> </li>
<li>If you liked the first album, imagine what we will do with this full-scale production!<br/> </li>
<li>This is truly a pivotal moment in the career of Æternal Requiem and its members. By creating an album of this magnitude we can start to perform on a bigger world stage. If you believe in what we are doing, now is the time to support us!</li>
</ul>
</div><div>
<h3>Risks &amp; Challenges</h3>
<ul>
<li>If we do not raise enough with this campaign, we will bridge the gap by any means necessary and all contributions will still go towards our goal. Anything helps!<br/> </li>
<li>Over the next 2.5 months we are working around the clock to arrange the songs and rehearse them to perfection to come fully prepared to seize this opportunity!</li>
</ul>
</div><div>
<h3>Other Ways You Can Help</h3>
<ul><li>Help us get the word out by sharing this campaign!</li></ul>
</div></div>","Background

Founded in 2012, Æternal Requiem is forging a new sound, combining elements of neoclassical, European folk, deep baritone vocals, and of course, heavy metal. Based in San Antonio, Texas, the band is taking its first steps into the global metal scene! 
While we are all ready investing our own money into this project, this campaign bridges the financial gap, making these plans possible! 


What We Need & What You Get

We have already paid half of our studio fees, securing our reservation, and now need to pay $4000 more by our first day in the studio in January. 
We are offering various packages and perks in exchange for your support:For $10 you can preorder the digital album!For $15 you can preorder the album on CD!For $30 you get the T-Shirt Package!For $60 you get the Guitar Lesson Package!For $200 you get the ULTIMATE Guitar Lesson Package!For $500 You can claim the Top Contributor Package! 
100% of all funds go towards our goal, whether or not our target is reached. 


The Impact

This album was written from years of inspiration and it needs to be heard in the highest quality! It will be recorded strictly on analogue tape to capture the raw emotion and realness that has been lost in modern music. 
If you liked the first album, imagine what we will do with this full-scale production! 
This is truly a pivotal moment in the career of Æternal Requiem and its members. By creating an album of this magnitude we can start to perform on a bigger world stage. If you believe in what we are doing, now is the time to support us!


Risks & Challenges

If we do not raise enough with this campaign, we will bridge the gap by any means necessary and all contributions will still go towards our goal. Anything helps! 
Over the next 2.5 months we are working around the clock to arrange the songs and rehearse them to perfection to come fully prepared to seize this opportunity!


Other Ways You Can Help
Help us get the word out by sharing this campaign!",0.0,0,"2 Campaigns
                |","San Antonio, United States",https://www.indiegogo.com/projects/help-aeternal-requiem-record-in-finland/pica
