,story,story_txt,img_len,video_len,campaign_count,campaign_city,url
0,"<div class=""routerContentStory-storyBody"" data-v-1df7bf5a=""""><div> <h3>Short Summary</h3> <p>Together, we can create an amazing music video to accompany the release of my new, upcoming single ""Electricity""! My team and I aim to pay homage to a classic '50s film (one of my favorites) to play off of the throwback vibes of the song.</p>
<p>Never one to sacrifice for my vision, I have aimed high for the concept of this music video, because I know that when it is completed, with your help, it can and will be exactly what I've always envisioned. Together, we will make something great.</p> </div> <div> <h3>What We Need &amp; What You Get</h3> <p>All of the money raised will go towards:</p> <ul> <li>Film Gear Rentals - to make this the best it can be, we need to rent some high-quality film gear to ensure that this looks just as good on your screen as it does in our heads.</li> <li>Car/Prop Rentals - the film the video is based on focuses on a classic car that will play a major role in the music video (This will be only a one-day rental as we want to maximize every dollar raised.)</li> <li>Permits/Insurance - in order to both legally and safely film in the locations for this shoot, film permits and insurance are necessary for both legal reasons as well as the safety of the cast and crew.</li> </ul>
<div>What You Get - Make sure to check out the awesome <b>Perks</b> section to see what I will give you as a thank you for your contribution!</div> </div> <div> <h3>The Impact</h3> <p>This is only the beginning of the release of lots of new music! I aim to bridge the gap between multiple genres and invite listeners of all walks of life.</p>
<p>Any extra money raised will go towards the creation of more new music/music videos/content for you to enjoy!</p>
<ul> </ul> </div> <div> <h3>
<span style=""letter-spacing: 0px;background-color: initial;"">Other Ways You Can Help</span><br/>
</h3>
</div><div> <p>If you cannot contribute monetarily, there are still plenty of ways you can help!</p>
<p>You can <b>SHARE </b>this campaign on any and every social network you use, as well as tell your friends/family/enemies via word of mouth! Any kind of help is greatly appreciated, as everyone you tell about this campaign/my music is a new pair of ears to sing to.</p>
</div></div>","Short Summary Together, we can create an amazing music video to accompany the release of my new, upcoming single ""Electricity""! My team and I aim to pay homage to a classic '50s film (one of my favorites) to play off of the throwback vibes of the song.
Never one to sacrifice for my vision, I have aimed high for the concept of this music video, because I know that when it is completed, with your help, it can and will be exactly what I've always envisioned. Together, we will make something great.   What We Need & What You Get All of the money raised will go towards:  Film Gear Rentals - to make this the best it can be, we need to rent some high-quality film gear to ensure that this looks just as good on your screen as it does in our heads. Car/Prop Rentals - the film the video is based on focuses on a classic car that will play a major role in the music video (This will be only a one-day rental as we want to maximize every dollar raised.) Permits/Insurance - in order to both legally and safely film in the locations for this shoot, film permits and insurance are necessary for both legal reasons as well as the safety of the cast and crew. 
What You Get - Make sure to check out the awesome Perks section to see what I will give you as a thank you for your contribution!   The Impact This is only the beginning of the release of lots of new music! I aim to bridge the gap between multiple genres and invite listeners of all walks of life.
Any extra money raised will go towards the creation of more new music/music videos/content for you to enjoy!
    
Other Ways You Can Help

 If you cannot contribute monetarily, there are still plenty of ways you can help!
You can SHARE this campaign on any and every social network you use, as well as tell your friends/family/enemies via word of mouth! Any kind of help is greatly appreciated, as everyone you tell about this campaign/my music is a new pair of ears to sing to.",0.0,0,"1 Campaign
                |","Los Angeles, United States",https://www.indiegogo.com/projects/trey-ewald-electricity-music-video/pica
0,"<div class=""routerContentStory-storyBody"" data-v-1df7bf5a=""""><div> <h3>Yes, We're Making A New Album.</h3> <p><i>Here's the deal</i></p>
<p>It's been nearly 4 years since we starting recording our debut album <i>1994</i>, which would go on to make several top album lists of 2013 and be streamed/sold in over 30 different countries. Needlessly to say, we're absolutely proud of what its accomplished, considering that we had no help from any management group, label, or publicist - everything we did ourselves with the support of amazing fans.</p>
<p>Since then, we've learned a lot about what to do and what not to do. At the end of 2014, we decided maybe we should do what other bands were doing: release an EP and hire a publicist to help promote it - the result being our self-titled EP released in July 2015. Because of what little we could afford, we went with a smaller company in hopes that we could still get the impact we were wanting. This turned out to be a giant waste of money and time, as it virtually did nothing for us. </p>
<p>Point being - you pay for what you get!</p>
<p>We also felt that releasing a short EP as opposed to a full album naturally didn't generate as much excitement among our fans. Don't get us wrong, the love and support we have received from it has been great - all I'm saying is, we hear you.</p>
<p>So, after taking some time away from the group and allowing ourselves to be without it for awhile, we're coming back revitalized to make things right: record a brand new full-length album and include you all (our fans) in the process.</p>
<p>Every dollar contributed will not only go toward your rewards, but will also be key in partnering with big name industry insiders, producers, publicists, and promoters.</p>
<p>We know you want to see the band succeed, and you can help us make that possible.</p>
<p></p>
<h3>All You Have To Do Is Pre-Order.</h3> </div> <div> <p><i>That's it!</i></p>
<p>We've heard it time and time again - ""Any chance of your music getting a vinyl or cassette release?""</p>
<p>Now we're saying YES, there IS a chance and all you have to do is pre-order.</p>
<p>Vinyl-pressing is expensive and hard to produce up front. However, pre-ordering our new full-length album will help us make it possible - plus, there'll even be an opportunity for you to get your very own personal copy of our debut album <i>1994</i> on vinyl (the only to ever exist).</p>
<p>Not to mention the more you contribute, the more awesome goodies you'll receive exclusively - exclusive vinyl/cassette releases, album updates, t-shirts, posters, buttons, private live-stream shows, etc.</p>
</div><div>
<ul> </ul> </div> <div> <h3>What If We Don't Reach Our Goal?</h3>
<div>
<i>We'll still love ya anyway...</i>
</div>
<div><i><br/></i></div> <p>We're hoping to use this as a platform to progress in our career and further get the word out about what we do via radio, TV, and touring.</p>
<p>The truth is we literally can not do this on our own.</p>
<p>What we're wanting to do is something that normally a record label would help fund but since we release everything independently, we have no buffer for such things - everything comes straight from our pockets.</p>
<p>We thought this would be a cool way for our fans to get their hands on some AWESOME merch that otherwise wouldn't be possible, while helping Noiseheads move forward - making it a win-win for both parties.</p>
<p>But even if we don't make the goal, we'll still fulfill every pre-order we receive <span style=""font-family: 'Benton Sans', Helvetica, sans-serif;letter-spacing: 0px;background-color: initial;"">:)</span></p>
<ul> </ul> </div> <div> <h3>Let's Make It Happen.</h3>
<div>
<i>We can do this.</i>
</div>
<div><i><br/></i></div> <p>We've never done anything like this before and have no idea what to expect. But believe us when we say this can be the turning point in Noiseheads career, and YOU can be responsible for making that happen.</p>
<p>Thank you for all of the support over the years, and here's to many more :)</p>
<p>- Noiseheads</p>
</div></div>","Yes, We're Making A New Album. Here's the deal
It's been nearly 4 years since we starting recording our debut album 1994, which would go on to make several top album lists of 2013 and be streamed/sold in over 30 different countries. Needlessly to say, we're absolutely proud of what its accomplished, considering that we had no help from any management group, label, or publicist - everything we did ourselves with the support of amazing fans.
Since then, we've learned a lot about what to do and what not to do. At the end of 2014, we decided maybe we should do what other bands were doing: release an EP and hire a publicist to help promote it - the result being our self-titled EP released in July 2015. Because of what little we could afford, we went with a smaller company in hopes that we could still get the impact we were wanting. This turned out to be a giant waste of money and time, as it virtually did nothing for us. 
Point being - you pay for what you get!
We also felt that releasing a short EP as opposed to a full album naturally didn't generate as much excitement among our fans. Don't get us wrong, the love and support we have received from it has been great - all I'm saying is, we hear you.
So, after taking some time away from the group and allowing ourselves to be without it for awhile, we're coming back revitalized to make things right: record a brand new full-length album and include you all (our fans) in the process.
Every dollar contributed will not only go toward your rewards, but will also be key in partnering with big name industry insiders, producers, publicists, and promoters.
We know you want to see the band succeed, and you can help us make that possible.

All You Have To Do Is Pre-Order.   That's it!
We've heard it time and time again - ""Any chance of your music getting a vinyl or cassette release?""
Now we're saying YES, there IS a chance and all you have to do is pre-order.
Vinyl-pressing is expensive and hard to produce up front. However, pre-ordering our new full-length album will help us make it possible - plus, there'll even be an opportunity for you to get your very own personal copy of our debut album 1994 on vinyl (the only to ever exist).
Not to mention the more you contribute, the more awesome goodies you'll receive exclusively - exclusive vinyl/cassette releases, album updates, t-shirts, posters, buttons, private live-stream shows, etc.

    What If We Don't Reach Our Goal?

We'll still love ya anyway...

 We're hoping to use this as a platform to progress in our career and further get the word out about what we do via radio, TV, and touring.
The truth is we literally can not do this on our own.
What we're wanting to do is something that normally a record label would help fund but since we release everything independently, we have no buffer for such things - everything comes straight from our pockets.
We thought this would be a cool way for our fans to get their hands on some AWESOME merch that otherwise wouldn't be possible, while helping Noiseheads move forward - making it a win-win for both parties.
But even if we don't make the goal, we'll still fulfill every pre-order we receive :)
    Let's Make It Happen.

We can do this.

 We've never done anything like this before and have no idea what to expect. But believe us when we say this can be the turning point in Noiseheads career, and YOU can be responsible for making that happen.
Thank you for all of the support over the years, and here's to many more :)
- Noiseheads",0.0,0,"1 Campaign
                |","Greensboro, United States",https://www.indiegogo.com/projects/pre-order-noiseheads-new-full-length-album/pica
0,"<div class=""routerContentStory-storyBody"" data-v-1df7bf5a=""""><div style=""text-align: justify;"">
<p>Dearest friends, i am creating an album, a compilation of songs that have birthed out of deep love in me thinking about the future of my children and great grandchildren. </p>
<p>I feel really inspired to create this, and i am just so grateful you are taking the time to consider being a supporter!</p>
<div style=""text-align: center;""><div><div class=""campaignStoryVideoWrapper""><iframe src=""https://www.youtube.com/embed/MwFCT71z2UI?list=RDMwFCT71z2UI&amp;controls=1&amp;showinfo=0""></iframe></div></div></div>
<p>I know that there are so many causes, so many deserving places in need of contribution, and i am someone who donates to a lot of different things...  I had to sit with it for a while before i put a call out for support in a world filled with much need,  And yet when i dream't about the world i wanted for my children, i wanted there to be art in it, i wanted there to be a place for the creative process and the artistic visioning potential within our humanity to have a place in the world. i have always felt that there always needs to be a place for visionary art on this planet. Art and music in its nature reflects the creative force that lives inside of us as human beings. I want my great grand children to inherit a healthy planet, and i also want them to inherit a life that is full of love and spirit that is rooted in a relationship with all living beings, as a tool to build a relationship and connection and reminder to that inherent connection we all share. </p>
<p>Though i am not formally trained in music, i have been studying sound and the use of music in a very unique way for over 7 years now. Learning from masterful healers who have harnessed the power of sound and using ancient songs that have literally come from the earth to help aid the healing process. </p>
<p>I also am working alongside my husband who is a professional musician who majored in Jazz in university and has been teaching music for over 15 years.  As well as other talented guest musicians and vocalists who are supporting the project. </p>
<p>The album will also be sharing a few sound bites from an amazing native drumming group who are part of my family.  They carry a truly beautiful authentic and ceremonial energy as they support in local ceremonies, vision quests, and sundance  in the Eastern part of Canada. </p>
<p>The album is devoted to every woman who is seizing courage to follow her dreams and dream in and vision a new world for our futures. Every woman who is afraid and doing it anyway. And of course to the Great Mother.... Who is always with us, but who has been forgotten of for far too long. </p>
<p>It is also deeply devoted to my grandmothers and grandfathers, living and passed on, and the deep gratitude i feel to be alive and all those who walked before me to get me to this moment in time.  </p>
<p>The songs that we want to record are beautiful lyrical compisitions and Piano and Drum. They are powerful and potent, haunting and inspiring. </p>
<p>One song, is called water is life. And it is written for the water protectors at standing rock, and all the protectors and guardians of the water. Anthems for protests, environmental protection, and spiritual connection. </p>
<p>All songs have been offered to be used in all and every capacity to different environmental and activist organizations working towards the protection of our peoples and planet. </p>
<p>This campaign will help with the primary costs of the creation of the album. </p>
<p>Studio recording Costs ---5000</p>
<p>Mastering process  -- 2000$ </p>
<p>Paying musicians the album estimate --- 1000$ </p>
<p>Material Production 500$  -Cds, Visionary Art Prints </p>
<p>Production is between 7-9,000$ with video creation</p>
<p>Which adds up to be a good chunk of change. So we are very very grateful for any help in this creations process. </p>
<p>Thank you so much for your support! </p>
<p>All my love and boundless blessing</p>
<p>Athena</p>
</div></div>","Dearest friends, i am creating an album, a compilation of songs that have birthed out of deep love in me thinking about the future of my children and great grandchildren. 
I feel really inspired to create this, and i am just so grateful you are taking the time to consider being a supporter!

I know that there are so many causes, so many deserving places in need of contribution, and i am someone who donates to a lot of different things...  I had to sit with it for a while before i put a call out for support in a world filled with much need,  And yet when i dream't about the world i wanted for my children, i wanted there to be art in it, i wanted there to be a place for the creative process and the artistic visioning potential within our humanity to have a place in the world. i have always felt that there always needs to be a place for visionary art on this planet. Art and music in its nature reflects the creative force that lives inside of us as human beings. I want my great grand children to inherit a healthy planet, and i also want them to inherit a life that is full of love and spirit that is rooted in a relationship with all living beings, as a tool to build a relationship and connection and reminder to that inherent connection we all share. 
Though i am not formally trained in music, i have been studying sound and the use of music in a very unique way for over 7 years now. Learning from masterful healers who have harnessed the power of sound and using ancient songs that have literally come from the earth to help aid the healing process. 
I also am working alongside my husband who is a professional musician who majored in Jazz in university and has been teaching music for over 15 years.  As well as other talented guest musicians and vocalists who are supporting the project. 
The album will also be sharing a few sound bites from an amazing native drumming group who are part of my family.  They carry a truly beautiful authentic and ceremonial energy as they support in local ceremonies, vision quests, and sundance  in the Eastern part of Canada. 
The album is devoted to every woman who is seizing courage to follow her dreams and dream in and vision a new world for our futures. Every woman who is afraid and doing it anyway. And of course to the Great Mother.... Who is always with us, but who has been forgotten of for far too long. 
It is also deeply devoted to my grandmothers and grandfathers, living and passed on, and the deep gratitude i feel to be alive and all those who walked before me to get me to this moment in time.  
The songs that we want to record are beautiful lyrical compisitions and Piano and Drum. They are powerful and potent, haunting and inspiring. 
One song, is called water is life. And it is written for the water protectors at standing rock, and all the protectors and guardians of the water. Anthems for protests, environmental protection, and spiritual connection. 
All songs have been offered to be used in all and every capacity to different environmental and activist organizations working towards the protection of our peoples and planet. 
This campaign will help with the primary costs of the creation of the album. 
Studio recording Costs ---5000
Mastering process  -- 2000$ 
Paying musicians the album estimate --- 1000$ 
Material Production 500$  -Cds, Visionary Art Prints 
Production is between 7-9,000$ with video creation
Which adds up to be a good chunk of change. So we are very very grateful for any help in this creations process. 
Thank you so much for your support! 
All my love and boundless blessing
Athena",0.0,1,"1 Campaign
                |","Salt Spring Island, Canada",https://www.indiegogo.com/projects/athena-and-the-guardians/pica
0,"<div class=""routerContentStory-storyBody"" data-v-1df7bf5a=""""><p></p><p></p><h3>About Us</h3><p></p><p>Hey guys and gals!  Thanks for coming to our Indiegogo page!!  We started our band, The Danberrys, in 2010 and have released two records and two singles since then.  Both of our records were nominated for Independent Music Awards (""Best EP"" and ""Best Americana Album""), but since we've always funded our projects on our own, we didn't have the extra funds to properly publicize those albums &amp; only a limited number of people got to hear them. This time we need some help getting this album into the ears of as many listeners as possible!  </p><p>Our new record, ""Give and Receive"", was recorded at Zac Brown's Southern Ground studio here in Nashville, TN.  It's one of the best studios in town and we were thrilled for the opportunity to record our music in such a historic room with some of the most talented musicians and engineers on the planet.  </p><p>We have already spent over $15,000 out-of-pocket to record and print our new album.  Now we need help to properly publicize the record.  Without proper exposure, our music will unfortunately not reach many listeners.  Publicizing the album is the next step in making music our day job.</p><p><span style=""font-family: 'Benton Sans', Helvetica, sans-serif;letter-spacing: 0px;background-color: initial;"">Our video costs for this release will amount to around $3,000, and our publicist fees will be over $8,000.  In order to cover these costs, we are raising money through a pre-sale of our new record and offering exclusive content that will only be available to Indiegogo contributors.  We hope you'll check out the different contribution levels (i.e. perks) and find one that makes you feel fuzzy inside.</span></p><p></p><h3>The Impact</h3><p>We make music because we're called to make music.  For independent artists like us, recording records is a labor of love and time with a hefty financial burden thrown in for good measure.  Your support allows us to continue sharing our gifts with you, the music lovers.  Through the years we've been honored to experience the healing power of music, and we know this is what we're here to do.  We're very thankful for the talents we've been given and for the opportunities that continue to be presented every day.  We would like to send a humongous THANK YOU for your time and consideration!</p><p>Ben and Dorothy</p><br/></div>","About UsHey guys and gals!  Thanks for coming to our Indiegogo page!!  We started our band, The Danberrys, in 2010 and have released two records and two singles since then.  Both of our records were nominated for Independent Music Awards (""Best EP"" and ""Best Americana Album""), but since we've always funded our projects on our own, we didn't have the extra funds to properly publicize those albums & only a limited number of people got to hear them. This time we need some help getting this album into the ears of as many listeners as possible!  Our new record, ""Give and Receive"", was recorded at Zac Brown's Southern Ground studio here in Nashville, TN.  It's one of the best studios in town and we were thrilled for the opportunity to record our music in such a historic room with some of the most talented musicians and engineers on the planet.  We have already spent over $15,000 out-of-pocket to record and print our new album.  Now we need help to properly publicize the record.  Without proper exposure, our music will unfortunately not reach many listeners.  Publicizing the album is the next step in making music our day job.Our video costs for this release will amount to around $3,000, and our publicist fees will be over $8,000.  In order to cover these costs, we are raising money through a pre-sale of our new record and offering exclusive content that will only be available to Indiegogo contributors.  We hope you'll check out the different contribution levels (i.e. perks) and find one that makes you feel fuzzy inside.The ImpactWe make music because we're called to make music.  For independent artists like us, recording records is a labor of love and time with a hefty financial burden thrown in for good measure.  Your support allows us to continue sharing our gifts with you, the music lovers.  Through the years we've been honored to experience the healing power of music, and we know this is what we're here to do.  We're very thankful for the talents we've been given and for the opportunities that continue to be presented every day.  We would like to send a humongous THANK YOU for your time and consideration!Ben and Dorothy",0.0,0,"1 Campaign
                |","Nashville, United States",https://www.indiegogo.com/projects/the-danberrys-new-album-pre-sale/pica
