,story,story_txt,img_len,video_len,campaign_count,campaign_city,url
0,"<div class=""routerContentStory-storyBody"" data-v-1df7bf5a=""""><p>My name is Adrian Blackhurst.  MUSIC is my #1 passion in life.  I've been involved with music my entire life, having been born into a musical family.  After playing in bands &amp; co-founding successful band Delhi 2 Dublin &amp; music collective Beats Without Borders, I moved to Hawaii &amp; began new solo projects Boogiemeister &amp; Bionic Love Soundsystem, as well DJ'ing and organizing events with my Beats Bazaar presents &amp; Remix The Earth monthly music events -over 40+ shows to date!   I am a multi-instrumentalist that plays guitar, bass, ukulele, melodica, percussion &amp; my main instrument of choice nowadays...the laptop with its infinite sound design possibilities.  I studied electronic music production in college in 2000-2002, at same time I had a radio show &amp; internship on the campus station in Olympia, WA on KAOS 89.3FM.   As you can see, MUSIC has been my life.  I have released 2 full length albums, 3 EP's (over 40+ songs total all on <a href=""http://www.SoundCloud.com/Boogiemeister),%C2%A0and"" rel=""noopener nofollow"" target=""_blank"">www.SoundCloud.com/Boogiemeister)</a>, &amp; many remixes.  Ahhhh....remixes.  This brings us to to the point of this conversation.  </p><p>Remix The Earth is my life-long dream project come true! A non-profit organization &amp; ongoing music, video &amp; travel project modeled after similar projects “Playing For Change”, “1 Giant Leap” &amp; “Critical Beats” (which I traveled to Ecuador with in 2011).  Remix The Earth has the vision &amp; dedicated goal of travelling the world to different locations 1-2x year, with these missions in mind: record musicians to collaborate &amp; create new tracks, offer tracks &amp; field recordings from abroad to be remixed by famous producers, record music videos with local dancers/musicians &amp; crews, &amp; mature into a documentary film eventually.  </p><p>The finished products will be Music album compilation series, Music Videos, Short Film Interviews for our YouTube channel, &amp; a Documentary Film.   This is Art for Art's sake, actually Music for Music's sake, with a bit of Video thrown in the creative mix!  My ultimate goal with this is to team up with a filmmaker &amp; crew to make documentary film, an amazing series of music videos, &amp; create series of workshops &amp; lessons teaching at risk youth the art of music/video.  </p><p>As a contributor you will help out in many ways!  You will help fund a global Music/Video ongoing project which will eventually be as popular as our peers at Playing For Change (see their YouTube which gets millions of plays, amazing music!).  </p><p><i>We are dedicated to this cause, but need your support now.   </i></p><p> Full story of Remix The Earth here:    <a href=""http://www.RemixTheEarth.com"" rel=""noopener nofollow"" target=""_blank"">www.RemixTheEarth.com</a></p><p> </p><h2><strong>What We Need &amp; What You Get</strong></h2><p>FUNDS NEEDED TO:</p><p>1)  Remix The Earth: volume 1, Morocco album release.  Need $300-500 to pay each producer (this is bargain price as usually they ask for $1500-2000+).  Some producers will use the Morocco field recordings to make their own song, others will remix Boogiemeister ""Mystic Medina"" track:</p><p><a href=""https://www.youtube.com/watch?v=YoElvbMeU08"" rel=""noopener nofollow"" target=""_blank"">https://www.youtube.com/watch?v=YoElvbMeU08</a></p><p> </p><p>2) Book studio time with local musicians @ professional music recording studios with hired audio engineers here in Brazil.  This costs $200 for 2-3 hours of time.   Goal = 5 sessions for this Brazil trip #1 = $1000.</p><p> </p><p>3) Update Website.  Currently <a href=""http://www.RemixTheEarth.com"" rel=""noopener nofollow"" target=""_blank"">www.RemixTheEarth.com</a>  is mostly there but needs a few editions &amp; updates about the Brazil project.   $250 </p><p> </p><p>4) Online Marketing of the music via Facebook Ads mainly.  Morocco compilation first, then Brazil compilation by June 2017.     $500</p><p> </p><p>5) Video/Film.  Need funds to pay dancers &amp; professional videographer here in Brazil (Gabriela Marquez) to create music videos &amp; future documentary clips  $1500 estimate.  Will release videos on YouTube channel here: </p><p><a href=""https://www.youtube.com/channel/UCiqf9PKtru6XvrWObKoQoJQ"" rel=""noopener nofollow"" target=""_blank"">https://www.youtube.com/channel/UCiqf9PKtru6XvrWObKoQoJQ/videos</a></p><p> </p><p> </p><h2>PERKS :: </h2><p> $25 usd gets you:  Remix The Earth volume 1: Morocco album downloads.  </p><p>$50 usd gets you:   Remix The Earth volume 1: Morocco &amp; volume 2 Brazil album downloads + 1 VIP entry into Remix The Earth music event in Hawaii. </p><p>$100 usd gets you:   Remix The Earth volume 1: Morocco &amp; volume 2 Brazil album downloads +     2 VIP entry into Remix The Earth music event in Hawaii. </p><p>$250 usd gets you:   Remix The Earth volume 1: Morocco &amp; volume 2 Brazil album downloads +     4 VIP entry into Remix The Earth music event in Hawaii. </p><p>$500 usd gets you:   Remix The Earth volume 1: Morocco &amp; volume 2 Brazil album downloads +     Lifetime VIP entry into Remix The Earth music event in Hawaii.  </p><p>$1000 usd+:   all of above AND....you get EXTRA GOOD KARMA POINTS!!! If you have that kind of money to donate, many blessings for sharing &amp; making our artistic dreams come true!  </p><p>If I don't reach my entire goal, the funds will still go towards making this project happen, just scaled down.  I would do less recording sessions, maintain a humble website, do lo-fi music videos, do free promotions on Facebook &amp; through my email list instead of paid ads to promote the music.    </p><h2><strong>The Impact</strong></h2><p>As a contributor you will help out in many ways!  You will help fund a global Music/Video ongoing project which will allow musicians from various countries to collaborate &amp; get the music out to the masses!  You will help support a series of music videos &amp; a documentary.  Lastly, you will help in funding childrens music programs across the world!  You will help bring the world closer together with the power of Music, unifying cultures &amp; dissolving boundaries.    More info here:</p><p><a href=""http://www.RemixTheEarth.com"" rel=""noopener nofollow"" target=""_blank"">www.RemixTheEarth.com</a></p><p> </p><p><strong>OTHER RELATED INFO ::  </strong></p><p>Spin Rocinha in Rio de Janeiro is place I've already been connecting with &amp; now teaching free electronic music &amp; DJ lessons to at risk youth.  We are aiming to shoot a music video in the favela (ghetto) with local musicians, dancers &amp; singer with the 1st track started.     <a href=""https://spinrocinha.jimdo.com/"" rel=""noopener nofollow"" target=""_blank"">https://spinrocinha.jimdo.com/</a></p><p>My time with Critical Beats volunteer program in Ecuador December 2011 allowed me to get firsthand experience recording music &amp; video of the Shuar tribe.  <a href=""http://criticalbeats.org/"" rel=""noopener nofollow"" target=""_blank"">http://criticalbeats.org/</a></p><p>I've received more inspiration from the ""Playing For Change"" video series &amp; the documentary ""1 Giant Leap"".  Together we can put Remix The Earth on the map such as these great projects.  <a href=""https://www.youtube.com/user/PlayingForChange"" rel=""noopener nofollow"" target=""_blank"">https://www.youtube.com/user/PlayingForChange</a></p><p><a href=""https://www.youtube.com/watch?v=neb3O6Bo6Zg"" rel=""noopener nofollow"" target=""_blank"">https://www.youtube.com/watch?v=neb3O6Bo6Zg</a></p><p> </p><h2><strong>Other Ways You Can Help</strong></h2><p>Some people just can't contribute, but that doesn't mean you can't help:</p><p>Please help get the word out and make some noise about my campaign.  You can share via Facebook, email, megaphones in marching bands, etc.   By using the Indiegogo share tools, its just a few clicks to spread the word!</p></div>","My name is Adrian Blackhurst.  MUSIC is my #1 passion in life.  I've been involved with music my entire life, having been born into a musical family.  After playing in bands & co-founding successful band Delhi 2 Dublin & music collective Beats Without Borders, I moved to Hawaii & began new solo projects Boogiemeister & Bionic Love Soundsystem, as well DJ'ing and organizing events with my Beats Bazaar presents & Remix The Earth monthly music events -over 40+ shows to date!   I am a multi-instrumentalist that plays guitar, bass, ukulele, melodica, percussion & my main instrument of choice nowadays...the laptop with its infinite sound design possibilities.  I studied electronic music production in college in 2000-2002, at same time I had a radio show & internship on the campus station in Olympia, WA on KAOS 89.3FM.   As you can see, MUSIC has been my life.  I have released 2 full length albums, 3 EP's (over 40+ songs total all on www.SoundCloud.com/Boogiemeister), & many remixes.  Ahhhh....remixes.  This brings us to to the point of this conversation.  Remix The Earth is my life-long dream project come true! A non-profit organization & ongoing music, video & travel project modeled after similar projects “Playing For Change”, “1 Giant Leap” & “Critical Beats” (which I traveled to Ecuador with in 2011).  Remix The Earth has the vision & dedicated goal of travelling the world to different locations 1-2x year, with these missions in mind: record musicians to collaborate & create new tracks, offer tracks & field recordings from abroad to be remixed by famous producers, record music videos with local dancers/musicians & crews, & mature into a documentary film eventually.  The finished products will be Music album compilation series, Music Videos, Short Film Interviews for our YouTube channel, & a Documentary Film.   This is Art for Art's sake, actually Music for Music's sake, with a bit of Video thrown in the creative mix!  My ultimate goal with this is to team up with a filmmaker & crew to make documentary film, an amazing series of music videos, & create series of workshops & lessons teaching at risk youth the art of music/video.  As a contributor you will help out in many ways!  You will help fund a global Music/Video ongoing project which will eventually be as popular as our peers at Playing For Change (see their YouTube which gets millions of plays, amazing music!).  We are dedicated to this cause, but need your support now.    Full story of Remix The Earth here:    www.RemixTheEarth.com What We Need & What You GetFUNDS NEEDED TO:1)  Remix The Earth: volume 1, Morocco album release.  Need $300-500 to pay each producer (this is bargain price as usually they ask for $1500-2000+).  Some producers will use the Morocco field recordings to make their own song, others will remix Boogiemeister ""Mystic Medina"" track:https://www.youtube.com/watch?v=YoElvbMeU08 2) Book studio time with local musicians @ professional music recording studios with hired audio engineers here in Brazil.  This costs $200 for 2-3 hours of time.   Goal = 5 sessions for this Brazil trip #1 = $1000. 3) Update Website.  Currently www.RemixTheEarth.com  is mostly there but needs a few editions & updates about the Brazil project.   $250  4) Online Marketing of the music via Facebook Ads mainly.  Morocco compilation first, then Brazil compilation by June 2017.     $500 5) Video/Film.  Need funds to pay dancers & professional videographer here in Brazil (Gabriela Marquez) to create music videos & future documentary clips  $1500 estimate.  Will release videos on YouTube channel here: https://www.youtube.com/channel/UCiqf9PKtru6XvrWObKoQoJQ/videos  PERKS ::  $25 usd gets you:  Remix The Earth volume 1: Morocco album downloads.  $50 usd gets you:   Remix The Earth volume 1: Morocco & volume 2 Brazil album downloads + 1 VIP entry into Remix The Earth music event in Hawaii. $100 usd gets you:   Remix The Earth volume 1: Morocco & volume 2 Brazil album downloads +     2 VIP entry into Remix The Earth music event in Hawaii. $250 usd gets you:   Remix The Earth volume 1: Morocco & volume 2 Brazil album downloads +     4 VIP entry into Remix The Earth music event in Hawaii. $500 usd gets you:   Remix The Earth volume 1: Morocco & volume 2 Brazil album downloads +     Lifetime VIP entry into Remix The Earth music event in Hawaii.  $1000 usd+:   all of above AND....you get EXTRA GOOD KARMA POINTS!!! If you have that kind of money to donate, many blessings for sharing & making our artistic dreams come true!  If I don't reach my entire goal, the funds will still go towards making this project happen, just scaled down.  I would do less recording sessions, maintain a humble website, do lo-fi music videos, do free promotions on Facebook & through my email list instead of paid ads to promote the music.    The ImpactAs a contributor you will help out in many ways!  You will help fund a global Music/Video ongoing project which will allow musicians from various countries to collaborate & get the music out to the masses!  You will help support a series of music videos & a documentary.  Lastly, you will help in funding childrens music programs across the world!  You will help bring the world closer together with the power of Music, unifying cultures & dissolving boundaries.    More info here:www.RemixTheEarth.com OTHER RELATED INFO ::  Spin Rocinha in Rio de Janeiro is place I've already been connecting with & now teaching free electronic music & DJ lessons to at risk youth.  We are aiming to shoot a music video in the favela (ghetto) with local musicians, dancers & singer with the 1st track started.     https://spinrocinha.jimdo.com/My time with Critical Beats volunteer program in Ecuador December 2011 allowed me to get firsthand experience recording music & video of the Shuar tribe.  http://criticalbeats.org/I've received more inspiration from the ""Playing For Change"" video series & the documentary ""1 Giant Leap"".  Together we can put Remix The Earth on the map such as these great projects.  https://www.youtube.com/user/PlayingForChangehttps://www.youtube.com/watch?v=neb3O6Bo6Zg Other Ways You Can HelpSome people just can't contribute, but that doesn't mean you can't help:Please help get the word out and make some noise about my campaign.  You can share via Facebook, email, megaphones in marching bands, etc.   By using the Indiegogo share tools, its just a few clicks to spread the word!",0.0,0,"4 Campaigns
                |","Rio de Janeiro, Brazil",https://www.indiegogo.com/projects/remix-the-earth-international-music-video-npo/pica
0,"<div class=""routerContentStory-storyBody"" data-v-1df7bf5a=""""><p>The album has been funded thus far by myself using what I made shooting and editing an independent feature film last year. Those funds are now all invested into this album and we need a couple grand more to check out some studio time for critical mixing. Then of course comes mastering. We want to ensure that these songs get the treatment they deserve which is to be able to compete with anything else put out by serious rock recording artists these days. Lastly, we want to make two music videos to promote its release. Since I make music videos more or less for a living, I am confident that I can make a couple of absolutely stellar music videos for a fraction of the cost any other artist would face at this phase. Of course it <i>still</i> adds up, hence this campaign. The ball is rolling and picking up speed, we're almost to the really fun part (when everyone gets to rock out to it of course). Thanks for checking out this project, watching/listening, I really appreciate it. -Jon  </p></div>","The album has been funded thus far by myself using what I made shooting and editing an independent feature film last year. Those funds are now all invested into this album and we need a couple grand more to check out some studio time for critical mixing. Then of course comes mastering. We want to ensure that these songs get the treatment they deserve which is to be able to compete with anything else put out by serious rock recording artists these days. Lastly, we want to make two music videos to promote its release. Since I make music videos more or less for a living, I am confident that I can make a couple of absolutely stellar music videos for a fraction of the cost any other artist would face at this phase. Of course it still adds up, hence this campaign. The ball is rolling and picking up speed, we're almost to the really fun part (when everyone gets to rock out to it of course). Thanks for checking out this project, watching/listening, I really appreciate it. -Jon",0.0,0,"1 Campaign
                |","Portland, United States",https://www.indiegogo.com/projects/talk-station-debut-album/pica
0,"<div class=""routerContentStory-storyBody"" data-v-1df7bf5a=""""><p><strong>Why this campaign must be fulfilled!!!</strong></p><p>  Construction on <strong>Studio 28 Productionz </strong>is already underway, but I need your help to finish! There's another empty room which I'm turning into another production room for other great musicians to come and create music! The goal of $20,000 is the budget to get this project done, though I know I will go over budget trying to build my Independent Record Label "" Crown Mics Records "" with 2 of my artists. So I set a stretch goal of $50,000 to put towards their music career . </p><p> </p><p><b>Here's a list of what the funds you contribute is going towards!</b></p><p><a href=""http://tinypic.com?ref=ws9yyt"" rel=""noopener nofollow"" target=""_blank""><img alt=""Image and video hosting by TinyPic"" border=""0"" class=""lazy"" data-src=""http://i65.tinypic.com/ws9yyt.jpg"" src="""" style=""""/></a></p><p> </p><p><strong>The Producer</strong></p><p><a href=""http://tinypic.com?ref=talx0n"" rel=""noopener nofollow"" target=""_blank""><img alt=""Image and video hosting by TinyPic"" border=""0"" class=""lazy"" data-src=""http://i68.tinypic.com/talx0n.png"" src="""" style=""""/></a></p><p><strong>   </strong>Hello I'm Andre Matthews owner of <strong>Studio 28 Productionz also a artist/engineer/songwriter. </strong>Music became a big part of my life at a earlier age. My father was a big inspiration of my music by watching him produce tracks for his group. This helped me evolve and become the person I am today. This been going on for about 10 years before I was able to achieve my very own studio, which is now <strong>Studio 28 Productionz. </strong>I've done a few shows and music videos throughout my city.</p><p><b>Checkout this snippet of my latest performance at The Link Bar in Gary, IN.</b></p><p><a href=""https://www.instagram.com/p/BMJ1_6MjSfI/"" rel=""noopener nofollow"" target=""_blank"">https://www.instagram.com/p/BMJ1_6MjSfI/</a></p><p> </p><p><span style=""font-family: 'Benton Sans', Helvetica, sans-serif;font-size: 16px;letter-spacing: 0px;line-height: 26px;""> </span><b>The Studio </b></p><p> <a href=""http://tinypic.com?ref=wahlk9"" rel=""noopener nofollow"" target=""_blank""><img alt=""Image and video hosting by TinyPic"" border=""0"" class=""lazy"" data-src=""http://i67.tinypic.com/wahlk9.jpg"" src="""" style=""""/></a></p><p>   <strong>Studio 28 Productionz </strong>was established in 2013 which is located <strong>Downtown Indianapolis, IN. </strong>recording numerous artists singles, EP's, albums, and mixtapes. To get the studio to where it is, it took alot of work such as; <strong>Rebuilding the booth, soundproofing the walls, and painting. Studio 28 Productionz </strong>gives artists that industry sound they need by using <strong>Waves Plugins and with the recording software Acid Music Studio. </strong>Once this studio is completed it will not only serve as a place for <strong>Crown Mics Records, </strong>but it will serve as a catalyst for bringing musicians to the next level with the best quality I got to offer.</p><p> </p><p><b>Here's some of my production I've engineered here at Studio 28 Productionz. The music you're tuning into there's plenty more on the way from my artists and I once the studio project succeed.</b></p><p><a href=""https://youtu.be/XiObLG0eDrE"" rel=""noopener nofollow"" target=""_blank"">https://youtu.be/XiObLG0eDrE</a></p><p><a href=""https://youtu.be/OpzxTYx_Nfs"" rel=""noopener nofollow"" target=""_blank"">https://youtu.be/OpzxTYx_Nfs</a></p><p><a href=""https://youtu.be/L6d0kee5uao"" rel=""noopener nofollow"" target=""_blank"">https://youtu.be/L6d0kee5uao</a></p><p><a href=""https://youtu.be/QxjvdqVf6Yk"" rel=""noopener nofollow"" target=""_blank"">https://youtu.be/QxjvdqVf6Yk</a></p><p> </p><p><strong>Other Ways You Can Help</strong></p><p>If you are not able to contribute financially, but feel that <strong>Studio 28 Productionz </strong>is an organization you believe in, help spread the word. Share this campaign, tell your friends, shout it from the rooftops, anything to get others to do the same. </p><p>Thank you for your support! God bless!</p></div>","Why this campaign must be fulfilled!!!  Construction on Studio 28 Productionz is already underway, but I need your help to finish! There's another empty room which I'm turning into another production room for other great musicians to come and create music! The goal of $20,000 is the budget to get this project done, though I know I will go over budget trying to build my Independent Record Label "" Crown Mics Records "" with 2 of my artists. So I set a stretch goal of $50,000 to put towards their music career .  Here's a list of what the funds you contribute is going towards! The Producer   Hello I'm Andre Matthews owner of Studio 28 Productionz also a artist/engineer/songwriter. Music became a big part of my life at a earlier age. My father was a big inspiration of my music by watching him produce tracks for his group. This helped me evolve and become the person I am today. This been going on for about 10 years before I was able to achieve my very own studio, which is now Studio 28 Productionz. I've done a few shows and music videos throughout my city.Checkout this snippet of my latest performance at The Link Bar in Gary, IN.https://www.instagram.com/p/BMJ1_6MjSfI/  The Studio     Studio 28 Productionz was established in 2013 which is located Downtown Indianapolis, IN. recording numerous artists singles, EP's, albums, and mixtapes. To get the studio to where it is, it took alot of work such as; Rebuilding the booth, soundproofing the walls, and painting. Studio 28 Productionz gives artists that industry sound they need by using Waves Plugins and with the recording software Acid Music Studio. Once this studio is completed it will not only serve as a place for Crown Mics Records, but it will serve as a catalyst for bringing musicians to the next level with the best quality I got to offer. Here's some of my production I've engineered here at Studio 28 Productionz. The music you're tuning into there's plenty more on the way from my artists and I once the studio project succeed.https://youtu.be/XiObLG0eDrEhttps://youtu.be/OpzxTYx_Nfshttps://youtu.be/L6d0kee5uaohttps://youtu.be/QxjvdqVf6Yk Other Ways You Can HelpIf you are not able to contribute financially, but feel that Studio 28 Productionz is an organization you believe in, help spread the word. Share this campaign, tell your friends, shout it from the rooftops, anything to get others to do the same. Thank you for your support! God bless!",3.0,0,"1 Campaign
                |","Indianapolis, United States",https://www.indiegogo.com/projects/help-rebuild-studio-28-productionz-record-label/pica
