,story,story_txt,img_len,video_len,campaign_count,campaign_city,url
0,"<div class=""routerContentStory-storyBody"" data-v-1df7bf5a=""""><div>
<h3>What Is This?</h3>
<p><i>""In my four years of living in New York, I've only ever swiped right on white guys on Tinder.""</i></p>
<p><i>I LOVE WHITE MEN</i> is an exploration of one Asian woman's obsession with white men. Through a series of confessions, Reddit posts, email records, historical research, and reflection on her Singaporean upbringing, YY attempts to unpack the complex relationships she's had with the various white men in her life-- and figure out where to go from there.</p>
<p>NEXT UP at <strong>Ars Nova ANT Fest 2019,</strong> on <strong>Thursday June 20th, 7pm</strong>. Get ready for a show about white worship, postcolonial baggage, and lots and lots of sex!!!</p>
<p><i>ANT Fest is Ars Nova’s 12th annual celebration of All New Talent, in which they jam-pack the month of June with at least one (or 2 or 3!) one-night-only performances from artists they are excited to get to know. We are beyond thrilled to be among great artists!</i></p>
<p> </p>
</div><div>
<h3>Who We Are</h3>
<p><a href=""http://simyanying.com"" rel=""noopener nofollow""><strong>Sim Yan Ying</strong></a> (Creator &amp; Performer) is a theatre artist based in New York and Singapore. She creates works that are borne out of her obsessions - which are often messy and ugly - and her preoccupation with ordering this chaos. She draws much of her inspiration from New York City bars, strangers on the streets, and her Facebook newsfeed.</p>
<p><a href=""http://reneeyeong.com"" rel=""noopener nofollow""><strong>Renee Yeong</strong></a> (Director) is a Singapore-born, New York-based theatre director and sound designer. She most recently assisted Rachel Chavkin on Bess Wohl’s world premiere play <i>Continuity</i><i style=""font-style: italic;""> </i>and will be a member of the 2019 Lincoln Centre Director's Lab. She is also an avid Oprah SuperSoul podcast fan and loves hosting dinner parties.</p>
<p><a href=""http://nicholaschanwj.com"" rel=""noopener nofollow""><strong>Nicholas Chan</strong></a> (Dramaturg) is a Singapore-born writer that loves tackling spicy issues like social inequality, postcolonialism and racial disparity often through fantastical lenses. Before graduating from NYU, he was the lead writer of a Singapore-based video game company, and now is excited to explore a very different kind of fantasy with ILWM.</p>
<p><strong>Lisa Mordkovich</strong> (Producer) is a New York-based producer completing her BA in Performance Studies at NYU Tisch School of the Arts. Recent producing credits include: Tisch New Theatre's Next to Normal at Soho Playhouse and <i>I LOVE WHITE MEN</i> at Dixon Place. She is leaving to continue studying producing in London this summer and wants to start a theatre company in the mountains somewhere because she thinks she is destined to live in the mountains.</p>
<p><strong>Chris Voegels </strong>(Lighting Designer) is a lighting designer who has worked on numerous student works at Playwrights Horizons Theater School. Credits include <i>The Content Generation</i>, <i>Where Are You, Annie Aspen's Musical Space Spectacular!,</i> and <i>Rekindle</i>. Chris is excited to finish his last year at NYU in the fall, majoring in - you guessed it - acting!</p>
<p><strong>Tate Rehklau </strong>(Projection Designer) is grateful to be the honorary white man of <i>I LOVE WHITE MEN</i>, developing work with a team that welcomes him, listens to him, and openly praises his every action. His primary responsibilities include: posing with YY for pictures, introducing YY to his friends, and going to dinners with her and her family. He would like to thank the team for being so appreciative, like... strangely appreciative.</p>
<p><strong>Alexis Lapp</strong> (Publicity Manager) is an NYC based artist, currently studying directing at NYU. She has recently had the joy of assistant directing at St. Ann’s Warehouse annual puppet lab, <i>Labapalooza! </i>under Sharone Halevy. Thanks to Renee and YY for this opportunity &amp; cheers to the changemakers baby!</p>
<p> </p>
</div><div>
<h3>Timeline</h3>
<p><strong>January 2018:</strong> Development began with core creative team Sim Yan Ying, Renee Yeong, and Nicholas Chan</p>
<p><strong>June 2018:</strong> Closed workshop presentation at Playwrights Downtown with collaborators Danica Jensen, Jacqueline Brockel, Beth Golison, Tate Rehklau, and Frances Yackel</p>
<p><strong>January 2019:</strong> First public (and sold-out) performance at the Dixon Place Mainstage, with collaborators Lisa Mordkovich, Tate Rehklau, and Ava Novak</p>
<p><strong>June 2019:</strong> Second public performance at Ars Nova ANT Fest 2019!</p>
<p> </p>
</div><div>
<h3>Some Backstory...</h3>
<p><i>I LOVE WHITE MEN</i> started with a conversation in KFC in Singapore, when Renee and I were home for winter break. I told her, “I’ve only dated and swiped right on white guys ever since I moved to New York.”</p>
<p>She asked me why. I said I didn’t know. And so I embarked on this project, together with my core collaborators Renee and Nick, as a means to find out why - and it has proven to be messier and more complicated than I thought.</p>
<p>I examined conversations with my family, researched Singapore’s colonial history, read Reddit posts that broke my heart, interviewed white men who shamed me, and consolidated personal stories ranging from my unlikely friendship with a Swedish man when I was seven to my many one night stands in New York. I put all of them together, and still cause and effect eluded me.</p>
<p>As it stands now,<i> I LOVE WHITE MEN</i> is about the tension between “problematic” desires and social expectations. My desire for white men goes against the traditional Asian values that my parents and my country have worked hard to instil in me, and also against the progressive liberal ideals of equality. What do I do when my heart is unable to catch up with my mind? Why do I continue to worship white people despite knowing better? How do I go about undoing the inferiority complex that I have carried with me for decades? Can I?</p>
<p><i>I LOVE WHITE MEN</i> was also created in response to what we felt was a gap in mainstream knowledge about Asian culture and stories, and specifically for us, Singaporean stories. There are so few stories in our global canon that capture the nuance and complexity of who Singaporeans are as individuals and we hope, as ambitious as it sounds, that I LOVE WHITE MEN can dismantle assumptions, break through stereotypes, and ignite our curiosities about things that feel foreign to us.</p>
<p> </p>
</div><div>
<h3>Why We Need Your Help</h3>
<p>1. Our design team will require funding to be able to work their magic. Your donation will help us acquire <strong>props</strong> and who knows, maybe you’ll be a lucky audience member taking home a <strong>souvenir</strong> ;) </p>
<p>2. Rehearsing in New York is expensive! Your money will help us find <strong>rehearsal space </strong>and acquire <strong>items for rehearsal</strong> - scripts, tape, rehearsal props, etc</p>
<p>3. We have a <strong>small team of seven</strong> creating a show for <strong>100+</strong> people, and will be working intensely for 6 weeks to develop this show! It is important to us that everyone gets a stipend as a thank you for their work. Part of your donation will go towards our goal of <strong>equitable compensation</strong>.</p>
<p>4. We are working to spread the word about I LOVE WHITE MEN - your donation will help us launch a solid and <strong>creative marketing campaign</strong> including Facebook ads and printed handouts, and reach audiences that are diverse in identity and political views. People whom we can challenge and will challenge us!</p>
<p>*If you're unable to financially contribute, you can help us out by sharing our fundraiser on social media! You can also share our <a href=""https://www.facebook.com/events/798105530572230/"" rel=""noopener nofollow""><strong>Facebook event</strong></a>, <a href=""https://arsnovanyc.com/antfest/6.20"" rel=""noopener nofollow""><strong>buy tickets online</strong></a> and Like us on our <strong><a href=""https://www.facebook.com/ILOVEWHITEMENshow"" rel=""noopener nofollow"">Facebook page</a></strong>!</p>
</div></div>","What Is This?
""In my four years of living in New York, I've only ever swiped right on white guys on Tinder.""
I LOVE WHITE MEN is an exploration of one Asian woman's obsession with white men. Through a series of confessions, Reddit posts, email records, historical research, and reflection on her Singaporean upbringing, YY attempts to unpack the complex relationships she's had with the various white men in her life-- and figure out where to go from there.
NEXT UP at Ars Nova ANT Fest 2019, on Thursday June 20th, 7pm. Get ready for a show about white worship, postcolonial baggage, and lots and lots of sex!!!
ANT Fest is Ars Nova’s 12th annual celebration of All New Talent, in which they jam-pack the month of June with at least one (or 2 or 3!) one-night-only performances from artists they are excited to get to know. We are beyond thrilled to be among great artists!
 

Who We Are
Sim Yan Ying (Creator & Performer) is a theatre artist based in New York and Singapore. She creates works that are borne out of her obsessions - which are often messy and ugly - and her preoccupation with ordering this chaos. She draws much of her inspiration from New York City bars, strangers on the streets, and her Facebook newsfeed.
Renee Yeong (Director) is a Singapore-born, New York-based theatre director and sound designer. She most recently assisted Rachel Chavkin on Bess Wohl’s world premiere play Continuity and will be a member of the 2019 Lincoln Centre Director's Lab. She is also an avid Oprah SuperSoul podcast fan and loves hosting dinner parties.
Nicholas Chan (Dramaturg) is a Singapore-born writer that loves tackling spicy issues like social inequality, postcolonialism and racial disparity often through fantastical lenses. Before graduating from NYU, he was the lead writer of a Singapore-based video game company, and now is excited to explore a very different kind of fantasy with ILWM.
Lisa Mordkovich (Producer) is a New York-based producer completing her BA in Performance Studies at NYU Tisch School of the Arts. Recent producing credits include: Tisch New Theatre's Next to Normal at Soho Playhouse and I LOVE WHITE MEN at Dixon Place. She is leaving to continue studying producing in London this summer and wants to start a theatre company in the mountains somewhere because she thinks she is destined to live in the mountains.
Chris Voegels (Lighting Designer) is a lighting designer who has worked on numerous student works at Playwrights Horizons Theater School. Credits include The Content Generation, Where Are You, Annie Aspen's Musical Space Spectacular!, and Rekindle. Chris is excited to finish his last year at NYU in the fall, majoring in - you guessed it - acting!
Tate Rehklau (Projection Designer) is grateful to be the honorary white man of I LOVE WHITE MEN, developing work with a team that welcomes him, listens to him, and openly praises his every action. His primary responsibilities include: posing with YY for pictures, introducing YY to his friends, and going to dinners with her and her family. He would like to thank the team for being so appreciative, like... strangely appreciative.
Alexis Lapp (Publicity Manager) is an NYC based artist, currently studying directing at NYU. She has recently had the joy of assistant directing at St. Ann’s Warehouse annual puppet lab, Labapalooza! under Sharone Halevy. Thanks to Renee and YY for this opportunity & cheers to the changemakers baby!
 

Timeline
January 2018: Development began with core creative team Sim Yan Ying, Renee Yeong, and Nicholas Chan
June 2018: Closed workshop presentation at Playwrights Downtown with collaborators Danica Jensen, Jacqueline Brockel, Beth Golison, Tate Rehklau, and Frances Yackel
January 2019: First public (and sold-out) performance at the Dixon Place Mainstage, with collaborators Lisa Mordkovich, Tate Rehklau, and Ava Novak
June 2019: Second public performance at Ars Nova ANT Fest 2019!
 

Some Backstory...
I LOVE WHITE MEN started with a conversation in KFC in Singapore, when Renee and I were home for winter break. I told her, “I’ve only dated and swiped right on white guys ever since I moved to New York.”
She asked me why. I said I didn’t know. And so I embarked on this project, together with my core collaborators Renee and Nick, as a means to find out why - and it has proven to be messier and more complicated than I thought.
I examined conversations with my family, researched Singapore’s colonial history, read Reddit posts that broke my heart, interviewed white men who shamed me, and consolidated personal stories ranging from my unlikely friendship with a Swedish man when I was seven to my many one night stands in New York. I put all of them together, and still cause and effect eluded me.
As it stands now, I LOVE WHITE MEN is about the tension between “problematic” desires and social expectations. My desire for white men goes against the traditional Asian values that my parents and my country have worked hard to instil in me, and also against the progressive liberal ideals of equality. What do I do when my heart is unable to catch up with my mind? Why do I continue to worship white people despite knowing better? How do I go about undoing the inferiority complex that I have carried with me for decades? Can I?
I LOVE WHITE MEN was also created in response to what we felt was a gap in mainstream knowledge about Asian culture and stories, and specifically for us, Singaporean stories. There are so few stories in our global canon that capture the nuance and complexity of who Singaporeans are as individuals and we hope, as ambitious as it sounds, that I LOVE WHITE MEN can dismantle assumptions, break through stereotypes, and ignite our curiosities about things that feel foreign to us.
 

Why We Need Your Help
1. Our design team will require funding to be able to work their magic. Your donation will help us acquire props and who knows, maybe you’ll be a lucky audience member taking home a souvenir ;) 
2. Rehearsing in New York is expensive! Your money will help us find rehearsal space and acquire items for rehearsal - scripts, tape, rehearsal props, etc
3. We have a small team of seven creating a show for 100+ people, and will be working intensely for 6 weeks to develop this show! It is important to us that everyone gets a stipend as a thank you for their work. Part of your donation will go towards our goal of equitable compensation.
4. We are working to spread the word about I LOVE WHITE MEN - your donation will help us launch a solid and creative marketing campaign including Facebook ads and printed handouts, and reach audiences that are diverse in identity and political views. People whom we can challenge and will challenge us!
*If you're unable to financially contribute, you can help us out by sharing our fundraiser on social media! You can also share our Facebook event, buy tickets online and Like us on our Facebook page!",0.0,0,"1 Campaign
                |","New York, United States",https://www.indiegogo.com/projects/i-love-white-men-at-ars-nova-s-ant-fest/pica
