,story,story_txt,img_len,video_len,campaign_count,campaign_city,url
0,"<div class=""routerContentStory-storyBody"" data-v-1df7bf5a=""""><p></p><h2></h2><p><span style=""font-size: 30px; font-weight: bold; letter-spacing: 0px; line-height: 38px;"">What is Subi</span><br/></p><p></p><p></p><p>Subi is essentially a social space for discovering new experiences by trading in old ones. Unlike any loyalty app, Subi connects you with people like yourself who enjoy indulging in their favorite things-to-do, but at the same time appreciate the notion that variety is the spice of life and are open to trying new things.</p><h2>Easy as Counting From 1 to 10</h2><p>Subi does away with the vague point-building system that you find in many loyalty programs where 50,000 points doesn't really mean a lot when you equate the amount to the value of the redeemable reward. Subi is here to enforce radical transparency. </p><p>In this Subi community, every user is entitled to an exclusive reward when the user purchases a service or item within the app after the 10th time.</p><p>What makes Subi’s offering unique is based on the number 10. There will be a variety of deals to choose from offered by a selected list of local and online merchants. Our featured Merchants offer specials ranging from: percentage discounts, 2-for-1s or free items in order to bring in new customers like you and also to maintain their relationships with current customers. Here's the sample list of cool things-to-do on Subi</p><h3><b>CITY TOURS</b></h3><p></p><p><img class=""lazy"" data-src=""https://images.indiegogo.com/file_attachments/565635/files/20140508052010-CityTours.jpg?1399551610"" src="""" style=""""/></p><p><br/></p><h3>RESTAURANTS </h3><p></p><p></p><p><img class=""lazy"" data-src=""https://images.indiegogo.com/file_attachments/565637/files/20140508052128-Food.jpg?1399551688"" src="""" style=""""/></p><p><br/></p><h3><b>NIGHTCLUBS AND BARS</b></h3><p></p><p><img class=""lazy"" data-src=""https://images.indiegogo.com/file_attachments/565639/files/20140508052211-Nightclub.jpg?1399551731"" src="""" style=""""/></p><h3>VACATION GETAWAYS</h3><p><br/></p><p></p><p><img class=""lazy"" data-src=""https://images.indiegogo.com/file_attachments/565647/files/20140508052339-familyvacation.jpg?1399551819"" src="""" style=""width: 400.5075445816187px; height: 602px;""/></p><br/><p></p><h3>FITNESS</h3><p></p><p><img class=""lazy"" data-src=""https://images.indiegogo.com/file_attachments/565655/files/20140508052656-8687810_m.jpg?1399552016"" src="""" style=""""/></p><p><br/></p><p>Still wondering How Subi works? Take a look at this scenario</p><h4>HOW EXACTLY DOES IT WORK? HERE'S AN EXAMPLE;</h4><p><b>WEEK #1</b></p><p>Step 1: Get Tickets to a Concert</p><p>Step 2: Book a Car Service to Concert</p><p>Step 3: Get Dinner at a fancy Restaurant </p><p><b>WEEK #4</b></p><p>Step 4: Book a vacation getaway to the Bahamas</p><p><b>WEEK #7</b></p><p>Step 5: Get Tickets to a Museum</p><p><b>WEEK #8</b></p><p>Step 6: Get Lunch at a Diner </p><p>Step 7: Sign up for a Gym Membership</p><p><b>WEEK #10</b></p><p>Step 8: Book a 3 Night Stay at a Resort </p><p>Step 9: Book Car Service from Airport to Resort</p><p>Step 10: Get Meals for You + Family </p><p><br/></p><p><b><u>NOW PICK YOUR REWARDS</u></b></p><p>Example 1: Book a vacation getaway on Subi for 3 nights at Half-off (50% discount).</p><p>Example 2: Get dinner at one of our restaurants and receive 2 complimentary drinks (Free item).</p><p>Example 3: Get 2 tickets forprice of 1 for an event (Buy 1 Get 1 Free).</p><h3>EASILY TRACK YOUR PROGRESS</h3><p>There’s a built-in meter which keeps a track of your progress from 1 - 10 represented on a scale of 0 - 100% in increments of 10% (See pic below).You’ll be on fire -- figuratively speaking -- in no time and your meter lights up in flames indicating you've reach your 10th goal.</p><p></p><figure style=""margin: 0px;""><img alt="""" class=""fit lazy"" data-src=""https://s3.amazonaws.com/ksr/assets/001/979/406/9057bfff90403c5f070e6ddecf7539b1_large.png?1399490228"" src="""" style=""""/></figure><p></p><h3>CONCERTS AND SHOWS</h3><p>Start seeing rewards from doing everyday things you do fast. Redeem your prize and the meter resets to 0%. Start again “clearly” knowing you’ve got ONLY 10 things to do for your next reward. It’s so simple, clear and concise; unlike airline flyer Miles that take years to build 100’s of thousands of points in order to win anything.</p><h3>SUBI WORKS FOR MERCHANTS </h3><p>Subi brings you new customers like ""Groupon"" with the incentives for current customers on ""Foursquare"" combined in one fun to use application. Based on popular research, the 2 biggest complaints from Local Merchants like are (1) attracting new customers and (2) retaining current customers. Trust Subi to solve this issue like nothing else before. Develop lasting relationships with your current and future customers in a variety of ways including;</p><ul>
<li>Get to know your frequent customers and develop new ones</li>
<li>Tracking loyalty points for recent activity.</li>
<li>Processing transactions within the app in real-time </li>
<li>Create customizable rewards that benefits both loyal and new visitors. </li>
<li>Reports: number of visits, points earned, rewards redeemed </li>
</ul><p>Subi caters to a niche market of users who are already in the mindset of building points through loyalty programs. So increase relevant traffic to your venue by backing our project and earn higher placement on our recommendation engine. Register your venue first by choosing one of the merchant-tailored rewards. Your venue will be featured higher on user search results. The amount you pledge today is an early-bird investment that will multiply very fast in measurable revenue.</p><p>With a whole slew of valuable rewards, there's something for everyone; check our list of rewards and back us today.</p><h3><b><br/></b></h3><h3><b>PERKS FOR MOBILE USERS</b></h3><p><b><br/></b></p><p><b>1. SUPPORT SUBI WITH $10+ </b></p><p></p><p>EARLY BIRD ACCESS: Receive a shout out + an early bird invitation to try out Subi when we launch; use all of Subi's features in its glory.</p><p></p><p><b><br/></b></p><p><b>2. SUPPORT SUBI WITH $25+</b></p><p>COMMUNITY MEMBER: Receive a shout out + early bird access + invitation to join our community-driven feed feedback and support team. Provide feedback and suggestions for making Subi even better; recommend your favorite local business to be featured on our venue listing.</p><p><b><br/></b></p><p><b>3. SUPPORT SUBI WITH $250</b></p><p>SUBI UBER Level: This level will give you the ability to get rewards twice as fast: in 5 steps. You now receive rewards for every 5th activity + rewards (above) #1 to #3.</p><p><b><br/></b></p><p><b>4. SUPPORT SUBI WITH $400</b></p><p>SUBI OOWEE Level: This Level gives you the ability to reach rewards after in 3 steps. You now receive a reward for every 3rd completed activity + rewards (above) #1 to #3. </p><p>Example: 1st step -- Book a vacation getaway cruise. 2nd step -- Buy concert tickets. 3rd (Reward) -- Book a 3 night stay at hotel and get 1 extra night Free.</p><p><b><br/></b></p><p><b>5. SUPPORT SUBI WITH $1,000</b></p><p>SUBI SUPREME Level: This is the ultimate level attainable by a Subi user. You get rewards after completing 1 step + reward (above) #1 to #3 </p><p>Example: 1st step -- Book a vacation getaway cruise. 2nd (reward) -- Buy 1 concert ticket and get 2nd ticket Free</p><h3><br/></h3><p></p><h3><b>PERKS FOR MERCHANTS</b></h3><p><br/></p><p><b>1. Pledge $1,150 or more</b></p><p>SPROUT (Merchant) -- 16th to 20th Bracket list. This is an early-bird placement boost for merchants. Get your venue listing placed high in user search results for 3 months (renewable). </p><p>When Subi users conduct a search for a local spot in your city, your venue will be show up within the 16th to 20th bracket on the list. </p><p>For example;</p><p>User Searches: ""Restaurants in Miami"" </p><p>Results: Restaurant (A) #16 </p><p>Restaurant (B) #17 </p><p>YOUR RESTAURANT (C) #18 </p><p>Restaurant (D) #19 </p><p>Restaurant (E) #20</p><p><br/></p><p><b>2. Pledge $3,500 or more</b></p><p>STARTER (Merchant)-- 11th to 15th Bracket list. This is an early-bird placement boost for merchants. Get your venue listing placed higher in user search results for the 6 months (renewable). </p><p>When Subi users conduct a search for a local spot in your city, your venue will always show up within the 11th to 15th bracket on the list. </p><p>For example; </p><p>User Searches: ""Hotels in New York"" </p><p>Results: Hotel (A) #11 </p><p>YOUR HOTEL (B) #12 </p><p>Hotel (C) #13 </p><p>Hotel (D) #14 </p><p>Hotel (E) #15</p><p><br/></p><p><b>3. Pledge $5,000 or More</b></p><p>PREMIUM (Merchant) -- 2nd to 10th Bracket.</p><p>This is an early-bird placement boost for merchants. Get your venue listing placed even higher in user search results for 9 months (renewable).</p><p>When Subi users conduct a search for a local spot in your city, your venue will always show up within the 2nd to 10th bracket on the list. </p><p>Even Higher placement = Even higher revenue. For example;</p><p>User Searches: ""Getaways""</p><p>Results:  Resort(A)#2</p><p>               Resort (B) #3</p><p>               Resort (C) #4</p><p>               YOUR RESORT (D) #5</p><p>               Resort (E) #6</p><p>               Resort (F) #7</p><p>               Resort (G) #8</p><p>               Resort (H) #9</p><p>               Resort (I) #10</p><p><br/></p><p><b>4. Pledge $10,000 or more</b></p><p>OVERLORD (Merchant) -- 1st Spot</p><p>This is an early-bird placement boost for merchants. Get your venue listing placed even higher in user search results for 1 year (renewable).</p><p>When Subi users conduct a search for a local spot in your city, your venue will always show up as number #1 on the list. </p><p>User Searches: ""Theme Parks in Orlando, Florida""</p><p>Results: YOUR THEME PARK #1</p><p><b>Note to Merchants</b>: Pledging any of the amounts above is a huge ROI (Return of investment). Using the Overlord level pledge of $10,000, our projection analysis states that your business would make that amount back within 2 months via revenue generated from payments received by Subi mobile users.</p><br/><p></p><br/><p></p><p><span style=""line-height: 30px; font-size: x-large; color: rgb(106, 106, 106); font-family: 'Benton Sans', Helvetica, sans-serif;""><b>WHY YOU NEED TO SUPPORT SUBI</b></span><br/></p><p>Subi is bound to revolutionize the way we spend leisure time by giving users the ability to track their activity and redeem rewards from a handful of selected merchants.</p><p></p><p>Please support us, but only if you fulfill ALL of the following criteria:</p><p>A). You're a deal seeker and have used a Groupon (or similar) before. </p><p>B). You enjoy trying new things and sharing your experiences by connecting with others like you.</p><p>C).You're a local business owner -- or knows someone -- that is in need of increasing their venue's exposure in order to gain new followers as well as providing incentives for their current customers.</p><p>D). You're genuinely looking forward to seeing this project come to life.</p><p>If you agree to all things, please help the project succeed by supporting Subi and spreading the word to your friends.</p></div>","What is SubiSubi is essentially a social space for discovering new experiences by trading in old ones. Unlike any loyalty app, Subi connects you with people like yourself who enjoy indulging in their favorite things-to-do, but at the same time appreciate the notion that variety is the spice of life and are open to trying new things.Easy as Counting From 1 to 10Subi does away with the vague point-building system that you find in many loyalty programs where 50,000 points doesn't really mean a lot when you equate the amount to the value of the redeemable reward. Subi is here to enforce radical transparency. In this Subi community, every user is entitled to an exclusive reward when the user purchases a service or item within the app after the 10th time.What makes Subi’s offering unique is based on the number 10. There will be a variety of deals to choose from offered by a selected list of local and online merchants. Our featured Merchants offer specials ranging from: percentage discounts, 2-for-1s or free items in order to bring in new customers like you and also to maintain their relationships with current customers. Here's the sample list of cool things-to-do on SubiCITY TOURSRESTAURANTS NIGHTCLUBS AND BARSVACATION GETAWAYSFITNESSStill wondering How Subi works? Take a look at this scenarioHOW EXACTLY DOES IT WORK? HERE'S AN EXAMPLE;WEEK #1Step 1: Get Tickets to a ConcertStep 2: Book a Car Service to ConcertStep 3: Get Dinner at a fancy Restaurant WEEK #4Step 4: Book a vacation getaway to the BahamasWEEK #7Step 5: Get Tickets to a MuseumWEEK #8Step 6: Get Lunch at a Diner Step 7: Sign up for a Gym MembershipWEEK #10Step 8: Book a 3 Night Stay at a Resort Step 9: Book Car Service from Airport to ResortStep 10: Get Meals for You + Family NOW PICK YOUR REWARDSExample 1: Book a vacation getaway on Subi for 3 nights at Half-off (50% discount).Example 2: Get dinner at one of our restaurants and receive 2 complimentary drinks (Free item).Example 3: Get 2 tickets forprice of 1 for an event (Buy 1 Get 1 Free).EASILY TRACK YOUR PROGRESSThere’s a built-in meter which keeps a track of your progress from 1 - 10 represented on a scale of 0 - 100% in increments of 10% (See pic below).You’ll be on fire -- figuratively speaking -- in no time and your meter lights up in flames indicating you've reach your 10th goal.CONCERTS AND SHOWSStart seeing rewards from doing everyday things you do fast. Redeem your prize and the meter resets to 0%. Start again “clearly” knowing you’ve got ONLY 10 things to do for your next reward. It’s so simple, clear and concise; unlike airline flyer Miles that take years to build 100’s of thousands of points in order to win anything.SUBI WORKS FOR MERCHANTS Subi brings you new customers like ""Groupon"" with the incentives for current customers on ""Foursquare"" combined in one fun to use application. Based on popular research, the 2 biggest complaints from Local Merchants like are (1) attracting new customers and (2) retaining current customers. Trust Subi to solve this issue like nothing else before. Develop lasting relationships with your current and future customers in a variety of ways including;
Get to know your frequent customers and develop new ones
Tracking loyalty points for recent activity.
Processing transactions within the app in real-time 
Create customizable rewards that benefits both loyal and new visitors. 
Reports: number of visits, points earned, rewards redeemed 
Subi caters to a niche market of users who are already in the mindset of building points through loyalty programs. So increase relevant traffic to your venue by backing our project and earn higher placement on our recommendation engine. Register your venue first by choosing one of the merchant-tailored rewards. Your venue will be featured higher on user search results. The amount you pledge today is an early-bird investment that will multiply very fast in measurable revenue.With a whole slew of valuable rewards, there's something for everyone; check our list of rewards and back us today.PERKS FOR MOBILE USERS1. SUPPORT SUBI WITH $10+ EARLY BIRD ACCESS: Receive a shout out + an early bird invitation to try out Subi when we launch; use all of Subi's features in its glory.2. SUPPORT SUBI WITH $25+COMMUNITY MEMBER: Receive a shout out + early bird access + invitation to join our community-driven feed feedback and support team. Provide feedback and suggestions for making Subi even better; recommend your favorite local business to be featured on our venue listing.3. SUPPORT SUBI WITH $250SUBI UBER Level: This level will give you the ability to get rewards twice as fast: in 5 steps. You now receive rewards for every 5th activity + rewards (above) #1 to #3.4. SUPPORT SUBI WITH $400SUBI OOWEE Level: This Level gives you the ability to reach rewards after in 3 steps. You now receive a reward for every 3rd completed activity + rewards (above) #1 to #3. Example: 1st step -- Book a vacation getaway cruise. 2nd step -- Buy concert tickets. 3rd (Reward) -- Book a 3 night stay at hotel and get 1 extra night Free.5. SUPPORT SUBI WITH $1,000SUBI SUPREME Level: This is the ultimate level attainable by a Subi user. You get rewards after completing 1 step + reward (above) #1 to #3 Example: 1st step -- Book a vacation getaway cruise. 2nd (reward) -- Buy 1 concert ticket and get 2nd ticket FreePERKS FOR MERCHANTS1. Pledge $1,150 or moreSPROUT (Merchant) -- 16th to 20th Bracket list. This is an early-bird placement boost for merchants. Get your venue listing placed high in user search results for 3 months (renewable). When Subi users conduct a search for a local spot in your city, your venue will be show up within the 16th to 20th bracket on the list. For example;User Searches: ""Restaurants in Miami"" Results: Restaurant (A) #16 Restaurant (B) #17 YOUR RESTAURANT (C) #18 Restaurant (D) #19 Restaurant (E) #202. Pledge $3,500 or moreSTARTER (Merchant)-- 11th to 15th Bracket list. This is an early-bird placement boost for merchants. Get your venue listing placed higher in user search results for the 6 months (renewable). When Subi users conduct a search for a local spot in your city, your venue will always show up within the 11th to 15th bracket on the list. For example; User Searches: ""Hotels in New York"" Results: Hotel (A) #11 YOUR HOTEL (B) #12 Hotel (C) #13 Hotel (D) #14 Hotel (E) #153. Pledge $5,000 or MorePREMIUM (Merchant) -- 2nd to 10th Bracket.This is an early-bird placement boost for merchants. Get your venue listing placed even higher in user search results for 9 months (renewable).When Subi users conduct a search for a local spot in your city, your venue will always show up within the 2nd to 10th bracket on the list. Even Higher placement = Even higher revenue. For example;User Searches: ""Getaways""Results:  Resort(A)#2               Resort (B) #3               Resort (C) #4               YOUR RESORT (D) #5               Resort (E) #6               Resort (F) #7               Resort (G) #8               Resort (H) #9               Resort (I) #104. Pledge $10,000 or moreOVERLORD (Merchant) -- 1st SpotThis is an early-bird placement boost for merchants. Get your venue listing placed even higher in user search results for 1 year (renewable).When Subi users conduct a search for a local spot in your city, your venue will always show up as number #1 on the list. User Searches: ""Theme Parks in Orlando, Florida""Results: YOUR THEME PARK #1Note to Merchants: Pledging any of the amounts above is a huge ROI (Return of investment). Using the Overlord level pledge of $10,000, our projection analysis states that your business would make that amount back within 2 months via revenue generated from payments received by Subi mobile users.WHY YOU NEED TO SUPPORT SUBISubi is bound to revolutionize the way we spend leisure time by giving users the ability to track their activity and redeem rewards from a handful of selected merchants.Please support us, but only if you fulfill ALL of the following criteria:A). You're a deal seeker and have used a Groupon (or similar) before. B). You enjoy trying new things and sharing your experiences by connecting with others like you.C).You're a local business owner -- or knows someone -- that is in need of increasing their venue's exposure in order to gain new followers as well as providing incentives for their current customers.D). You're genuinely looking forward to seeing this project come to life.If you agree to all things, please help the project succeed by supporting Subi and spreading the word to your friends.",6.0,0,"2 Campaigns
                |","New York, United States",https://www.indiegogo.com/projects/subi-get-rewards-for-exploring-and-sharing-new-experiences/pica
